"File.Name","Date","Notes","Latitude","Longitude","Accuracy","Locality","Country","State","CommonNames","ScientificName","associatedTaxa","Families","Date_YYYYMMDD"
"d704d_d703-006.jpg","7/4/13","9213074310 This is a <b>Pale Swallowtail</b> (<i>Papilio eurymedon</i>) butterfly trying to position itself on a RED flower of an old-fashioned <b>Geranium</b> (really a <i>Pelargonium</i>, family <i>Geraniaceae</i>) in the garden. I'm pretty sure we got this geranium as a cutting from the old ""Casa Vieja"" adobe at Christy Ranch on Santa Cruz Island. It's a real old-fashioned geranium! (San Marcos Pass, 3 July 2013)","34.512815","-119.813557","16","San Marcos Pass","United States","California","Pale Swallowtail; Geranium","Papilio eurymedon; Pelargonium; Geraniaceae","Papilio eurymedon; Pelargonium; Geraniaceae","Geraniaceae","2013-07-04"
"d704e_d703-017.jpg","7/4/13","9210271235 This is looking close at pretty WHITE summer flowers of native <b>California Buckwheat</b> (<i>Eriogonum fasciculatum</i>) in the <i>Polygonaceae</i> plant family. It's one of our most prolific summer flowers, and the red stamens are like little flags up close. (San Marcos Pass, 3 July 2013)","34.512975","-119.812721","16","San Marcos Pass","United States","California","California Buckwheat","Eriogonum fasciculatum",NA,"Polygonaceae","2013-07-04"
"d704f_d704-031.jpg","7/4/13","9210237793 These are fantastic BLUE summer flowers of native <b>Woolly Blue Curls</b> (<i>Trichostema lanatum</i>) in the <i>Lamiaceae</i> plant family. If you look close, you the see a little <b>Wild Bee</b> (<i>Anthophila</i> aka <i>Apoidae</i>, order <i>Hymenoptera</i>) on the flower. It's getting close to the end for these wonderful flowers. (Santa Ynez Mountains, 4 July 2013)","34.512886","-119.812785","16","Santa Ynez Mountains","United States","California","Woolly Blue Curls; Wild Bee","Trichostema lanatum; Lamiaceae; Anthophila; Apoidae; Hymenoptera","Trichostema lanatum; Lamiaceae; Anthophila; Apoidae; Hymenoptera","Lamiaceae; Apoidae","2013-07-04"
"d704g_d704-052.jpg","7/4/13","9210143039 These are fantastic RED flowers of native <b>Scarlet Larkspur</b> (<i>Delphinium cardinale</i>) in the <i>Ranunculaceae</i> plant family in our mountains. These plants have been heavily browsed by deer, but they are still producing a few of the brilliant summer flowers. Maybe they're still flowering <i>because</i> they've been browsed by deer? See <a href=""http://www.flickr.com/photos/treebeard/9140390964/"">this photo (June 25)</a> of what I also thought were the last flowers of the year. (Near Arroyo Burro saddle, Santa Ynez Mountains, 4 July 2013)","34.512762","-119.813042","16","Near Arroyo Burro saddle","United States","California","Scarlet Larkspur","Delphinium cardinale; Ranunculaceae; because","Delphinium cardinale; Ranunculaceae; because","Ranunculaceae","2013-07-04"
"d704h_d704-024.jpg","7/4/13","9212880348 These are new sumer flowers of native <b>Weed's Mariposa Lily</b> (<i>Calochortus weedii</i> var. <i>vestus</i>) - now renamed as <i>C. fimbriata</i> - in the <i>Liliaceae</i> plant family, shot against a sandstone outcrop. I've heard it called the ""<b>Late-flowered Mariposa Lily</b>"" which makes sense. The flowers on the left are mostly WHITE, but the flowers on the right are more magenta. (Santa Ynez Mountains, 4 July 2013) <p>These flowers are individuals, just like you and me. They are all built on the same form, but they are recognizable as individuals with their shape and different amounts of pigment. Maybe all flowers are like this, and we just don't notice.","34.512727","-119.813021","16","Santa Ynez Mountains","United States","California","Weed's Mariposa Lily; Late-flowered Mariposa Lily","Calochortus weedii; vestus; C. fimbriata; Liliaceae","Calochortus weedii; vestus; C. fimbriata; Liliaceae","Liliaceae","2013-07-04"
"d704i_d704-028.jpg","7/4/13","9210047881 Here are new BLUE summer flowers of native <b>Coyote Mint</b> aka <b>White-leaf Monardella</b> (<i>Monardella hypoleuca</i>) in the <i>Lamiaceae</i> plant family. Well, they are mostly blue, there's some magenta. (Santa Ynez Mountains, 4 July 2013) <p>Today's photos are red, white, and blue wildflowers for Independence Day - three times! I got most of the photos today on a drive up East Camino Cielo towards La Cumbre Peak. A fun project.","34.512745","-119.813042","16","Santa Ynez Mountains","United States","California","Coyote Mint; White-leaf Monardella","Monardella hypoleuca; Lamiaceae","Monardella hypoleuca; Lamiaceae","Lamiaceae","2013-07-04"
"d705a_d705-018.jpg","7/5/13","9220077324 I believe this is a <b>Large Milkweed Bug</b> (<i>Oncopeltus fasciatus</i> or kin) in the family <i>Lygaeidae</i> of the old order <i>Hemiptera</i>. It is working new flowers of <b>Narrow-leaved Milkweed</b> (<i>Asclepias fascicularis</i>) in the <i>Asclepiadaceae</i> plant family. These summer flowers are remarkably complex. (San Lucas Ranch, Santa Ynez Valley, 5 July 2013) <p>I had an errand to do in the Santa Ynez Valley this morning, so I wanted to make the best of it with a photo. But it was frustrating trying to photograph this insect today - it was quite windy and the cars zooming by on Highway 154 only made it worse. <p>Just five photos today. Julie and I MIGHT have a date to attend an outdoor screening of Alfred Hitchcock's film <i>Vertigo</i> tonight at the SB courthouse. Then again we might just stay home. Either way, I'll be ready.","34.512709","-119.813042","16","San Lucas Ranch","United States","California","Large Milkweed Bug; Narrow-leaved Milkweed","Oncopeltus fasciatus; Lygaeidae; Hemiptera; Asclepias fascicularis; Asclepiadaceae; Vertigo","Oncopeltus fasciatus; Lygaeidae; Hemiptera; Asclepias fascicularis; Asclepiadaceae; Vertigo","Lygaeidae; Asclepiadaceae","2013-07-05"
"d705b_d705-012.jpg","7/5/13","9220013830 Here is a <b>Honey Bee</b> (<i>Apis mellifera</i>, <i>Hymenoptera</i>) on a perfect ball of intricate new flowers of <b>Narrow-leaved Milkweed</b> (<i>Asclepias fascicularis</i>) in the <i>Asclepiadaceae</i> plant family. The plants are native, but kind of weedy in the Santa Ynez Valley. The summer flowers are remarkably complex, but I'll have to wait for a day that isn't so windy to illustrate just how complex they are. (San Lucas Ranch, Santa Ynez Valley, 5 July 2013)","34.519481","-119.797078","16","San Lucas Ranch","United States","California","Honey Bee; Narrow-leaved Milkweed","Apis mellifera; Hymenoptera; Asclepias fascicularis; Asclepiadaceae","Apis mellifera; Hymenoptera; Asclepias fascicularis; Asclepiadaceae","Asclepiadaceae","2013-07-05"
"d705c_d705-002.jpg","7/5/13","9217214967 I'm not sure, but I guess this is a small <b>Drosophilid Fly</b> in the family <i>Drosophilidae</i> of the order <i>Diptera</i>. It's perched (for a moment) on a leaf of <b>Wild Blackberry</b> (<i>Rubus ursinus</i>) in the <i>Rosaceae</i> plant family. (San Marcos Pass, 5 July 2013)","34.519499","-119.796563","16","San Marcos Pass","United States","California","Drosophilid Fly; Wild Blackberry","Drosophilidae; Diptera; Rubus ursinus; Rosaceae","Drosophilidae; Diptera; Rubus ursinus; Rosaceae","Drosophilidae; Rosaceae","2013-07-05"
"d705d_d704-003.jpg","7/5/13","9219917142 This is the tiny nymph of a <b>Tree Cricket</b> (genus <i>Oecanthus</i> in the family <i>Gryllidae</i> of the order <i>Orthoptera</i>). The adults appear in late-summer and fill the nights with song. This one is resting on a leaf of <b>Wild Blackberry</b> (<i>Rubus ursinus</i>) in the <i>Rosaceae</i> plant family. (San Marcos Pass, 4 July 2013)","34.512745","-119.813042","16","San Marcos Pass","United States","California","Tree Cricket; Wild Blackberry","Oecanthus; Gryllidae; Orthoptera; Rubus ursinus; Rosaceae","Oecanthus; Gryllidae; Orthoptera; Rubus ursinus; Rosaceae","Gryllidae; Rosaceae","2013-07-05"
"d705e_d704-019.jpg","7/5/13","9219884930 Here are the elegant curves of new seeds of the same red-flowered old-fashioned <b>Geranium</b> (really a <i>Pelargonium</i>, family <i>Geraniaceae</i>) in the garden that I showed <a href=""http://www.flickr.com/photos/treebeard/9213074310/"">yesterday</a>. Very graceful. (San Marcos Pass, 4 July 2013)","34.519499","-119.796541","16","San Marcos Pass","United States","California","Geranium","Pelargonium; Geraniaceae","Pelargonium; Geraniaceae","Geraniaceae","2013-07-05"
"d706a_d706-022.jpg","7/6/13","9227879900 This is a remarkable <b>Robber Fly</b> (family <i>Asilidae</i>, order <i>Diptera</i>) perched on a leaf of <b>Bitter Gooseberry</b> (<i>Ribes amarum</i>) in the <i>Grossulariaceae</i> plant family. I guess it's one of the <b>Bee-like Robber Flies</b> in the genus <i>Laphria</i>. These flies are predators that catch their prey on the wing, like dragonflies. Whenever I can make out the <i>ommatidia</i> or ""simple eyes"" that make up the compound eyes of any fly, I'm happy. (San Marcos Pass, 6 July 2013) <p>I didn't plan for today's photos to be all interesting flies, but it happened. <p>We never made it to the outdoor showing of <i>Vertigo</i> last night. Partly it was inertia, but also because TCM was showing the whole cycle of ""Antoine Doinel"" films by FranÁois Truffaut, starting with ""The 400 Blows"" and ending (after midnight) with ""Love On The Run"". I didn't quite make it until the end.","34.512745","-119.813042","16","San Marcos Pass","United States","California","Robber Fly; Bitter Gooseberry; Bee-like Robber Flies","Asilidae; Diptera; Ribes amarum; Grossulariaceae; Laphria; ommatidia; Vertigo","Asilidae; Diptera; Ribes amarum; Grossulariaceae; Laphria; ommatidia; Vertigo","Asilidae; Grossulariaceae","2013-07-06"
"d706b_d706-002.jpg","7/6/13","9227791206 I first thought this different little fly (order <i>Diptera</i>) was a <b>Tachinid Fly</b> in the family <i>Tachinidae</i>, but <a href=""http://www.flickr.com/photos/thijsdegraaf/"">Tjdegraaf</a> informs me that it's genus <i>Metopia</i>, subfamily <i>Miltogramminae</i>, in the family <i>Sarcophagidae</i>. Live and learn. Thanks for the update Tjdegraaf! <p>It is still quite bristly. This one is perched on a leaf of native <b>Wild Blackberry</b> (<i>Rubus ursinus</i>) in the <i>Rosaceae</i> plant family. This fly was hard to photograph - it kept jumping around from leaf to leaf, but finally I got it. It's most recognizable features are its small size and white face. (San Marcos Pass, 6 July 2013) <p>I got many of today's photos at this one place along our driveway that catches early morning light. All the photos taken on wild blackberry were taken here,","34.512727","-119.813042","16","San Marcos Pass","United States","California","Tachinid Fly; Wild Blackberry","Diptera; Tachinidae; Metopia; Miltogramminae; Sarcophagidae; Rubus ursinus; Rosaceae","Diptera; Tachinidae; Metopia; Miltogramminae; Sarcophagidae; Rubus ursinus; Rosaceae","Tachinidae; Sarcophagidae; Rosaceae","2013-07-06"
"d706c_d705-003.jpg","7/6/13","9227737642 I believe this is a bristly <b>Tachinid Fly</b> in the family <i>Tachinidae</i> of the order <i>Diptera</i> - perched for just a moment on a fallen leaf of <b>Coast Live Oak</b> (<i>Quercus agrifolia</i>, <i>Fagaceae</i>) that's caught on a leaf of native <b>Wild Blackberry</b> (<i>Rubus ursinus</i>) in the <i>Rosaceae</i> plant family. (San Marcos Pass, 5 July 2013)","34.512745","-119.813064","16","San Marcos Pass","United States","California","Tachinid Fly; Coast Live Oak; Wild Blackberry","Tachinidae; Diptera; Quercus agrifolia; Fagaceae; Rubus ursinus; Rosaceae","Tachinidae; Diptera; Quercus agrifolia; Fagaceae; Rubus ursinus; Rosaceae","Tachinidae; Fagaceae; Rosaceae","2013-07-06"
"d706d_d706-007.jpg","7/6/13","9227620350 I guess this is a <b>Flesh Fly</b> in the family <i>Sarcophagidae</i> of the order <i>Diptera</i> with those bright red eyes - but I'm not sure. This one is perched on a frond of <b>Western Bracken Fern</b> (<i>Pteridium aquilinum</i> var. <i>pubescens</i>) in the in the <i>Polypodiaceae</i> plant family. It doesn't have the bristles of the tachinid fly in my [Next] photo. (San Marcos Pass, 6 July 2013) <p>I'm never sure with flies. I'm bewildered by the diversity of flies, but I love to photograph them. They have so much structural detail!","34.512745","-119.813042","16","San Marcos Pass","United States","California","Flesh Fly; Western Bracken Fern","Sarcophagidae; Diptera; Pteridium aquilinum; pubescens; Polypodiaceae","Sarcophagidae; Diptera; Pteridium aquilinum; pubescens; Polypodiaceae","Sarcophagidae; Polypodiaceae","2013-07-06"
"d706e_d705-009.jpg","7/6/13","9224803029 This is a different little <b>Bee Fly</b> (family <i>Bombyliidae</i>) in the order <i>Diptera</i> on the native <b>Wild Blackberry</b> (<i>Rubus ursinus</i>) plants in the <i>Rosaceae</i> plant family. It perched for a moment, and then it was gone. I don't know anything else about it. (San Marcos Pass, 5 July 2013)","34.51918","-119.795511","16","San Marcos Pass","United States","California","Bee Fly; Wild Blackberry","Bombyliidae; Diptera; Rubus ursinus; Rosaceae","Bombyliidae; Diptera; Rubus ursinus; Rosaceae","Bombyliidae; Rosaceae","2013-07-06"
"d706f_d706-004.jpg","7/6/13","9224744283 This is a small <b>Bee Fly</b> (family <i>Bombyliidae</i>) in the order <i>Diptera</i> on the native <b>Wild Blackberry</b> (<i>Rubus ursinus</i>) plants in the <i>Rosaceae</i> plant family. I guess they are in mating mode - looking for mates and chasing anything that moves, including my camera! They are hard to photograph, quite camera shy. The flies look black from a distance, but they are quite brown up close like this. (San Marcos Pass, 6 July 2013)","34.519499","-119.796477","16","San Marcos Pass","United States","California","Bee Fly; Wild Blackberry","Bombyliidae; Diptera; Rubus ursinus; Rosaceae","Bombyliidae; Diptera; Rubus ursinus; Rosaceae","Bombyliidae; Rosaceae","2013-07-06"
"d706g_d706-043.jpg","7/6/13","9227483822 I first thought this was a <b>Syrphid Flower Fly</b> (family <i>Syrphidae</i>, order <i>Diptera</i>) resting on a leaf of <b>Coast Live Oak</b> (<i>Quercus agrifolia</i>) in the <i>Fagaceae</i> plant family. But Alice sounds pretty sure it's a <b>Stiletto Fly</b> (<i>Therevidae</i>), and I can see now that the antennae are wrong for a syrphid. So many flies, so little time! The fog came over the mountain pass above us about when I got this photo, and this handsome little fly was grounded by cool weather. (San Marcos Pass, 6 July 2013)","34.512745","-119.813064","16","San Marcos Pass","United States","California","Syrphid Flower Fly; Coast Live Oak; Stiletto Fly","Syrphidae; Diptera; Quercus agrifolia; Fagaceae; Therevidae","Syrphidae; Diptera; Quercus agrifolia; Fagaceae; Therevidae","Syrphidae; Fagaceae; Therevidae","2013-07-06"
"d706h_d706-026.jpg","7/6/13","9227372056 I have no idea what kind of <b>Fly</b> (order <i>Diptera</i>) this is. It's quite tiny. I found it perched on the steel railing over the bridge in our canyon. I believe it's waiting to waiting to hook up with a mate - I did see a pair of them interested in each other. If you have an idea, please let me know. (San Marcos Pass, 6 July 2013) <p>So many flies, so little time! This one does have a <b>Robber Fly</b> (family <i>Asilidae</i>) look with those bristly legs and bulbous ""see everything"" eyes...","34.512727","-119.813064","16","San Marcos Pass","United States","California","Fly; Robber Fly","Diptera; Asilidae","Diptera; Asilidae","Asilidae","2013-07-06"
"d707a_d706-049.jpg","7/7/13","9233892585 This is a rather large (an inch or more) <b>Longhorned Beetle</b> (<i>Cerambycidae</i>) in the order <i>Coleoptera</i>. I found this one in the bathroom, and asked Julie to be my wrangler to release it on the porch. It immediately started moving and climbed up her hand! (San Marcos Pass, 6 July 2013) <p>After browsing at BugGuide, I guess this is a <b>Yellow Douglas Fir Borer</b> (<i>Centrodera spurca</i>) - which is curious, because we don't have any kind of Doug Fir growing within 10 miles. Maybe it likes the <b>Coulter Pines</b> (<i>Pinus coulteri</i>) in the <i>Pinaceae</i> plant family growing up the hill? I've seen these before, on our lamps at night. It's not uncommon. <p>Today was a great day for getting photos - warm and calm winds. But insects are getting scarce in the woods. It's no surprise. It's our second drought year in a row, so there are fewer flowers this summer. That means there are fewer pollinator insects. And that means there are fewer predators of those insects. Ripples in the food web... If we don't get rain next year, it really will have an impact that people won't like.","34.513293","-119.813128","16","<i>Pinus coulteri</i>) in the <i>Pinaceae</i> plant family growing up the hill?  I've seen these before","United States","California","Longhorned Beetle; Yellow Douglas Fir Borer; Coulter Pines","Cerambycidae; Coleoptera; Centrodera spurca; Pinus coulteri; Pinaceae","Cerambycidae; Coleoptera; Centrodera spurca; Pinus coulteri; Pinaceae","Cerambycidae; Pinaceae","2013-07-07"
"d707b_d707-018.jpg","7/7/13","9236513896 My first guess is that this is another <b>Hedgerow Hairstreak</b> (<i>Satyrium saepium</i>) butterfly. My second guess is that it's a <b>Mountain Mahogany Hairstreak</b> (<i>Satyrium tetra</i>) - it does have some ""white frosting"" and white wing borders. Either way, it's perched on a leaf of <b>Scrub Oak</b> (<i>Quercus berberidifolia</i>) in the <i>Fagaceae</i> plant family. The butterflies are disappearing. I guess I should try to document the last butterflies I see as well as the first. (San Marcos Pass, 7 July 2013)","34.512727","-119.813042","16","San Marcos Pass","United States","California","Hedgerow Hairstreak; Mountain Mahogany Hairstreak; Scrub Oak","Satyrium saepium; Satyrium tetra; Quercus berberidifolia; Fagaceae","Satyrium saepium; Satyrium tetra; Quercus berberidifolia; Fagaceae","Fagaceae","2013-07-07"
"d707c_d707-039.jpg","7/7/13","9233613299 I guess this is another <b>Flesh Fly</b> in the family <i>Sarcophagidae</i> of the order <i>Diptera</i> with those red eyes and that red abdomen. They are [nasty/wonderful] (select one)! Personally, I like them. They are large and remarkable sculpted. This one is perched on a leaf of native <b>Poison Oak</b> (<i>Toxicodendron diversilobum</i>) in the <i>Anacardiaceae</i> plant family that is already turning red to drop its leaves in this drought year. (San Marcos Pass, 7 July 2013)","34.512709","-119.813042","16","San Marcos Pass","United States","California","Flesh Fly; Poison Oak","Sarcophagidae; Diptera; Toxicodendron diversilobum; Anacardiaceae","Sarcophagidae; Diptera; Toxicodendron diversilobum; Anacardiaceae","Sarcophagidae; Anacardiaceae","2013-07-07"
"d707d_d707-005.jpg","7/7/13","9233531639 This is a <b>Window Fly</b> aka <b>Black Soldier Fly</b> (<i>Hermetia illucens</i> or kin) in the family <i>Stratiomyidae</i> of the insect order <i>Diptera</i>. It's ""puddling"" - taking moisture - on damp soil in our garden today. It's quite large, nearly an inch long. They have wonderful patterned eyes, unfortunately not very visible here. There is a <a href=""http://blacksoldierflyblog.com/"">Black Soldier Fly Blog</a>! (San Marcos Pass, 7 July 2013)","34.512709","-119.813064","16","San Marcos Pass","United States","California","Window Fly; Black Soldier Fly","Hermetia illucens; Stratiomyidae; Diptera","Hermetia illucens; Stratiomyidae; Diptera","Stratiomyidae","2013-07-07"
"d707e_d707-053.jpg","7/7/13","9233489319 Here are more new galls of the <b>Crystalline Gall Wasp</b> (<i>Andricus crystallinus</i>) in the family <i>Cynipidae</i>, order <i>Hymenoptera</i>, on the underside of leaves of <b>Scrub Oak</b> (<i>Quercus berberidifolia</i>) in the <i>Fagaceae</i> plant family. You can still make out the individual capsules of the galls, but they are starting to grow together. In time, it will look like one mass of red hairs. (San Marcos Pass, 7 July 2013)","34.512798","-119.813514","16","San Marcos Pass","United States","California","Crystalline Gall Wasp; Scrub Oak","Andricus crystallinus; Cynipidae; Hymenoptera; Quercus berberidifolia; Fagaceae","Andricus crystallinus; Cynipidae; Hymenoptera; Quercus berberidifolia; Fagaceae","Cynipidae; Fagaceae","2013-07-07"
"d707f_d707-049.jpg","7/7/13","9233385275 This is a fantastic cluster of new galls of the <b>Crystalline Gall Wasp</b> (<i>Andricus crystallinus</i>) in the family <i>Cynipidae</i>, order <i>Hymenoptera</i>, on the underside of leaves of <b>Scrub Oak</b> (<i>Quercus berberidifolia</i>) in the <i>Fagaceae</i> plant family. This photo shows that the galls are made of individual capsules containing just one gall wasp larvae each. As they mature, the hairs of the capsules become intertwined to make a hairy mass, and the individual capsules become lost. See my [Next] photo. (San Marcos Pass, 7 July 2013)","34.512727","-119.813064","16","San Marcos Pass","United States","California","Crystalline Gall Wasp; Scrub Oak","Andricus crystallinus; Cynipidae; Hymenoptera; Quercus berberidifolia; Fagaceae","Andricus crystallinus; Cynipidae; Hymenoptera; Quercus berberidifolia; Fagaceae","Cynipidae; Fagaceae","2013-07-07"
"d707g_d707-052.jpg","7/7/13","9236123642 This is a handsome new gall of the <b>Spined Turban Gall Wasp</b> (<i>Antron douglasii</i>) in the family <i>Cynipidae</i> of the order <i>Hymenoptera</i> growing on the underside of a leaf of <b>Scrub Oak</b> (<i>Quercus berberidifolia</i>) in the <i>Fagaceae</i> plant family. They are <i>monothalamus</i> (just one wasp larvae inside) and easily <i>detachable</i> (you can break them off). They look like little mushrooms growing from the oak leaf, but they are really the ""nests"" of tiny wasps. These are the first ones I've noticed this year. (San Marcos Pass, 7 July 2013)","34.514601","-119.814308","16","San Marcos Pass","United States","California","Spined Turban Gall Wasp; Scrub Oak","Antron douglasii; Cynipidae; Hymenoptera; Quercus berberidifolia; Fagaceae; monothalamus; detachable","Antron douglasii; Cynipidae; Hymenoptera; Quercus berberidifolia; Fagaceae; monothalamus; detachable","Cynipidae; Fagaceae","2013-07-07"
"d707h_d706-024.jpg","7/7/13","9233214167 Here is a new shroud of web-spinning caterpillars of <b>Variable Checkerspot</b> (<i>Euphydryas chalcedona</i>) butterflies on a flowering branch of <b>Climbing Penstemon</b> (<i>Keckiella cordifolia</i>) in the <i>Scrophulariaceae</i> plant family - now moved to the <b>Plantain Family</b> (<i>Plantaginaceae</i>) for reasons that escape me. If you look close, you can see a few of the caterpillars on the web. They look like tent caterpillars, but they are really next years butterflies, so treat them well! (San Marcos Pass, 6 July 2013) <p>They caterpillars may kill a branch or two of the plants, but they do not do too much damage. They spin their creepy webs on the host plants in the summer. Then they form tough skins and drop to the forest floor to over-winter until they pupate into adults next year. It's a strange cycle, but it works for them. Tents now = butterflies next year!","34.512727","-119.813042","16","San Marcos Pass","United States","California","Variable Checkerspot; Climbing Penstemon; Plantain Family","Euphydryas chalcedona; Keckiella cordifolia; Scrophulariaceae; Plantaginaceae","Euphydryas chalcedona; Keckiella cordifolia; Scrophulariaceae; Plantaginaceae","Scrophulariaceae; Plantaginaceae","2013-07-07"
"d708a_d708-019.jpg","7/8/13","9245357478 This is a remarkable <b>Sand Wasp</b> (genus <i>Steniolia</i>) in the tribe <i>Bembicini</i> of the <i>Apoidea</i> of the <i>Hymenoptera</i> on a flower of (maybe) non-native <b>English Lavender</b> (<i>Lavandula angustifolia</i>) in the <i>Lamiaceae</i> plant family in our garden this morning. (San Marcos Pass, 8 July 2013) <p>They have remarkable goggle-eyes and a long proboscis that's hidden in the flower. See my [Previous] photo to appreciate just how long its proboscis is - long enough to get to the nectar of this flower! These wasps are hard to photograph as they move so fast between the flowers. They seem intelligent, and they don't like being photographed! <p>Today was another beautiful in paradise. I did go to the river today - where it was windy. But all my photos today are from the garden at home.","34.512338","-119.813922","16","San Marcos Pass","United States","California","Sand Wasp; English Lavender","Steniolia; Bembicini; Apoidea; Hymenoptera; Lavandula angustifolia; Lamiaceae","Steniolia; Bembicini; Apoidea; Hymenoptera; Lavandula angustifolia; Lamiaceae","Lamiaceae","2013-07-08"
"d708b_d708-014.jpg","7/8/13","9242430681 Here are two photos of a remarkable <b>Sand Wasp</b> (genus <i>Steniolia</i>) in the tribe <i>Bembicini</i> of the <i>Apoidea</i> of the <i>Hymenoptera</i> on a flower of (maybe) non-native <b>English Lavender</b> (<i>Lavandula angustifolia</i>) in the <i>Lamiaceae</i> plant family in our garden this morning. You can see it's long proboscis in the upper photo, partly inserted into a flower in the lower photo. See my [Next] photo! (San Marcos Pass, 8 July 2013)","34.519269","-119.795898","16","San Marcos Pass","United States","California","Sand Wasp; English Lavender","Steniolia; Bembicini; Apoidea; Hymenoptera; Lavandula angustifolia; Lamiaceae","Steniolia; Bembicini; Apoidea; Hymenoptera; Lavandula angustifolia; Lamiaceae","Lamiaceae","2013-07-08"
