"File.Name","Date","Notes","Latitude","Longitude","Accuracy","Locality","Country","State","CommonNames","ScientificName","associatedTaxa","Families","Date_YYYYMMDD"
"6715a_6715-030.jpg","7/15/06","Interesting native summer flower of <b>Broad-leaved Milkweed</b> (<i>Asclepias eriocarpa</i>) in the <i>Asclepiadaceae</i> family. If the <b>Honey Bees</b> (<i>Apis mellifera</i>) were in charge, they would put a warning label on every one of these flowers. This bee died in the flower's trap! Note how the bee's leg is stuck between the 'hoods"" of the flower. You can see golden ""pollinia"" or pollen sacks on it's rear leg - it's stuck on another one in the flower. Sometimes the bees can crawl away - even if they leave a leg behind. I didn't notice until I got home to my computer, but there's another preditor insect inspecting the prey - look between the bee's rear legs! (Santa Ynez River, 15 July 2006) <P>See my photo about milkweed flower anatomy - not quite complete - at: <BR>&nbsp;&nbsp; http://www.fotolog.com/treebeard/?photo_id=8108247 <P>We hiked up the Santa Ynez River today a few miles past Red Rock to the best swimming hole on the river. It was so hot and the water was perfect. I'm still a little ""sun-sick"". I managed to get a few photos.",NA,NA,NA,"Santa Ynez River","United States","California","Broad-leaved Milkweed; Honey Bees","Asclepias eriocarpa; Asclepiadaceae; Apis mellifera","Asclepias eriocarpa; Asclepiadaceae; Apis mellifera","Asclepiadaceae","2006-07-15"
"6715b_6715-002.jpg","7/15/06","Unusual butterfly on an uncommon native flower of <b>Broad-leaved Milkweed</b> (<i>Asclepias eriocarpa</i>) in the <i>Asclepiadaceae</i> family. The little gray butterfly sure looks like a <b>Hairstreak</b> without a tail. I believe this is a tailless ""<i>Dryope</i>"" member of the <b>Sylvan Butterfly</b> (<i>Satyrium sylvinus</i>) species. It looks like the <b>California Hairstreak</b> (<i>Satyrium californica</i>) butterflies that are common at home, but it has no tail, the orange spot on the hind wing is very small, and the blue spot is barely visible with no orange crown at all. I've been working to learn our local butterflies. It seems the more I learn, the harder it is - that's how it is! (Santa Ynez River, 15 July 2006)",NA,NA,NA,"Santa Ynez River","United States","California","Broad-leaved Milkweed; Hairstreak; Sylvan Butterfly; California Hairstreak","Asclepias eriocarpa; Asclepiadaceae; Dryope; Satyrium sylvinus; Satyrium californica","Asclepias eriocarpa; Asclepiadaceae; Dryope; Satyrium sylvinus; Satyrium californica","Asclepiadaceae","2006-07-15"
"6715c_6715-007.jpg","7/15/06","This unusual butterfly knows the secret entrance to this unusual flower - I learned something today, like I do most every day in the woods with my camera! <P>This little gray butterfly sure looks like a <b>Hairstreak</b> without a tail. I believe this is a tailless ""<i>Dryope</i>"" member of the <b>Sylvan Butterfly</b> (<i>Satyrium sylvinus</i>) clan. Some authorities consider it a new species, but the lepidopterists are such ""splitters""! See my [Next] photo. <P>The uncommon summer flowers are <b>Broad-leaved Milkweed</b> (<i>Asclepias eriocarpa</i>) in the family <i>Asclepiadaceae</i>. It's not common. I only know a few colonies of this plant - here at the river, and in a meadow near home on the pass, and a few more. The flowers have a remarkable complex structure second only to orchids. This butterfly seems to know that the good stuff is inside the ""petals"" - except the real petals are lower on the flower, and these are the ""hoods"" of the ""corona"" - the unique milkweed flower structure above the petals and sepals. I didn't know that the ""hoods"" had this secret passage for insects to find the good stuff. Sometimes bees get stuck on these flowers, but this butterfly knows just what to do. So much to learn! (Santa Ynez River, 15 July 2006) <P>See my photo about milkweed flower anatomy - not quite complete - at: <BR>&nbsp;&nbsp; http://www.fotolog.com/treebeard/?photo_id=8108247",NA,NA,NA,"Santa Ynez River","United States","California","Hairstreak; Sylvan Butterfly; Broad-leaved Milkweed","Dryope; Satyrium sylvinus; Asclepias eriocarpa; Asclepiadaceae","Dryope; Satyrium sylvinus; Asclepias eriocarpa; Asclepiadaceae","Asclepiadaceae","2006-07-15"
"6715d_6715-027.jpg","7/15/06","New flower of native <b>Chaparral Mallow</b> (<i>Malacothamnus fasciculatus</i>) in the <b>Mallow</b> (<i>Malvaceae</i>) family. This gray shrub grows double-overhead and has many small hibiscus-like flowers. It has an odd distribution - common in the Santa Barbara foothills on the ocean side down in the fog-belt, but also here along the upper Santa Ynez River past Red Rock where it's summer hot and dry. (Santa Ynez River, 15 July 2006)",NA,NA,NA,"Santa Ynez River","United States","California","Chaparral Mallow; Mallow","Malacothamnus fasciculatus; Malvaceae","Malacothamnus fasciculatus; Malvaceae","Malvaceae","2006-07-15"
"6715e_6715-029.jpg","7/15/06","New flower head of native <b>Red Thistle</b> aka <b>Cobweb Thistle</b> (<i>Cirsium occidentale</i> - maybe var. <i>venustum</i>? - in the <b>Composite</b> (<i>Asteraceae</i>) family. I had to push through a pure stand of scratchy non-native <b>Italian Thistle</b> (<i>Carduus pycnocephalus</i>) to get this photo. The non-native thistles are bad invasive weeds that we must control - but don't disturb the natives! (Santa Ynez River, 15 July 2006)",NA,NA,NA,"Santa Ynez River","United States","California","Red Thistle; Cobweb Thistle; Composite; Italian Thistle","Cirsium occidentale; venustum; Asteraceae; Carduus pycnocephalus","Cirsium occidentale; venustum; Asteraceae; Carduus pycnocephalus","Asteraceae","2006-07-15"
"6715f_6715-023.jpg","7/15/06","I'm collecting photos of mid-summer flowers in our summer-dry climate. These are new flowers of <b>Creek Clematis</b> aka <b>Yerba de Chivato</b> (<i>Clematis ligusticifolia</i>) in the <b>Buttercup</b> (<i>Ranunculaceae</i>) family. This vine gets huge and grows up into the trees and hangs clusters of small flowers back down near creeks and the river. It's cousin <b>Chaparral Clematis</b> (<i>C. lasiantha</i>) has bigger flowers and fewer leaflets and makes its flowers earlier in the mountains. (Santa Ynez River, 15 July 2006)",NA,NA,NA,"Santa Ynez River","United States","California","Creek Clematis; Yerba de Chivato; Buttercup; Chaparral Clematis","Clematis ligusticifolia; Ranunculaceae; C. lasiantha","Clematis ligusticifolia; Ranunculaceae; C. lasiantha","Ranunculaceae","2006-07-15"
"6716a_6714-181.jpg","7/16/06","This <b>Western Fence Lizard</b> (<i>Sceloporus occidentalis</i>) got caught under the sprinkler in the garden. It's trying to dry off on a rock in the sun - if the darn photographer would just stay away! It's remarkable how colorful these lizards are - like an impressionist painting. (San Marcos Pass, 16 July 2006) <P>It's getting harder every day to get new photos in the woods. Flowers and insects are getting scarce after many weeks of hot weather. Just as well that we're heading off to Oregon in a few days.",NA,NA,NA,"San Marcos Pass","United States","California","Western Fence Lizard","Sceloporus occidentalis","Sceloporus occidentalis",NA,"2006-07-16"
"6716b_6716-036.jpg","7/16/06","Today was hot and windy - a dangerous combination. This <b>Pale Swallowtail</b> (<i>Papilio eurymedon</i>) butterfly is trying to hang on to this flower head of <b>Bull Thistle</b> (<i>Cirsium vulgare</i>) in the canyon. This non-native thistle is cousin to our beautiful native <i>Cirsium</i> thistles that I've been showing in recent photos. It's hard to tell the young plants apart, and the non-native flowers are attractive to butterflies. We work to keep our canyon weed-free. We missed this thistle, but we'll get it before it spreads gazillions of seeds in the canyon. (San Marcos Pass, 16 July 2006) <P>Interesting - I just started thinking of recent immigration issues. Invasive weeds are different - they simplify nature rather than making it more diverse!",NA,NA,NA,"San Marcos Pass","United States","California","Pale Swallowtail; Bull Thistle","Papilio eurymedon; Cirsium vulgare; Cirsium","Papilio eurymedon; Cirsium vulgare; Cirsium",NA,"2006-07-16"
"6716c_6714-195.jpg","7/16/06","Seeds of life - tiny insect egg perched on a bristle of a <b>Coast Live Oak</b> (<i>Quercus agrifolia</i>) leaf. This is about as close as I can get - 1:1 magnification and tight crop - stalk and egg are 3 or 4 mm long. I've seen photos like this in my books that attribute the stalked eggs to <b>Green Lacewings</b> (<i>Chrysopidae</i>) in the order <i>Neuroptera</i>. The rationale is that the insects put the eggs on stalks so the first to hatch won't eat the rest. But this egg is solitary, so I'm not sure. (San Marcos Pass, 14 July 2006) <P>We think of generations, but most insects live from year to year. The changeable weather of any single year could end their legacy here or there if not everywhere. Everything depends on tiny seed like this - lots of them!",NA,NA,NA,"San Marcos Pass","United States","California","Coast Live Oak; Green Lacewings","Quercus agrifolia; Chrysopidae; Neuroptera","Quercus agrifolia; Chrysopidae; Neuroptera","Chrysopidae","2006-07-16"
"6716d_6716-035.jpg","7/16/06","Big green caterpillar and little brown caterpillar sharing a branch of <b>Climbing Penstemon</b> (<i>Keckiella cordifolia</i>) in the <i>Scrophulariaceae</i> family in the canyon. I reckon the size difference is about ""an order of magnitude"" - millimeter vs. centimeter, inch vs. ten feet (close enough) - a power of ten difference. It's interesting to think how we fit into the orders of magnitude of living things from smallest to largest! (San Marcos Pass, 16 July 2006) Try a web search on ""powers of ten"" - http://www.google.com/search?q=powers+of+ten - and have fun exploring. My favorite exploration of this idea is still the original brilliant ""Cosmic View: The Universe in 40 Jumps"" by Kees Boeke (1947). I have the thin book in my library. You can find a copy on the web at: <BR>&nbsp;&nbsp; http://www.vendian.org/mncharity/cosmicview/",NA,NA,NA,"San Marcos Pass","United States","California","Climbing Penstemon","Keckiella cordifolia; Scrophulariaceae","Keckiella cordifolia; Scrophulariaceae","Scrophulariaceae","2006-07-16"
"6716e_6715-017.jpg","7/16/06","Ripe berries of native <b>Basket Bush</b> aka ""<b>Squaw Bush</b>"" (<i>Rhus trilobata</i>) in the <b>Sumac</b> (<i>Anacardiaceae</i>) family near the river. The shrub sure looks like <b>Poison Oak</b> (<i>Toxicodendron diversilobum</i>) with reddish stems and leaves in threes. It's a poison oak relative and look-alike, but the middle leaf does not have a separate stalk; it has berries rather than dry seeds; it has a distinctive ""skunk-like"" smell; and it does not make you itch. The stems were the preferred basket material for the ""warp"" of native American Chumash baskets. The berries are tart and tasty if you ""suck and spit"" - but don't suck too long or you notice the skunk! These fruit by the river are much more colorful than that the berries in the mountains. (Santa Ynez River, 15 July 2006) <P>Homer Simpson said: ""leaves of three, let it be..."" You can scare your friends by casually eating these berries that are NOT poison oak. Suck and spit and enjoy, but don't suck poison oak by mistake!",NA,NA,NA,"Santa Ynez River","United States","California","Basket Bush; Squaw Bush; Sumac; Poison Oak","Rhus trilobata; Anacardiaceae; Toxicodendron diversilobum","Rhus trilobata; Anacardiaceae; Toxicodendron diversilobum","Anacardiaceae","2006-07-16"
"6716f_6715-003.jpg","7/16/06","Another <b>Honey Bee</b> (<i>Apis mellifera</i>) trapped by a flower of native <b>Broad-leaved Milkweed</b> (<i>Asclepias eriocarpa</i>) in the <i>Asclepiadaceae</i> family. Common as they are, honey bees are not native here. These flowers are adapted for heavier bumblebees to get trapped and pull free with a pollen sack attached to their leg. Honey bees can't quite escape. This bee managed to pull free by crawling over the furry leaf. The bee in my [Previous] photo didn't make it. (Santa Ynez River, 15 July 2006)",NA,NA,NA,"Santa Ynez River","United States","California","Honey Bee; Broad-leaved Milkweed","Apis mellifera; Asclepias eriocarpa; Asclepiadaceae","Apis mellifera; Asclepias eriocarpa; Asclepiadaceae","Asclepiadaceae","2006-07-16"
"6717a_6717-079.jpg","7/17/06","Hummingbirds in the garden (1 of 6). <P>Female <b>Anna's Hummingbird</b> (<i>Calypte anna</i>) approaching a flower on a tall <b>Prickley Pear</b> (<i>Opuntia</i> sp.) cactus in the garden. Look close - she's catching some color from the flower! (San Marcos Pass, 17 July 2006) <P>Today's photos are all hummingbirds working flowers in the garden this morning - maybe all the same hummingbird! It was an odd morning - overcast and cool for the first time in weeks. Not many butterflies, so I set up my long lens. We seem to have Anna's, Allen's, and Black-chinned hummers all at once, but this female Anna's chased them all away from HER prime corner of the garden. After every chase, she could come back to her flowers, so I had a chance for many photos.",NA,NA,NA,"San Marcos Pass","United States","California","Anna's Hummingbird; Prickley Pear","Calypte anna; Opuntia","Calypte anna; Opuntia",NA,"2006-07-17"
"6717b_6717-080.jpg","7/17/06","Hummingbirds in the garden (2 of 6). <P>Female <b>Anna's Hummingbird</b> (<i>Calypte anna</i>) going deep into a flower on a tall <b>Prickley Pear</b> (<i>Opuntia</i> sp.) cactus in the garden. Look how she's catching some color reflected from the flower! (San Marcos Pass, 17 July 2006)",NA,NA,NA,"San Marcos Pass","United States","California","Anna's Hummingbird; Prickley Pear","Calypte anna; Opuntia","Calypte anna; Opuntia",NA,"2006-07-17"
"6717c_6717-049.jpg","7/17/06","Hummingbirds in the garden (3 of 6). <P>Female <b>Anna's Hummingbird</b> (<i>Calypte anna</i>) working a flower of hybrid ""<b>Waverly Sage</b>"" (<i>Salvia ""Waverly""</i>) in the garden. Look close and you can see the stamen and pistil of the flower making contact with her bill. More than once, I saw this bird perch in a nearby Bay Laurel tree and wipe her bill on the branch. (San Marcos Pass, 17 July 2006)",NA,NA,NA,"San Marcos Pass","United States","California","Anna's Hummingbird; Waverly Sage","Calypte anna; Salvia ""Waverly","Calypte anna; Salvia ""Waverly",NA,"2006-07-17"
"6717d_6717-075.jpg","7/17/06","Hummingbirds in the garden (4 of 6). <P>Female <b>Anna's Hummingbird</b> (<i>Calypte anna</i>) working a flower of hybrid ""<b>Waverly Sage</b>"" (<i>Salvia ""Waverly""</i>) in the garden. I love the patterns of her wings. (San Marcos Pass, 17 July 2006)",NA,NA,NA,"San Marcos Pass","United States","California","Anna's Hummingbird; Waverly Sage","Calypte anna; Salvia ""Waverly","Calypte anna; Salvia ""Waverly",NA,"2006-07-17"
"6717e_6717-064.jpg","7/17/06","Hummingbirds in the garden (5 of 6). <P>Female <b>Anna's Hummingbird</b> (<i>Calypte anna</i>) working a flower of an unknown <i>Salvia</i> in the garden. The little birds work their wings so fast and sure to manoeuver from flower to flower. (San Marcos Pass, 17 July 2006)",NA,NA,NA,"San Marcos Pass","United States","California","Anna's Hummingbird","Calypte anna; Salvia","Calypte anna; Salvia",NA,"2006-07-17"
"6717f_6717-060.jpg","7/17/06","Hummingbirds in the garden (6 of 6). <P>Female <b>Anna's Hummingbird</b> (<i>Calypte anna</i>) working a flower of an unknown <i>Salvia</i> in the garden. The little birds fly so fast from flower to flower! Sure they are hard to capture. My only ""trick"" is to look where it's going, not where it is - pre-focus on the next flower and sometimes you'll get lucky! (San Marcos Pass, 17 July 2006) <P>I shot all of today's hummingbird photos in the garden this morning. Maybe there's a second trick - spend a lot of time in the garden. They really do get to know you!",NA,NA,NA,"San Marcos Pass","United States","California","Anna's Hummingbird","Calypte anna; Salvia","Calypte anna; Salvia",NA,"2006-07-17"
"6718a_6717-050.jpg","7/18/06","Perfect female <b>Anna's Hummingbird</b> (<i>Calypte anna</i>) working a flower of hybrid ""<b>Waverly Sage</b>"" (<i>Salvia ""Waverly""</i>) in the garden. (San Marcos Pass, 17 July 2006) <P>Shihiro - http://www.fotolog.com/shihiro/ - says ""The humingbird is wonderful omen of ""Good Luck"" and beauty that is coming forth, in our culture - Dineh or Navajo."" I reckon this photo a good omen for our trip to Oregon to visit kids and parents. No photos for a couple of weeks, but I look forward to chasing butterflies with my camera in the Cascade Mountain meadows. I'm sure I'll return with a few photos to share!",NA,NA,NA,"San Marcos Pass","United States","California","Anna's Hummingbird; Waverly Sage","Calypte anna; Salvia ""Waverly","Calypte anna; Salvia ""Waverly",NA,"2006-07-18"
"6718b_6717-051.jpg","7/18/06","I guess this is a <b>Fox Sparrow</b> (<i>Passerellia iliaca</i>) come to visit our garden - probably the <b>Thick-billed (California)</b> subspecies. It lives up to its name. It's visiting the ""bird-bath"" - just an old saucer - that we keep in the garden to catch water from the sprinkler for the birds. I don't think I've ever noticed this bird in the woods. This is like netting a creature from deep in the ocean. There it is, but there are so many questions! (San Marcos Pass, 17 July 2006)",NA,NA,NA,"San Marcos Pass","United States","California","Fox Sparrow; Thick-billed (California)","Passerellia iliaca","Passerellia iliaca",NA,"2006-07-18"
"6718c_6717-071.jpg","7/18/06","You won't find this critter in any of your books, but I'm sure it's an immature <b>Rufous-sided Towhee</b> (<i>Pipilo erythrophthalmus</i>) bird scratching in the garden. It's the right size and shape, it has a white border on its tail wings, hints of deeper color in the right places, and it moves just like a Towhee. (San Marcos Pass, 17 July 2006) <P>Compare my photo of the adult at: <BR>&nbsp;&nbsp; http://www.fotolog.com/treebeard/?pid=13578865",NA,NA,NA,"San Marcos Pass","United States","California","Rufous-sided Towhee","Pipilo erythrophthalmus","Pipilo erythrophthalmus",NA,"2006-07-18"
"6718d_6714-212.jpg","7/18/06","<b>Lesser Goldfinch</b> (<i>Carduelis psaltria</i>) bird - I believe - munching new seeds of native <b>Canyon Sunflower</b> (<i>Venegasia carpesioides</i>) on the edge of the garden. (San Marcos Pass, 18 July 2006)",NA,NA,NA,"San Marcos Pass","United States","California","Lesser Goldfinch; Canyon Sunflower","Carduelis psaltria; Venegasia carpesioides","Carduelis psaltria; Venegasia carpesioides",NA,"2006-07-18"
"6718e_6717-054.jpg","7/18/06","A little flock of crested <b>Oak Titmouse</b> (<i>Baeolophus inoratus</i>) - aka ""Plain Titmouse"" - birds flew through the garden this morning. Are they ""titmouses"" or titmice""? I got the photo, and a moment later they were gone. I'm good with flowers and mushrooms and butterflies, but I usually look down not up. I haven't noticed these little birds in the woods for awhile. (San Marcos Pass, 17 July 2006)",NA,NA,NA,"San Marcos Pass","United States","California","Oak Titmouse","Baeolophus inoratus","Baeolophus inoratus",NA,"2006-07-18"
"6718f_6718-089.jpg","7/18/06","I captured the other hummingbird! Compare my [Previous] photos. I believe this is a female <b>Allen's Hummingbird</b> (<i>Selasphorus sasin</i>) visiting one of the last flowers of non-native <i>Salvia greggii</i>) in the garden. Hard to get this photo because the female <b>Anna's Hummingbird</b> (<i>Calypte anna</i>) has been chasing her of the garden. This morning, the Allen's hummer seems to have the upper hand. She has more ""rufous"" red-brown colors on her body. (San Marcos Pass, 18 July 2006) <P>With time - another life - I'd like to photograph the hummers every day and plot their territories!",NA,NA,NA,"San Marcos Pass","United States","California","Allen's Hummingbird; Anna's Hummingbird","Selasphorus sasin; Salvia greggii; Calypte anna","Selasphorus sasin; Salvia greggii; Calypte anna",NA,"2006-07-18"
"6801a_6726-136.jpg","8/1/06","<b>Clodius Parnassian</b> (<i>Parnassius clodius</i>) butterfly embracing a flower head of <b>Nettleleaf Giant Hyssop</b> (<i>Agastache urticifolia</i>) in the <b>Mint</b> (<i>Lamiaceae</i>) family. This butterfly is in the <b>Swallowtail</b> (<i>Papilioidae</i>) family, though you wouldn't know by looking at it. It has beautiful translucent forewings. My book says that after mating, the males place a waxy cap - called a <i>sphragis</i> - over the females' abdomen to prevent other males from mating, kind of a ""chastity belt"". I guess that's the white thing in the lower-left of the photo at the end of her abdomen. It's not all free love in nature! I got this photo high on the mountain divide between Steamboat Creak and Boulder Creek. (North Umpqua River, Oregon, 26 July 2006) <P>We just got back today from two weeks in Oregon. I'm still sorting out my photos and ready to take more!",NA,NA,NA,"North Umpqua River","United States","California","Clodius Parnassian; Nettleleaf Giant Hyssop; Mint; Swallowtail","Parnassius clodius; Agastache urticifolia; Lamiaceae; Papilioidae; sphragis","Parnassius clodius; Agastache urticifolia; Lamiaceae; Papilioidae; sphragis","Lamiaceae; Papilioidae","2006-08-01"
"6802a_6724-076.jpg","8/2/06","I love the name of this large butterfly - it's a male <b>Great Spangled Fritillary</b> (<i>Speyeria cybele</i>). The ""white"" spots look like silver when the sun is right. The female looks very different - compare my [Previous] photo. I took both photos near Twin Lakes. (North Umpqua River, Oregon, 24 July 2006) <P>The pretty flower is an alien weed that is taking over the mountain meadows in Oregon - <b>Spotted Knapweed</b> (<i>Centaurea maculosa</i>) or maybe the hybrid <b>Meadow Thistle</b> (<i>Centaurea</i> x <i>pratensis</i>). We drove home along the Klamath River in California heading to Arcata. Interesting that the spiny <b>Yellow Star Thistle</b> (<i>Centaurea solstitialis</i>) and <b>Fennel</b> (<i>Foeniculum vulgare</i>) take over. <P>We just got back from two weeks in Oregon ""walking in the tall trees"" - family time, fix the water system, go for a hike - I found some time to photograph butterflies and other small critters in the woods.",NA,NA,NA,"<i>Foeniculum vulgare</i>) take over.  <P>We just got back from two weeks in Oregon ""walking in the tall trees"" - family time","United States","California","Great Spangled Fritillary; Spotted Knapweed; Meadow Thistle; Yellow Star Thistle; Fennel","Speyeria cybele; Centaurea maculosa; Centaurea; pratensis; Centaurea solstitialis; Foeniculum vulgare","Speyeria cybele; Centaurea maculosa; Centaurea; pratensis; Centaurea solstitialis; Foeniculum vulgare",NA,"2006-08-02"
"6802b_6723-070.jpg","8/2/06","Female <b>Great Spangled Fritillary</b> (<i>Speyeria cybele</i>) butterfly working a composite flower head of <b>Canada Thistle</b> (<i>Cirsium arvense</i>) in the Oregon woods near Twin Lakes high in the mountains. These butterflies are sexually dimorphic - the females are mostly black like this, and the males are mostly orange. Compare my [Next] photo. The plant is an invasive weed, but the butterflies like it, it's not spiny like the thistles at home, and it doesn't seem to be taking over the meadows - yet! (North Umpqua River, Oregon, 23 July 2006)",NA,NA,NA,"North Umpqua River","United States","California","Great Spangled Fritillary; Canada Thistle","Speyeria cybele; Cirsium arvense","Speyeria cybele; Cirsium arvense",NA,"2006-08-02"
"6802c_6723-026.jpg","8/2/06","The Oregon mountain meadows are full of fritillaries! I believe this butterfly is an <b>Atlantis Fritillary</b> (<i>Speyeria atlantis</i>). The pretty flower is an alien weed that is taking over the mountain meadows - <b>Spotted Kapweed</b> (<i>Centaurea maculosa</i>) or maybe the hybrid <b>Meadow Thistle</b> (<i>Centaurea </i> x <i>pratensis</i>). This <i>Centaurea</i> isn't spiney like our <b>Yellow Star Thistle</b> (<i>Centaurea solstitialis</i>) - and the butterflies like it - but it is taking over whole meadows along the road to Twin Lakes where I got this photo. (North Umpqua River, Oregon, 23 July 2006)",NA,NA,NA,"North Umpqua River","United States","California","Atlantis Fritillary; Spotted Kapweed; Meadow Thistle; Yellow Star Thistle","Speyeria atlantis; Centaurea maculosa; Centaurea ; pratensis; Centaurea; Centaurea solstitialis","Speyeria atlantis; Centaurea maculosa; Centaurea ; pratensis; Centaurea; Centaurea solstitialis",NA,"2006-08-02"
"6802d_6726-145.jpg","8/2/06","I believe this butterfly is a <b>Hoffmann's Checkerspot</b> (<i>Chlosyne hoffmanni</i>). It's ""puddling"" - sucking moisture and salts - from the same wet seep as the <b>Variable Checkerspot</b> (<i>Euphydryas chalcedona</i>) in my [Previous] photo. If you compare the photos, you can see that they are different. For one thing, this butterfly has dark antennae rather than golden like the other one. I sure can't remember all the color patterns in the field! ""Shoot them all"" (photos of course) and then sort them out! This is high on the mountain divide between Steamboat Creek and Boulder Creek. (North Umpqua River, Oregon, 26 July 2006)",NA,NA,NA,"North Umpqua River","United States","California","Hoffmann's Checkerspot; Variable Checkerspot","Chlosyne hoffmanni; Euphydryas chalcedona","Chlosyne hoffmanni; Euphydryas chalcedona",NA,"2006-08-02"
