"File.Name","Date","Notes","Latitude","Longitude","Accuracy","Locality","Country","State","CommonNames","ScientificName","associatedTaxa","Families","Date_YYYYMMDD"
"3b05a_3b03-230.jpg","11/5/03","There's a small universe of life on this <b>Chamise</b> (<i>Adenostoma fasciculatum</i>) twig in the chaparral near Lake Cachuma. Lichens are a symbiotic partnership between fungi and algae, but only the <i>Ascomycete</i> fungal partners make these pretty fruiting bodies, encouraged by our recent first rain of the season. (Santa Ynez Valley, 2 November 2003)",NA,NA,NA,"Santa Ynez Valley","United States","California","Chamise","Adenostoma fasciculatum; Ascomycete","Adenostoma fasciculatum; Ascomycete",NA,"2003-11-05"
"3b05b_3b03-212.jpg","11/5/03","Pretty insect gall on the underside of a <b>Scrub Oak</b> (<i>Quercus berberidifolia</i>) leaf. I believe these are caused by the <b>Crystalline Gall Wasp</b> (<i>Andricus chrystallinus</i>). These tumor-like growths are caused by tiny specialized <b>Gall Wasps</b> (<i>Cynipidae</i>) that lay eggs that are nutured by the abnormal growth they initiate. (Santa Ynez Valley, 2 November 2003)",NA,NA,NA,"Santa Ynez Valley","United States","California","Scrub Oak; Crystalline Gall Wasp; Gall Wasps","Quercus berberidifolia; Andricus chrystallinus; Cynipidae","Quercus berberidifolia; Andricus chrystallinus; Cynipidae","Cynipidae","2003-11-05"
"3b05c_3b03-216.jpg","11/5/03","<b>Scrub Oak</b> (<i>Quercus berberidifolia</i>) stump-sprouting after a small wildfire two years ago. There is life after fire, our native chaparral plants are adapted for it. (Santa Ynez Valley, 2 November 2003)",NA,NA,NA,"Santa Ynez Valley","United States","California","Scrub Oak","Quercus berberidifolia","Quercus berberidifolia",NA,"2003-11-05"
"3b06a_3b03-263.jpg","11/6/03","Dandelion-like seeds of <b>Coyote Bush</b> (<i>Baccharis pilularis</i> var. <i>consanguinea</i>) take to the wind. (Santa Ynez Valley, 5 November 2003) These are seeds not flowers, but I still think of this quote from Anais Nin: ""It takes courage to push yourself to places that you have never been before... to test your limits... to break through barriers. And the day came when the risk it took to remain tight inside the bud was more painful than the risk it took to blossom.",NA,NA,NA,"Santa Ynez Valley","United States","California","Coyote Bush","Baccharis   pilularis; consanguinea","Baccharis   pilularis; consanguinea",NA,"2003-11-06"
"3b06b_3b03-261.jpg","11/6/03","Dandelion-like seeds of <b>Coyote Bush</b> (<i>Baccharis pilularis</i> var. <i>consanguinea</i>) about to take to the wind. (Santa Ynez Valley, 5 November 2003)",NA,NA,NA,"Santa Ynez Valley","United States","California","Coyote Bush","Baccharis   pilularis; consanguinea","Baccharis   pilularis; consanguinea",NA,"2003-11-06"
"3b06c_3b03-258.jpg","11/6/03","White Flowers of <b>Coyote Bush</b> (<i>Baccharis pilularis</i> var. <i>consanguinea</i>) bursting into seed. It looks like a snowman with the sun behind. (Santa Ynez Valley, 5 November 2003)",NA,NA,NA,"Santa Ynez Valley","United States","California","Coyote Bush","Baccharis pilularis; consanguinea","Baccharis pilularis; consanguinea",NA,"2003-11-06"
"3b06d_3b03-232.jpg","11/6/03","White Flowers of a female <b>Coyote Bush</b> (<i>Baccharis pilularis</i> var. <i>consanguinea</i>). Those tufts of white hairs that make up the flowers will become the wings of the dandelion-like seeds that will soon emerge. This native composite shrub grows in waste places and is often dismissed as a weed. Coyote Bush one of my humble favorites. It flowers at an unlikely time and supports much life. (Santa Ynez Valley, 3 November 2003)",NA,NA,NA,"Santa Ynez Valley","United States","California","Coyote Bush","Baccharis pilularis; consanguinea","Baccharis pilularis; consanguinea",NA,"2003-11-06"
"3b07a_3b06-308.jpg","11/7/03","Reflections of <b>Bigleaf Maple</b> (<i>Acer macrophylum</i>) leaves in a small pool up the creek behind Cold Springs Tavern. It was very dark in the canyon this afternoon, but this photo managed to find light and focus from above. (San Marcos Pass, 6 November 2003)",NA,NA,NA,"San Marcos Pass","United States","California","Bigleaf Maple","Acer macrophylum","Acer macrophylum",NA,"2003-11-07"
"3b07b_3b07-378.jpg","11/7/03","This is my view driving home from school. The late afternoon light today was especially beautiful and worth a stop. Note the long shadows of the oak trees. This is looking north towards Cachuma Saddle and the Santa Barbara backcountry. (Santa Ynez Valley, 7 November 2003)",NA,NA,NA,"Santa Ynez Valley","United States","California",NA,NA,NA,NA,"2003-11-07"
"3b07c_3b07-380.jpg","11/7/03","Clouds building over Lake Cachuma (really a reservoir) and the distant Solomon hills to the west. The late afternoon light today was very beautiful and worth a stop. (Santa Ynez Valley, 7 November 2003)",NA,NA,NA,"Santa Ynez Valley","United States","California",NA,NA,NA,NA,"2003-11-07"
"3b08a_3b08-061.jpg","11/8/03","These new flowers on <b>Chaparral Currant</b> (<i>Ribes malvaceum</i>) first appeared today, a week after our first rain of the season. How do they know? It was dark and drizzly when I took this photo without flash. Image quality aside, this is important because it`s the very first wildflower of the new season that I`ve seen. May there be many more! (San Marcos Pass, 8 November 2003)",NA,NA,NA,"San Marcos Pass","United States","California","Chaparral Currant","Ribes malvaceum","Ribes malvaceum",NA,"2003-11-08"
"3b08b_3b08-014.jpg","11/8/03","LBMs (""Little Brown Mushrooms"") growing on oak wood chips at our house. They are probably some species of <i>Mycena</i>. Note how the tiny 'shrooms are glued together by raindrops. (San Marcos Pass, 8 November 2003)",NA,NA,NA,"San Marcos Pass","United States","California",NA,"Mycena","Mycena",NA,"2003-11-08"
"3b08c_3b08-044.jpg","11/8/03","Water drops and tendrils on <b>Wild Sweetpea</b> (<i>Lathyrus vestitus</i>. It was drizzling today when I took these photos - and now it's raining - but only a few plants catch the raindrops like this one. (San Marcos Pass, 8 November 2003)",NA,NA,NA,"San Marcos Pass","United States","California","Wild Sweetpea","Lathyrus vestitus","Lathyrus vestitus",NA,"2003-11-08"
"3b08d_3b08-051.jpg","11/8/03","The last berries on <b>California Honeysuckle</b> (<i>Lonicera hispidula</i>). The distinctive upper leaves are <i>connate</i> and grow together around the stem. (San Marcos Pass, 8 November 2003)",NA,NA,NA,"San Marcos Pass","United States","California","California Honeysuckle","Lonicera hispidula; connate","Lonicera hispidula; connate",NA,"2003-11-08"
"3b08e_3b08-035.jpg","11/8/03","<b>Western Sycamore</b> (<i>Platanus racemosa</i>), <b>Coast Live Oak</b> (<i>Quercus agrifolia</i>), and <b>California Bay</b> (<i>Umbellularia californica</i>) leaves on sandstone along our creek. Even the rock is turning color after recent rain. (San Marcos Pass, 8 November 2003)",NA,NA,NA,"San Marcos Pass","United States","California","Western Sycamore; Coast Live Oak; California Bay","Platanus racemosa; Quercus agrifolia; Umbellularia californica","Platanus racemosa; Quercus agrifolia; Umbellularia californica",NA,"2003-11-08"
"3b08f_3b08-025.jpg","11/8/03","<b>Coast Live Oak</b> (<i>Quercus agrifolia</i>) leaves floating and soaking in a little pool of tea-colored water on our mostly-dry creek. We had our first rain a week ago, and these leaves have been steeping in rain water since then. The brown color is tannic acid leaching from the leaves - just like real tea. (San Marcos Pass, 8 November 2003)",NA,NA,NA,"San Marcos Pass","United States","California","Coast Live Oak","Quercus agrifolia","Quercus agrifolia",NA,"2003-11-08"
"3b08g_3b08-014.jpg","11/8/03","<b>Dead Man's Foot</b> (<i>Pisolithus tinctorius</i>) is such a perfect name for this interesting mushroom growing up through the hard edge of our road. Sometimes they come up through the road! The species name ""<i>tinctorus</i>"" refers to its use as a dye for colors ranging from gold to blue depending on the mordant. (San Marcos Pass, 8 November 2003)",NA,NA,NA,"San Marcos Pass","United States","California","Dead Man's Foot","Pisolithus tinctorius; tinctorus","Pisolithus tinctorius; tinctorus",NA,"2003-11-08"
"3b08h_3b08-020.jpg","11/8/03","LBMs (""Little Brown Mushrooms"") growing on oak wood chips at our house. They are probably some species of <i>Mycena</i>. Note how the tiny 'shrooms are glued together by raindrops. (San Marcos Pass, 8 November 2003)",NA,NA,NA,"San Marcos Pass","United States","California",NA,"Mycena","Mycena",NA,"2003-11-08"
"3b09a_3b09-063.jpg","11/9/03","This old leaf of Bitter Gooseberry (Ribes amarum) is about to go. It looks like someone used a marker to circle the defects. Keep him away from me! (San Marcos Pass, 9 November 2003)",NA,NA,NA,"San Marcos Pass","United States","California",NA,NA,NA,NA,"2003-11-09"
"3b09b_3b09-067.jpg","11/9/03","<b>Madrone</b> (<i>Arbutus menziesii</i>) leaf ensnared by a tendril of <b>Wild Sweetpea</b> (<i>Lathyrus vestitus</i>. Which one brought it down? (San Marcos Pass, 9 November 2003)",NA,NA,NA,"San Marcos Pass","United States","California","Madrone; Wild Sweetpea","Arbutus menziesii; Lathyrus vestitus","Arbutus menziesii; Lathyrus vestitus",NA,"2003-11-09"
"3b09c_3b09-070.jpg","11/9/03","These pretty flowers of the composite <b>Cudweed-Aster</b> (<i>Lessingia filaginifolia</i> are some of our last summer flowers. A new generation of flowers is starting with the recent rain. (San Marcos Pass, 9 November 2003)",NA,NA,NA,"San Marcos Pass","United States","California","Cudweed-Aster","Lessingia filaginifolia","Lessingia filaginifolia",NA,"2003-11-09"
"3b09d_3b08-041.jpg","11/9/03","Raindrops on <b>Wild Blackberry</b> (<i>Rubus ursinus</i>) growing over sandstone in our mostly dry creek. (San Marcos Pass, 8 November 2003)",NA,NA,NA,"San Marcos Pass","United States","California","Wild Blackberry","Rubus ursinus","Rubus ursinus",NA,"2003-11-09"
"3b09e_3b08-046.jpg","11/9/03","Water drops and tendrils on <b>Wild Sweetpea</b> (<i>Lathyrus vestitus</i>). It was drizzling today when I took these photos - and now it's raining - but only a few plants catch the raindrops like this one. (San Marcos Pass, 8 November 2003)",NA,NA,NA,"San Marcos Pass","United States","California","Wild Sweetpea","Lathyrus vestitus","Lathyrus vestitus",NA,"2003-11-09"
"3b09f_3b08-004.jpg","11/9/03","<b>Dead Man's Foot</b> (<i>Pisolithus tinctorius</i>) is such a perfect name for this interesting mushroom growing up through the hard gravel in our driveway. The fruiting body is made up of thousands of lentil-like chambers (<i>peridioles</i>) that are starting to break up here to release spores. You can see some color if you look close. The species name ""<i>tinctorus</i>"" refers to its use as a dye for colors ranging from gold to dark blue depending on the mordant. (San Marcos Pass, 8 November 2003)",NA,NA,NA,"San Marcos Pass","United States","California","Dead Man's Foot","Pisolithus tinctorius; peridioles; tinctorus","Pisolithus tinctorius; peridioles; tinctorus",NA,"2003-11-09"
"3b10a_3b10-104.jpg","11/10/03","Leaves of <b>Western Sycamore</b> (<i>Platanus racemosa</i>) starting to turn color. (Santa Ynez River, 10 November 2003)",NA,NA,NA,"Santa Ynez River","United States","California","Western Sycamore","Platanus racemosa","Platanus racemosa",NA,"2003-11-10"
"3b10b_3b10-091.jpg","11/10/03","Leaves on <b>Fremont Cottonwood</b> (<i>Populus fremontii</i>) starting to turn color. The way they dance in the wind is even better. (Santa Ynez River, 10 November 2003)",NA,NA,NA,"Santa Ynez River","United States","California","Fremont Cottonwood","Populus fremontii","Populus fremontii",NA,"2003-11-10"
"3b10c_3b10-106.jpg","11/10/03","Corkscrew seedpods on <b>Spanish Broom</b> (<i>Spartium junceum</i>). Many plants in the pea family (<i>Fabaceae</i>) twist like this to squeeze out the seeds. This shrub has pretty flowers and interesting seed pods, but it`s a dangerous invasive weed. (Santa Ynez River, 10 November 2003)",NA,NA,NA,"Santa Ynez River","United States","California","Spanish Broom","Spartium junceum; Fabaceae","Spartium junceum; Fabaceae","Fabaceae","2003-11-10"
"3b10d_3b10-077.jpg","11/10/03","Ripe gourd of Calabazilla (Cucurbita foetidissima). The species name tells how it tastes. The orange-size gourds were used by Chumash native Americans for soap, tools, and rattles. It`s not common. This colony near Paradise Camp is huge, covering 1/2 acre or more. I wonder if it goes back to the old days. (Santa Ynez River, 10 November 2003)",NA,NA,NA,"Santa Ynez River","United States","California",NA,NA,NA,NA,"2003-11-10"
"3b10e_3b10-100.jpg","11/10/03","I found this dead crawdad is a small pool along our drying up river. It really is an ""organic soup""! (Santa Ynez River, 10 November 2003)",NA,NA,NA,"Santa Ynez River","United States","California",NA,NA,NA,NA,"2003-11-10"
"3b10f_3b10-101.jpg","11/10/03","Odd geometry of <b>green algae</b> in an almost-dry pool on the river. Why does it curl up in this pattern? (Santa Ynez River, 10 November 2003)",NA,NA,NA,"Santa Ynez River","United States","California","green algae",NA,NA,NA,"2003-11-10"
"3b11a_3b11-121.jpg","11/11/03","We had dramatic clouds at school today, with ""God light"" - aka ""crepuscular rays"". I have a stumper about this phenomenon at http://www.rain.org/~mkummel/stumpers/24jan03.html. The real stumper is how to photograph these sunbeams. I took lots of pictures trying different combinations. For this photo (I think) I spot-metered off the sunbeams, and lowered the exposure two full stops. (Santa Ynez Valley, 11 November 2003)",NA,NA,NA,"Santa Ynez Valley","United States","California",NA,NA,NA,NA,"2003-11-11"
"3b12a_3b12-196.jpg","11/12/03","We had more dramatic weather today, beautiful clouds with lightning and some rain. What struck me is the fractal similarity between the clouds and the trees in front. (Santa Ynez Valley, 12 November 2003)",NA,NA,NA,"Santa Ynez Valley","United States","California",NA,NA,NA,NA,"2003-11-12"
"3b13a_3b13-243.jpg","11/13/03","The ruins of Knapp's Castle and the Santa Ynez Valley beyond. ""The castle"" is the ruin of a mountain mansion that was destroyed by a wildfire in the 1930s. Only stone walls and chimneys remain. We had great views today after the dramatic weather and rain this week! (San Marcos Pass, 13 November 2003)",NA,NA,NA,"San Marcos Pass","United States","California",NA,NA,NA,NA,"2003-11-13"
"3b13b_3b13-224.jpg","11/13/03","Spiny branches of <b>Fuschia-flowered Gooseberry</b> (<i>Ribes speciosum</i>) in the rich afternoon light today. You can see next year's buds forming in the axils (""upper armpits"") of the spines. (San Marcos Pass, 13 November 2003)",NA,NA,NA,"San Marcos Pass","United States","California","Fuschia-flowered Gooseberry","Ribes speciosum","Ribes speciosum",NA,"2003-11-13"
"3b13c_3b13-270.jpg","11/13/03","<b>Smilo Grass</b> (<i>Piptatherum miliaceum</i>) flowers blowing in the wind - and probably spreading seeds too. It's a pretty introduced grass with a native ""look"" to it, but it's an invasive weed that's becoming all too common in the backcountry. (San Marcos Pass, 13 November 2003)",NA,NA,NA,"San Marcos Pass","United States","California","Smilo Grass","Piptatherum miliaceum","Piptatherum miliaceum",NA,"2003-11-13"
"3b14a_3b14-348.jpg","11/14/03","Ripening berries of <b>Toyon</b> or <b>Christmas Berry</b> (<i>Heteromeles arbutifolia</i>) caught in the perfect light. This shrub is the ""California Holly"" that is the namesake for Hollywood. The late afternoon sun is coming from the left under a bank of storm clouds, and there are more dark clouds behind. This is straight from my camera. I tried adjusting color and contrast, but this is best. I have a stumper about ""the perfect light"" on my Stumper page at http://www.rain.org/~mkummel/stumpers/08feb02.html (San Marcos Pass, 14 November 2003)",NA,NA,NA,"San Marcos Pass","United States","California","Toyon; Christmas Berry","Heteromeles arbutifolia","Heteromeles arbutifolia",NA,"2003-11-14"
"3b14b_3b14-355.jpg","11/14/03","Trunk of native <b>Coulter Pine</b> (<i>Pinus coulteri</i>) with yellow lichens and exuding sap. (San Marcos Pass, 14 November 2003)",NA,NA,NA,"San Marcos Pass","United States","California","Coulter Pine","Pinus coulteri","Pinus coulteri",NA,"2003-11-14"
"3b14c_3b14-342.jpg","11/14/03","Ripe seed heads of <b>Black Sage</b> (<i>Salvia mellifera</i>) in the late afternoon light. (San Marcos Pass, 14 November 2003)",NA,NA,NA,"San Marcos Pass","United States","California","Black Sage","Salvia mellifera","Salvia mellifera",NA,"2003-11-14"
"3b14d_3b14-329.jpg","11/14/03","Looking west past a native <b>Coulter Pine</b> (<i>Pinus coulteri</i>) towards ridge after ridge of the Santa Ynez Mountains late in the afternoon. I live down below that first ridge. (San Marcos Pass, 14 November 2003)",NA,NA,NA,"San Marcos Pass","United States","California","Coulter Pine","Pinus coulteri","Pinus coulteri",NA,"2003-11-14"
"3b15a_3b15-019.jpg","11/15/03","This seed pod of <b>Humboldt Lily</b> (<i>Lilium humboldtii</i> ssp. <i>ocellatum</i>) along the creek is full of wafer-like seeds. Note how the seeds are held in place by that elegant fiber net between the segments of the pod. (San Marcos Pass, 15 November 2003)",NA,NA,NA,"San Marcos Pass","United States","California","Humboldt Lily","Lilium humboldtii; ocellatum","Lilium humboldtii; ocellatum",NA,"2003-11-15"
"3b15b_3b15-002.jpg","11/15/03","LBM (""Little Brown Mushroom"") growing on wood chips in the garden with <b>Wood Mint</b> (<i>Stachys bullata</i>). It is probably some species of <i>Mycena</i>. (San Marcos Pass, 15 November 2003)",NA,NA,NA,"San Marcos Pass","United States","California","Wood Mint","Stachys bullata; Mycena","Stachys bullata; Mycena",NA,"2003-11-15"
"3b15c_3b15-015.jpg","11/15/03","Jaws! I think these are <b>Gilled Polypore</b> (<i>Lenzites betulina</i>) mushrooms growing on a dead <b>Coast Live Oak</b> (<i>Quercus agrifolia</i>) and engulfing an oak leaf from each side. This shows how fast everything is changing in the woods since our first rain on Halloween. It's raining now. Our woods are coming alive! (San Marcos Pass, 15 November 2003)",NA,NA,NA,"San Marcos Pass","United States","California","Gilled Polypore; Coast Live Oak","Lenzites betulina; Quercus agrifolia","Lenzites betulina; Quercus agrifolia",NA,"2003-11-15"
"3b15d_3b15-038.jpg","11/15/03","Looks like a strange animal hoof, but it's just the rooting tip of a <b>California Blackberry</b> (<i>Rubus ursinus</i>) stem growing up through a decomposing oak log. Brambles form because blackberries root at the tips of their stems. That's a hint for starting cuttings - plant them upside-down! (San Marcos Pass, 15 November 2003)",NA,NA,NA,"San Marcos Pass","United States","California","California Blackberry","Rubus ursinus","Rubus ursinus",NA,"2003-11-15"
"3b15e_3b15-011.jpg","11/15/03","New growth of <b>California Honeysuckle</b> (<i>Lonicera hispidula</i>) and twists of shed <b>Madrone</b> (<i>Arbutus menziesii</i>) bark on a sandstone outcrop. (San Marcos Pass, 15 November 2003)",NA,NA,NA,"San Marcos Pass","United States","California","California Honeysuckle; Madrone","Lonicera hispidula; Arbutus menziesii","Lonicera hispidula; Arbutus menziesii",NA,"2003-11-15"
"3b15f_3b15-008.jpg","11/15/03","I believe this is a <b>California Polypody</b> (<i>Polypodium californicum</i> fern just starting to grow from it's fertilized <i>prothallus</i>. Fern sex is complicated. Mature <i>diploid</i> ferns produce spores which become the small heart-shaped <i>haploid</i> prothallii. These produce mobile sperm that swim over wet surfaces like this rock near home to mate and produce new diploid ferns for next year. It's never easy! (San Marcos Pass, 15 November 2003)",NA,NA,NA,"San Marcos Pass","United States","California","California Polypody","Polypodium californicum; prothallus; diploid; haploid","Polypodium californicum; prothallus; diploid; haploid",NA,"2003-11-15"
"3b15g_3b13-210.jpg","11/15/03","<b>Crampball</b> (<i>Daldinia grandis</i>), but I usually call it the charcoal 'shroom because that's what it looks and feels like. This one is growing from a cut oak log. It looks like it's oozing, but it's _v_e_r_y__s_l_o_w_ and it's as hard as a charcoal briquet. This fungus or something like it has been conected to ""Sudden Oak Death"" (SOD), see http://www.suddenoakdeath.org/ (San Marcos Pass, 8 November 2003)",NA,NA,NA,"San Marcos Pass","United States","California","Crampball","Daldinia grandis","Daldinia grandis",NA,"2003-11-15"
"3b15h_3b13-207.jpg","11/15/03","<b>Smooth Lepiota</b> (<i>Leucoagaricus naucinus</i> aka <i>Lepiota naucina</i>) in the grass on the soccor field at school. David Arora calls it ""Woman on Motorcycle"" and these young caps DO look like helmets. (Santa Ynez Valley, 13 November 2003)",NA,NA,NA,"Santa Ynez Valley","United States","California","Smooth Lepiota","Leucoagaricus naucinus; Lepiota naucina","Leucoagaricus naucinus; Lepiota naucina",NA,"2003-11-15"
"3b15i_3b08-043.jpg","11/15/03","<b>Smooth Lepiota</b> (<i>Leucoagaricus naucinus</i> aka <i>Lepiota naucina</i>) in the grass on the soccor field at school. ""Leucoagaricus"" - ""white agaricus"" - is a good name because this looks and smells like an Agaricus with free gills and a ring on the stem, but it has a white spore print. Said to be edible, but be careful because it resembles Amanita. (Santa Ynez Valley, 13 November 2003)",NA,NA,NA,"Santa Ynez Valley","United States","California","Smooth Lepiota","Leucoagaricus naucinus; Lepiota naucina","Leucoagaricus naucinus; Lepiota naucina",NA,"2003-11-15"
"3b16a_3b16-045.jpg","11/16/03","<b>Chalk Lettuce</b> (<i>Dudleya pulverulenta</i>) in our garden. That's an ugly name for this beautiful native succulent. We live on the shady north side of the mountains, and we only get about an hour of sun at this time of year. I was busy today, and I never got past the garden, but I did pick the right time to get out with my camera. (San Marcos Pass, 16 November 2003)",NA,NA,NA,"San Marcos Pass","United States","California","Chalk Lettuce","Dudleya pulverulenta","Dudleya pulverulenta",NA,"2003-11-16"
"3b16b_3b16-041.jpg","11/16/03","<b>White Sage</b> (<i>Salvia apiana</i>) in our garden, with raindrops. (San Marcos Pass, 16 November 2003)",NA,NA,NA,"San Marcos Pass","United States","California","White Sage","Salvia apiana","Salvia apiana",NA,"2003-11-16"
"3b16c_3b16-046.jpg","11/16/03","New <b>Iris</b> leaves in our garden. (San Marcos Pass, 16 November 2003)",NA,NA,NA,"San Marcos Pass","United States","California","Iris",NA,NA,NA,"2003-11-16"
"3b16d_3b16-048.jpg","11/16/03","Tiny LBM (""Little Brown Mushroom"") in our garden. (San Marcos Pass, 16 November 2003)",NA,NA,NA,"San Marcos Pass","United States","California",NA,NA,NA,NA,"2003-11-16"
"3b16e_3b15-040.jpg","11/16/03","<b>Bracket Fungus</b> (<i>Coriolus hirsutus</i>?) growing on oak wood at home. (San Marcos Pass, 15 November 2003)",NA,NA,NA,"San Marcos Pass","United States","California","Bracket Fungus","Coriolus hirsutus","Coriolus hirsutus",NA,"2003-11-16"
"3b16f_3b15-004.jpg","11/16/03","At first I thought this was an orange wood fungus growing by the compost heap. Then I realized it's a moldy old <b>crookneck squash</b> from the garden! (San Marcos Pass, 15 November 2003)",NA,NA,NA,"San Marcos Pass","United States","California","crookneck squash",NA,NA,NA,"2003-11-16"
"3b17a_3b16-043.jpg","11/17/03","Our garden is winding down after light frost and little sun on our shady side of the mountains. I haven`t seen a butterfly or honeybee since Halloween, but there is still life in the garden. Here are pretty yellow aphids (some mature) on the garden Milkweed still beset by preditors. The ladybug is obvious, but there`s also a tiny black parasitic wasp visible on the leaf in the middle-left. (San Marcos Pass, 16 November 2003)",NA,NA,NA,"San Marcos Pass","United States","California",NA,NA,NA,NA,"2003-11-17"
"3b17b_3b15-032.jpg","11/17/03","Leaves of <b>California Bay</b> (<i>Umbellularia californica</i>) in a new pool on our creek, with reflections. (San Marcos Pass, 15 November 2003)",NA,NA,NA,"San Marcos Pass","United States","California","California Bay","Umbellularia californica","Umbellularia californica",NA,"2003-11-17"
"3b17c_3b15-036.jpg","11/17/03","Leaves of a small <b>Toyon</b> or <b>Christmas Berry</b> (<i>Heteromeles arbutifolia</i>) lost in the shade along our creek. Mature shrubs with some sun are ripening berries, but this one is under attack. (San Marcos Pass, 15 November 2003)",NA,NA,NA,"San Marcos Pass","United States","California","Toyon; Christmas Berry","Heteromeles arbutifolia","Heteromeles arbutifolia",NA,"2003-11-17"
"3b17d_3b15-039.jpg","11/17/03","Tendrils of <b>Wild Sweetpea</b> (<i>Lathyrus vestitus</i>) along my trail. (San Marcos Pass, 15 November 2003)",NA,NA,NA,"San Marcos Pass","United States","California","Wild Sweetpea","Lathyrus vestitus","Lathyrus vestitus",NA,"2003-11-17"
"3b19a_3b19-105.jpg","11/19/03","<b>Broad-leaved Cattail</b> (<i>Typha latifolia</i>) exploding with seeds. (Santa Ynez Valley, 19 November 2003)",NA,NA,NA,"Santa Ynez Valley","United States","California","Broad-leaved Cattail","Typha latifolia","Typha latifolia",NA,"2003-11-19"
"3b19b_3b19-123.jpg","11/19/03","Next year's bud on <b>Fremont Cottonwood</b> (<i>Populus fremontii</i>). The leaves are starting to turn gold and drop for winter. Those orange bumps on the leaf in front might be galls of the <b>Poplar Erineum Gall Mite</b> (<i>Phyllocoptes didelphis</i>) or something similar. (Santa Ynez Valley, 19 November 2003)",NA,NA,NA,"Santa Ynez Valley","United States","California","Fremont Cottonwood; Poplar Erineum Gall Mite","Populus fremontii; Phyllocoptes didelphis","Populus fremontii; Phyllocoptes didelphis",NA,"2003-11-19"
