"File.Name","Date","Notes","Latitude","Longitude","Accuracy","Locality","Country","State","CommonNames","ScientificName","associatedTaxa","Families","Date_YYYYMMDD"
"d526e_d526-036.jpg","5/26/13","8847923717 I believe this is a <b>Mountain Mahogany Hairstreak</b> (<i>Satyrium tetra</i>) butterfly perched on a flower head of <b>Golden Yarrow</b> (<i>Eriophyllum confertflorum</i>) in the <i>Asteraceae</i> plant family. It has a pointed forewing, very short tails, and a frosted white postmedian line on the hindwing. (San Marcos Pass, 26 May 2013) <p>This one completes our trio of small brown hairstreaks, including the <a href=""http://www.flickr.com/photos/treebeard/8835298766/""><b>Gold-Hunter's Hairstreak</b> (<i>Satyrium auretorum</i>) butterfly</a> and the <a href=""http://www.flickr.com/photos/treebeard/8727772764/""><b>Hedgerow Hairstreak</b> (<i>Satyrium saepium</i>) butterfly</a>.","34.51179","-119.818385","16","San Marcos Pass","United States","California","Mountain Mahogany Hairstreak; Golden Yarrow; Gold-Hunter's Hairstreak; Hedgerow Hairstreak","Satyrium tetra; Eriophyllum confertflorum; Asteraceae; Satyrium auretorum; Satyrium saepium","Satyrium tetra; Eriophyllum confertflorum; Asteraceae; Satyrium auretorum; Satyrium saepium","Asteraceae","2013-05-26"
"d526f_d526-047.jpg","5/26/13","8848458510 This is either a <b>Lupine Blue</b> (<i>Plebejus lupini</i>) or an <b>Acmon Blue</b> (<i>Plebejus acmon</i>) butterfly. See Alice's comments below. I really can't tell them apart, though the Lupine Blue favors buckwheat and the Acmon Blue favors legumes like lotus. This one is working a flower head of <b>Golden Yarrow</b> (<i>Eriophyllum confertflorum</i>) in the <i>Asteraceae</i> plant family - which is no help. The black border on the inside of the orange band does suggest Lupine Blue. Compare my [Previous] photo of (maybe) the <b>Bernardino Blue</b> (<i>Euphilotes bernardino</i>). This one is larger and doesn't have black checks on its wing margins. Whatever it is, it sure is pretty! (San Marcos Pass, 26 May 2013)","34.519216","-119.795683","16","San Marcos Pass","United States","California","Lupine Blue; Acmon Blue; Golden Yarrow; Bernardino Blue","Plebejus lupini; Plebejus acmon; Eriophyllum confertflorum; Asteraceae; Euphilotes bernardino","Plebejus lupini; Plebejus acmon; Eriophyllum confertflorum; Asteraceae; Euphilotes bernardino","Asteraceae","2013-05-26"
"d526g_d526-018.jpg","5/26/13","8848221156 These are the upper wings of a beautiful <b>Blue</b> butterfly in the subfamily <i>Polyommatinae</i> on working new flowers of <b>Golden Yarrow</b> (<i>Eriophyllum confertflorum</i>) in the <i>Asteraceae</i> plant family. It might be another <b>Lupine Blue</b> (<i>Plebejus lupini</i>) or an <b>Acmon Blue</b> (<i>Plebejus acmon</i>) butterfly, but it might also be a <b>Bernardino Blue</b> aka <b>Square-spotted Blue</b> (<i>Euphilotes bernardino</i> or <i>Euphilotes battoides bernardino</i>). It was quite small, and it seems to have black checks along what's left of its wing margins. Yes, there is native <b>California Buckwheat</b> (<i>Eriogonum fasciculatum</i>) in the <i>Polygonaceae</i> plant family growing nearby. Alice thinks it is a small Lupine Blue</b> (<i>Plebejus lupini</i>). See my [Next] photo and her comments. (San Marcos Pass, 26 May 2013)","34.512727","-119.813021","16","San Marcos Pass","United States","California","Blue; Golden Yarrow; Lupine Blue; Acmon Blue; Bernardino Blue; Square-spotted Blue; California Buckwheat","Polyommatinae; Eriophyllum confertflorum; Asteraceae; Plebejus lupini; Plebejus acmon; Euphilotes bernardino; Euphilotes battoides bernardino; Eriogonum fasciculatum; Polygonaceae; Plebejus lupini","Polyommatinae; Eriophyllum confertflorum; Asteraceae; Plebejus lupini; Plebejus acmon; Euphilotes bernardino; Euphilotes battoides bernardino; Eriogonum fasciculatum; Polygonaceae; Plebejus lupini","Asteraceae; Polygonaceae","2013-05-26"
"d526h_d526-044.jpg","5/26/13","8847478297 This is another <b>Spring Azure</b> (<i>Celastrina ladon</i>) butterfly working a new flower of native <b>Coffeeberry</b> (<i>Rhamnus californica</i>) in the <i>Rhamnaceae</i> plant family. This butterfly is very plain underneath, though it has a touch of blue. It's quite brilliant on top. See <a href=""http://www.flickr.com/photos/treebeard/8834324418/"">my photo yesterday</a>. (San Marcos Pass, 26 May 2013)","34.518597","-119.783045","16","San Marcos Pass","United States","California","Spring Azure; Coffeeberry","Celastrina ladon; Rhamnus californica; Rhamnaceae","Celastrina ladon; Rhamnus californica; Rhamnaceae","Rhamnaceae","2013-05-26"
"d527a_d527-020.jpg","5/27/13","8862371852 Fire on the mountain! <p>This is the first smoke we noticed of what has been called the ""<a href=""http://www.inciweb.org/incident/3394/"">White Fire</a>"" in the Paradise area along the Santa Ynez River. I got this photo around 3:24 pm, from our upstairs porch, looking north across Fremont Ridge. It looks like the fire is coming right towards us from just over the ridge, but it's actually burning east along the other side of Paradise Road. See my [Previous] photo. The wildfire now stands at 700 acres. This fire was apparently started at the White Rock picnic area - *maybe* by someone dumping hot BBQ coals. Memorial Day weekend is a dangerous time, with dangerous people. It's a good reminder to back up my hard drives! (San Marcos Pass, 27 May 2013) <p>I had some other photos ready to go, but that seems kind of superfluous right now. There's always tomorrow.","34.512709","-119.813042","16","San Marcos Pass","United States","California",NA,NA,NA,NA,"2013-05-27"
"d527b_d527-023.jpg","5/27/13","8862032144 Fire on the mountain! <p>This is the ""<a href=""http://www.inciweb.org/incident/3394/"">White Fire</a>"" burning in Oso Canyon in the Paradise area along the Santa Ynez River. I got this photo around 5:00 pm - from East Camino Cielo, looking down from the top of the mountains. The wind has been howling over San Marcos Pass from the north, but it seems to be blowing from the west down here - blowing the fire along the river, and away from us. I like that line of fire trucks evenly spaced along Paradise Road. The firefighters will try real hard to keep the wildfire from crossing the road and burning up the Santa Ynez Mountains, towards us and Santa Barbara. This fire has already burned through some of the areas I regularly photograph. (Santa Ynez Mountains, 27 May 2013) <p>This fire apparently started at the White Rock picnic area - *maybe* by someone dumping hot BBQ coals. Memorial Day weekend is a dangerous time, with dangerous people.","34.519322","-119.795962","16","Santa Ynez Mountains","United States","California",NA,NA,NA,NA,"2013-05-27"
"d528a_d528-003.jpg","5/28/13","8873332855 Here is another photo of the (I guess) <b>Carrion Beetle</b> (<i>Silphidae</i>) in the suborder <i>Polyphaga</i> of the <i>Coleoptera</i> - maybe the <b>Black Burying Beetle</b> (<i>Nicrophorus nigrita</i>). It's perched on Julie's thumb, before I realized what it was. If you look close, you can see that it's crawling with <b>mites</b> (<i>Acari</i>). I don't think these mites are just hitch-hikers. Look how they are concentrated around the left edge of its thorax - something to do with ""trachael tubes""? This beetle landed on my hand last night, and I put it in a jar to get a photo this morning. Something dead in the walls? (San Marcos Pass, 28 May 2013) <p>Damn, there's another wildfire in the Santa Ynez Valley. The ""<b>Olive Fire</b>"" started around 3:30 pm near the junction of Highways 154 and 246. I heard something about 170 acres and highways closed. The fastest source for local news seems to be <a href=""http://www.edhat.com/site/tidbit.cfm?id=1394"">Edhat</a>.","34.51301","-119.812678","16","San Marcos Pass","United States","California","Carrion Beetle; Black Burying Beetle; mites; Olive Fire","Silphidae; Polyphaga; Coleoptera; Nicrophorus nigrita; Acari","Silphidae; Polyphaga; Coleoptera; Nicrophorus nigrita; Acari","Silphidae","2013-05-28"
"d528b_d528-007.jpg","5/28/13","8873673420 I guess from its shape that this is a <b>Carrion Beetle</b> (<i>Silphidae</i>) in the suborder <i>Polyphaga</i> of the <i>Coleoptera</i> - maybe the <b>Black Burying Beetle</b> (<i>Nicrophorus nigrita<i>). It's about to take wing from Julie's hand - before I realized what it was. I don't quite understand this beetle's anatomy. Does it flip its wing covers (""elytra"") over and fold them down before it takes wing? If you look close, you can see that it's crawling with <b>mites</b> (<i>Acari</i>). See my [Next] photo. (San Marcos Pass, 27 May 2013) <p>This beetle landed on my hand last night, and I put it in a jar to get a photo this morning. Something dead in the walls?","34.513859","-119.814051","16","San Marcos Pass","United States","California","Carrion Beetle; Black Burying Beetle; mites","Silphidae; Polyphaga; Coleoptera; Nicrophorus nigrita).  It's about to take wing from Julie's hand - before I realized what it was.  I don't quite understand this beetle's anatomy.  Does it flip its wing covers (""elytra"") over and fold them down before it takes wing?   If you look close, you can see that it's crawling with <b>mites</b> (Acari","Silphidae; Polyphaga; Coleoptera; Nicrophorus nigrita).  It's about to take wing from Julie's hand - before I realized what it was.  I don't quite understand this beetle's anatomy.  Does it flip its wing covers (""elytra"") over and fold them down before it takes wing?   If you look close, you can see that it's crawling with <b>mites</b> (Acari","Silphidae","2013-05-28"
"d528c_d527-003.jpg","5/28/13","8872852813 This is a another tiny <b>Tick</b> (superfamily <i>Ixodoidea</i> of the <i>Arachnida</i>) in the woods just waiting (and waiting...) on the awns of a seedhead of native <b>Western Rye</b> aka <b>Blue Wildrye</b> (<i>Elymus glaucus</i>) grass in the <i>Poaceae</i> plant family. I guess it's a <b>Pacific Coast Tick</b> (<i>Dermacentor occidentalis</i>), but I really don't know. Not bad for a breezy morning! (San Marcos Pass, 27 May 2013)","34.513364","-119.813171","16","San Marcos Pass","United States","California","Tick; Western Rye; Blue Wildrye; Pacific Coast Tick","Ixodoidea; Arachnida; Elymus glaucus; Poaceae; Dermacentor occidentalis","Ixodoidea; Arachnida; Elymus glaucus; Poaceae; Dermacentor occidentalis","Poaceae","2013-05-28"
"d528d_d527-013.jpg","5/28/13","8873309588 OK Alice, I'll try again... <p>I think this might be the real <b>Bernardino Blue</b> aka <b>Square-spotted Blue</b> (<i>Euphilotes bernardino</i> or <i>Euphilotes battoides bernardino</i>) butterfly working new flowers of a native <b>California Buckwheat</b> (<i>Eriogonum fasciculatum</i>) in the <i>Polygonaceae</i> shrub. It's quite small, and it seems to have black checks along its wing margins. It also lacks the black spots along the border of its upper wings, which seems to be a characteristic of <b>Euphilotes Blues</b>. It looks quite rusty. (San Marcos Pass, 27 May 2013)","34.512798","-119.813064","16","San Marcos Pass","United States","California","Bernardino Blue; Square-spotted Blue; California Buckwheat; Euphilotes Blues","Euphilotes bernardino; Euphilotes battoides bernardino; Eriogonum fasciculatum; Polygonaceae","Euphilotes bernardino; Euphilotes battoides bernardino; Eriogonum fasciculatum; Polygonaceae","Polygonaceae","2013-05-28"
"d528e_d528-015.jpg","5/28/13","8872573339 This is a beautiful <b>Pale Swallowtail</b> (<i>Papilio eurymedon</i>) butterfly visiting the old-fashioned flowers of a <b>Geranium</b> (really a <i>Pelargonium</i>, family <i>Geraniaceae</i>) in the garden. I've seen remarkably few swallowtails in this drought year. I did everything wrong with this photo - ISO 800 and f/7.1, left over from a previous photo - but it's not bad! (San Marcos Pass, 28 May 2013)","34.512727","-119.813042","16","San Marcos Pass","United States","California","Pale Swallowtail; Geranium","Papilio eurymedon; Pelargonium; Geraniaceae","Papilio eurymedon; Pelargonium; Geraniaceae","Geraniaceae","2013-05-28"
"d528f_d527-007.jpg","5/28/13","8872493441 This is a new asparagus-like flower stalk of native <b>Chaparral Orchid</b> (<i>Piperia elongata</i>) in the <i>Orchidaceae</i> plant family that I found in the woods yesterday. They have large basal ovate leaves that wither away as the flowers appear. This one isn't flowering yet, but it looks like it will be soon. I never did find the the flowers last year, which was also dry. Maybe this year? (San Marcos Pass, 27 May 2013)","34.519092","-119.795662","16","San Marcos Pass","United States","California","Chaparral Orchid","Piperia elongata; Orchidaceae","Piperia elongata; Orchidaceae","Orchidaceae","2013-05-28"
"d528g_d528-016.jpg","5/28/13","8872925826 This is another small casualty of the ""<a href=""http://www.inciweb.org/incident/3394/"">White Fire</a>"" now burning in the Paradise area along the Santa Ynez River. It's a native <b>Weed's Mariposa Lily</b> (<i>Calochortus weedii</i> var. <i>vestus</i>) - now renamed as <i>C. fimbriata</i> - in the <i>Liliaceae</i> plant family, that was trampled at a place in the Santa Ynez Mountains where you could look out and see the fire. There was a crowd of people there yesterday afternoon, and this fine native plant took a hit. (San Marcos Pass, 28 May 2013)","34.513204","-119.812978","16","San Marcos Pass","United States","California","Weed's Mariposa Lily","Calochortus weedii; vestus; C. fimbriata; Liliaceae","Calochortus weedii; vestus; C. fimbriata; Liliaceae","Liliaceae","2013-05-28"
"d528h_d528-weather.jpg","5/28/13","8872564808 This is the <a href=""http://www.wrh.noaa.gov/lox/"">NWS<a> weather forecast for the next few days - windy, very windy, breezy, windy, breezy, and breezy. Not good for the wildfire situation, and not good for photos either. The wind is coming from the north-west. I guess it funnels over San Marcos Pass south towards the ocean, but it also funnels east along the Santa Ynez River canyon towards the backcountry. (San Marcos Pass, 26 May 2013) <p>I did go up to the ridge above the ""<a href=""http://www.inciweb.org/incident/3394/"" rel=""nofollow"">White Fire</a>"" again this morning. I don't want to jinx it, but it looked pretty quiet. The wildfire has actually burned its own ""backfire clearing"" on the river side. Even so, I wouldn't want to be on the fire lines right now. The wind is really blowing. <p>Apparently the rumors are true - the fire was started by someone dumping hot BBQ coals. Local TV KEYT news person John Palminteri has a couple of remarkable photos of the White Fire point of origin in the campground at White Rock on <a href=""www.edhat.com/site/tidbit.cfm?nid=115088"" rel=""nofollow"">Edhat</a>. The person who started the fire left in a hurry. <p>The fire now stands at 2,025 acres, and 10% contained. I'll bet that 10% is along Paradise Road on the south side. It's still burning away from us.","34.512692","-119.813021","16","San Marcos Pass","United States","California",NA,NA,NA,NA,"2013-05-28"
"d529a_d529-013.jpg","5/29/13","8884471289 This is a tiny ""parasitic wasp"" (<i>Hymenoptera</i>) inserting its elegantly curved ovipositor into a flower head of <b>Canyon Sunflower</b> (<i>Venegasia carpesioides</i>) in the <i>Asteraceae</i> plant family. Maybe its found the larva of a <b>Tephritid Fruit Fly</b> (family <i>Tephritidae</i>, order <i>Diptera</i>) which like to oviposit on these flowers? (See <a href=""http://www.flickr.com/photos/treebeard/6974225566/"">this photo</a>.) I have no idea what kind of wasp it is. It was a challenge to get this photo today in the low light and wind. (San Marcos Pass, 29 May 2013) <p>We had a small but sharp earthquake this morning - just magnitude 4.8, but the epicenter was close, and it got me out of bed in a hurry! Drought, wildfires, and earthquakes, oh my! This is starting to feel downright biblical. But it's the incessant wind that's really starting to get me down.","34.512727","-119.813064","16","San Marcos Pass","United States","California","Canyon Sunflower; Tephritid Fruit Fly","Hymenoptera; Venegasia carpesioides; Asteraceae; Tephritidae; Diptera","Hymenoptera; Venegasia carpesioides; Asteraceae; Tephritidae; Diptera","Asteraceae; Tephritidae","2013-05-29"
"d529b_d529-004.jpg","5/29/13","8884337257 These are <b>Valley Oak</b> (<i>Quercus lobata</i>) trees in the <i>Fagaceae</i> plant family surrounded by burned grassland from the ""Olive Fire"" that happened yesterday afternoon near the junction of Highways 154 and 246. Now it just looks like some some rancher burned his grassland. The oaks look a bit toasted, but otherwise fine. The wildfire burned about 170 acres, but it was a dry grass fire that didn't get into the chaparral. Good job firefighters - it must have been tough to get a handle on this one in the wind yesterday! (Santa Ynez Valley, 29 May 2013)","34.519287","-119.795876","16","Santa Ynez Valley","United States","California","Valley Oak","Quercus lobata; Fagaceae","Quercus lobata; Fagaceae","Fagaceae","2013-05-29"
"d529c_d526-001.jpg","5/29/13","8884828620 This is a cute little <b>Treehopper</b> (family <i>Membracidae</i> in the old insect order <i>Homoptera</i>). Looking at <a href=""http://bugguide.net/node/view/10789/bgimage"" rel=""nofollow"">BugGuide</a>, it sure looks like genus <i>Cyrtolobus</i>. This one is perched on a leaf of native <b>Nuttall's Snowberry</b> (<i>Symphoricarpos mollis</i> or kin) in the <i>Caprifoliaceae</i> plant family. The thorax of these insects is expanded to cover the abdomen. They have remarkable eyes, like all hoppers that have to see where they're hopping. It's small, about 1/4 inch long. (San Marcos Pass, 26 May 2013)","34.518845","-119.793537","16","San Marcos Pass","United States","California","Treehopper; Nuttall's Snowberry","Membracidae; Homoptera; Cyrtolobus; Symphoricarpos mollis; Caprifoliaceae","Membracidae; Homoptera; Cyrtolobus; Symphoricarpos mollis; Caprifoliaceae","Membracidae; Caprifoliaceae","2013-05-29"
"d529d_d526-027.jpg","5/29/13","8884123417 This is a wonderful little <b>Bee Fly</b> (family <i>Bombyliidae</i>) in the order <i>Diptera</i> working a new flower of <b>Trask's Yerba Santa</b> (<i>Eriodictyon traskiae</i>) in the <i>Hydrophyllaceae</i> or <i>Boraginaceae</i> plant family. I guess the fly is genus <i>Bombylius</i>. You can see some pollen stuck to it's long proboscis, which it will transfer to the next flower. Compare my [Previous] photo to get an idea of how long its proboscis really is! (San Marcos Pass, 26 May 2013)","34.519233","-119.795812","16","San Marcos Pass","United States","California","Bee Fly; Trask's Yerba Santa","Bombyliidae; Diptera; Eriodictyon traskiae; Hydrophyllaceae; Boraginaceae; Bombylius","Bombyliidae; Diptera; Eriodictyon traskiae; Hydrophyllaceae; Boraginaceae; Bombylius","Bombyliidae; Hydrophyllaceae; Boraginaceae","2013-05-29"
"d529e_d526-026.jpg","5/29/13","8884068103 This is a wonderful little <b>Bee Fly</b> (family <i>Bombyliidae</i>) in the order <i>Diptera</i> showing just how long its proboscis is! It's hovering above new flowers of <b>Trask's Yerba Santa</b> (<i>Eriodictyon traskiae</i>) in the <i>Hydrophyllaceae</i> or <i>Boraginaceae</i> plant family. I guess the fly is genus <i>Bombylius</i>. Compare my [Next] photo. (San Marcos Pass, 26 May 2013)","34.512727","-119.813042","16","San Marcos Pass","United States","California","Bee Fly; Trask's Yerba Santa","Bombyliidae; Diptera; Eriodictyon traskiae; Hydrophyllaceae; Boraginaceae; Bombylius","Bombyliidae; Diptera; Eriodictyon traskiae; Hydrophyllaceae; Boraginaceae; Bombylius","Bombyliidae; Hydrophyllaceae; Boraginaceae","2013-05-29"
"d529f_d526-022.jpg","5/29/13","8883977111 This is a another pretty <b>Long-horned Beetle</b> in the family <i>Cerambycidae</i> of the order <i>Coleoptera</i>. It's perched on a leaf of flowering native <b>Coffeeberry</b> (<i>Rhamnus californica</i>) in the <i>Rhamnaceae</i> plant family. This critter is relatively large, about an inch long. It's been munching the flowers. (San Marcos Pass, 26 May 2013)","34.512957","-119.812656","16","San Marcos Pass","United States","California","Long-horned Beetle; Coffeeberry","Cerambycidae; Coleoptera; Rhamnus californica; Rhamnaceae","Cerambycidae; Coleoptera; Rhamnus californica; Rhamnaceae","Cerambycidae; Rhamnaceae","2013-05-29"
"d529g_d526-043.jpg","5/29/13","8884518760 I guess this is a little <b>Long-horned Beetle</b> in the family <i>Cerambycidae</i> of the order <i>Coleoptera</i>. It's perched on a leaf of flowering native <b>Coffeeberry</b> (<i>Rhamnus californica</i>) in the <i>Rhamnaceae</i> plant family. It looks like it has the ""blahs"". (San Marcos Pass, 26 May 2013)","34.512709","-119.813064","16","San Marcos Pass","United States","California","Long-horned Beetle; Coffeeberry","Cerambycidae; Coleoptera; Rhamnus californica; Rhamnaceae","Cerambycidae; Coleoptera; Rhamnus californica; Rhamnaceae","Cerambycidae; Rhamnaceae","2013-05-29"
"d529h_d526-028.jpg","5/29/13","8884457142 These are pretty new galls of the <b>Spined Turban Gall Wasp</b> (<i>Antron douglasii</i>) in the family <i>Cynipidae</i> of the order <i>Hymenoptera</i> growing on the underside of a leaf of <b>Scrub Oak</b> (<i>Quercus berberidifolia</i>) in the <i>Fagaceae</i> plant family. They are <i>monothalamus</i> (just one wasp larvae inside) and easily <i>detachable</i> (you can break them off). They look like little mushrooms growing from the oak leaf, but they are the ""nests"" of tiny wasps. I haven't found them for a few years. (San Marcos Pass, 26 May 2013)","34.51934","-119.796134","16","San Marcos Pass","United States","California","Spined Turban Gall Wasp; Scrub Oak","Antron douglasii; Cynipidae; Hymenoptera; Quercus berberidifolia; Fagaceae; monothalamus; detachable","Antron douglasii; Cynipidae; Hymenoptera; Quercus berberidifolia; Fagaceae; monothalamus; detachable","Cynipidae; Fagaceae","2013-05-29"
"d530a_d530-005.jpg","5/30/13","8897210694 This is the tiny nymph of an <b>Assassin Bug</b> in the family <i>Reduviidae</i> of the insect order <i>Hemiptera</i>, on a leaf of native <b>Nuttall's Snowberry</b> (<i>Symphoricarpos mollis</i> or kin) in the <i>Caprifoliaceae</i> plant family. It's only about 1/4 inch long. It looks like a tiny dragon! You can see its mighty proboscis, like a scythe below its head. I'm always happy when I can make out the ""ommatidia"" simple-eyes that make up the compound eyes of any insect. (San Marcos Pass, 30 May 2013) <p>It was breezy today, but not a bad as its been. I hope our latest ""wind event"" is all done. But maybe it blew all the larger insects out towards the ocean? I only found nymphs and aphids today. Well, there's always tomorrow.","34.508254","-119.770878","16","San Marcos Pass","United States","California","Assassin Bug; Nuttall's Snowberry","Reduviidae; Hemiptera; Symphoricarpos mollis; Caprifoliaceae","Reduviidae; Hemiptera; Symphoricarpos mollis; Caprifoliaceae","Reduviidae; Caprifoliaceae","2013-05-30"
"d530b_d530-016.jpg","5/30/13","8896395489 This is the late-instar nymph of a <b>Stilt Bug</b> in the family <i>Berytidae</i> of the old insect order <i>Hemiptera</i>. This one is on a bristly and glandular seed head of annual <b>Caterpillar Phacelia</b> (<i>Phacelia cicutaria</i> var. <i>hispida</i>) in the <i>Hydrophyllaceae</i> plant family, now moved to the <i>Boraginaceae</i>. It's a beautiful insect, and not easy to notice. The red eyes are remarkable. Our usual adult Stilt Bugs are brown in color. I'm not sure if this is something different, or just a step on the way. (San Marcos Pass, 30 May 2013)","34.506574","-119.76678","16","San Marcos Pass","United States","California","Stilt Bug; Caterpillar Phacelia","Berytidae; Hemiptera; Phacelia cicutaria; hispida; Hydrophyllaceae; Boraginaceae","Berytidae; Hemiptera; Phacelia cicutaria; hispida; Hydrophyllaceae; Boraginaceae","Berytidae; Hydrophyllaceae; Boraginaceae","2013-05-30"
"d530c_d530-012.jpg","5/30/13","8896211431 Here are <b>ants</b> (family <i>Formicidae</i> in the order <i>Hymenoptera</i>) tending their <b>aphids</b> (family <i>Aphididae</i> of the order <i>Homoptera</i>) on a plant of native <b>California Thistle</b> (<i>Cirsium occidentale</i> var. <i>californicum</i>) in the <i>Asteraceae</i> plant family. Some of the aphids have their adult wings. This plant will soon have beautiful violet flowers, but others (which look quite different) have white flowers. Native thistles are a confusing group. (San Marcos Pass, 30 May 2013)","34.506627","-119.759162","16","San Marcos Pass","United States","California","ants; aphids; California Thistle","Formicidae; Hymenoptera; Aphididae; Homoptera; Cirsium occidentale; californicum; Asteraceae","Formicidae; Hymenoptera; Aphididae; Homoptera; Cirsium occidentale; californicum; Asteraceae","Formicidae; Aphididae; Asteraceae","2013-05-30"
"d530d_d530-025.jpg","5/30/13","8896775932 I believe these are the galls of the <b>Willow Apple Gall Sawfly</b> (<i>Potania californica</i>) in the family <i>Tenthredinidae</i> of the order <i>Hymenoptera</i>, on a leaf of <b>Arroyo Willow</b> (<i>Salix lasiolepis</i>) in the <i>Salicaceae</i> plant family. You can see how the galls protrude on both sides of the leaf. (San Marcos Pass, 30 May 2013)","34.500986","-119.721654","16","San Marcos Pass","United States","California","Willow Apple Gall Sawfly; Arroyo Willow","Potania californica; Tenthredinidae; Hymenoptera; Salix lasiolepis; Salicaceae","Potania californica; Tenthredinidae; Hymenoptera; Salix lasiolepis; Salicaceae","Tenthredinidae; Salicaceae","2013-05-30"
