"File.Name","Date","Notes","Latitude","Longitude","Accuracy","Locality","Country","State","CommonNames","ScientificName","associatedTaxa","Families","Date_YYYYMMDD"
"d909f_d908-062.jpg","9/9/13","9714379008 This is a whole plant with summer flowers of native composite <b>Bush Groundsel</b> (<i>Senecio douglasii</i>) in the <i>Asteraceae</i> plant family - now renamed <b>Douglas' Groundsel</b> (<i>Senecio flaccidus</i> var. <i>douglasii</i>). It's growing with the ubiquitous weedy grasses. Despite drought and heat, it keeps making pretty flowers! (Near La Cumbre Peak, Santa Ynez Mountains, 8 September 2013)","34.512833","-119.813214","16","Near La Cumbre Peak","United States","California","Bush Groundsel; Douglas' Groundsel","Senecio douglasii; Asteraceae; Senecio flaccidus; douglasii","Senecio douglasii; Asteraceae; Senecio flaccidus; douglasii","Asteraceae","2013-09-09"
"d910a_d821-198.jpg","9/10/13","9722085598 This is a remarkable ""ping pong gall"" of a <b>Speckled Gall Wasp</b> (<i>Besbicus mirabilis</i>) in the family <i>Cynipidae</i> of the order <i>Hymenoptera</i> on a leaf of <b>Oregon White Oak</b> (<i>Quercus garryana</i>) in the <i>Fagaceae</i> plant family growing in the Oregon woods. It is the ""nest"" of tiny wasps, beautiful and strange - but also part of the oak tree and grown from oak tissue. (Near Susan Creek, North Umpqua River, Oregon, 21 August 2013) <p>It was a crummy day for new photos, foggy and windy - and I had errands to do in town, including dropping off the new SYVNHS newsletter at the printers. It's a good day to post some Oregon photos from our recent trip.","34.538166","-119.746588","16","Near Susan Creek","United States","California","Speckled Gall Wasp; Oregon White Oak","Besbicus mirabilis; Cynipidae; Hymenoptera; Quercus garryana; Fagaceae","Besbicus mirabilis; Cynipidae; Hymenoptera; Quercus garryana; Fagaceae","Cynipidae; Fagaceae","2013-09-10"
"d910b_d805-030.jpg","9/10/13","9718752255 This is the remarkable gall of a <b>Mossy Rose Gall Wasp</b> (<i>Diplolepis bassetti</i>) in the family <i>Cynipidae</i> of the order <i>Hymenoptera</i> - actually many wasps, since the galls are polythalamous. It's growing on the stem of some kind of native <b>Wild Rose</b> (genus <i>Rosa</i>) in the <i>Rosaceae</i> plant family. (Near Susan Creek, North Umpqua River, Oregon, 5 August 2013)","34.534666","-119.724937","16","Near Susan Creek","United States","California","Mossy Rose Gall Wasp; Wild Rose","Diplolepis bassetti; Cynipidae; Hymenoptera; Rosa; Rosaceae","Diplolepis bassetti; Cynipidae; Hymenoptera; Rosa; Rosaceae","Cynipidae; Rosaceae","2013-09-10"
"d910c_d821-179.jpg","9/10/13","9718555849 These are interesting insect galls on leaves of what I guess is some kind of <b>huckleberry</b> or <b>blueberry</b> - genus <i>Vaccinium</i> in the <i>Ericaceae</i> plant family. I found them in the Oregon woods near Lemolo Lake at about 4,000 ft. elevation. There are many species of Vaccinium in Pacific Northwest, so I won't try to guess which one this is with those notched leaves. (Lemolo Lake, North Umpqua River, Oregon, 21 August 2013)","34.542214","-119.75751","16","Lemolo Lake","United States","California","huckleberry; blueberry","Vaccinium; Ericaceae","Vaccinium; Ericaceae","Ericaceae","2013-09-10"
"d910d_d819-119+d329-019.jpg","9/10/13","9721612420 I was disturbed when I saw the <b>Madrone</b> (<i>Arbutus menziesii</i>) trees in the <i>Ericaceae</i> plant family turning brown from a leaf blight last March in the Oregon woods. They look better now in summer. This photo shows the same tree in March (left) and again in August (right). It looks fatal, but the trees do recover. Then again, it can't be doing them any good! Apparently this is a new blight, first noticed in 2009. Suspects include the fungi <i>Mycosphaerella arbuticola</i> and <i>Phacidiopycnis washingtonensis</i>, but it's my impression that the specific cause in still unknown. This is NOT caused by drought. We have madrones at home too, and I hope we didn't inadvertently bring any spores back! This most beautiful of trees should not look like it's dying! (Wright Creek Bridge, North Umpqua River, Oregon, 29 March 2013 and 19 August 2013) <p>Try a google search on <a href=""http://www.google.com/search?q=madrone+blight+oregon"">madrone blight oregon</a> for more info.","34.511666","-119.809373","16","Wright Creek Bridge","United States","California","Madrone","Arbutus menziesii; Ericaceae; Mycosphaerella arbuticola; Phacidiopycnis washingtonensis","Arbutus menziesii; Ericaceae; Mycosphaerella arbuticola; Phacidiopycnis washingtonensis","Ericaceae","2013-09-10"
"d910e_d819-122.jpg","9/10/13","9718318163 Here are new seeds and foliage of <b>Bigleaf Maple</b> (<i>Acer macrophyllum</i>) in the <i>Aceraceae</i>) plant family. It's fun to knock the seeds out of the trees in autumn and watch them twirl down like little helicopters. (Wright Creek Bridge, North Umpqua River, Oregon, 15 August 2013)","34.512709","-119.81315","16","Wright Creek Bridge","United States","California","Bigleaf Maple","Acer macrophyllum; Aceraceae","Acer macrophyllum; Aceraceae","Aceraceae","2013-09-10"
"d910f_d815-108.jpg","9/10/13","9718267853 This is the lovely foliage of native <b>Vine Maple</b> (<i>Acer circinatum</i>) in the <i>Aceraceae</i> plant family growing by our deck in the Oregon woods. The leaves look more like the maple leaf flag of Canada than the much larger <b>Bigleaf Maples</b> (<i>Acer macrophyllum</i>). They look and feel cool even when it's hot. (Near Susan Creek, North Umpqua River, Oregon, 15 August 2013)","34.538184","-119.746631","16","Near Susan Creek","United States","California","Vine Maple; Bigleaf Maples","Acer circinatum; Aceraceae; Acer macrophyllum","Acer circinatum; Aceraceae; Acer macrophyllum","Aceraceae","2013-09-10"
"d911a_d911-025.jpg","9/11/13","9729177600 Well blow me down... (as Popeye used to say) <p>I found this new <b>Acmon Blue</b> (<i>Plebejus acmon</i>) butterfly working the new staminate flowers of native <b>Coyote Bush</b> (<i>Baccharis pilularis</i>) in the <i>Asteraceae</i> plant family. You can see from the exposed bit of its upper wing why they are called Blues. I haven't seen one of these butterflies since July 19. (San Marcos Pass, 11 September 2013) <p>I'm still dealing with sciatica-type back and leg pains, but it is (very slowly) getting better. I'm still dealing with sciatica-type back and leg pains, but it is (very slowly) getting better. I have been getting out every day - hobbling with cane and tripod, but getting out.","34.518296","-119.793688","16","very slowly) getting better.  I have been getting out every day - hobbling with cane and tripod","United States","California","Acmon Blue; Coyote Bush","Plebejus acmon; Baccharis pilularis; Asteraceae","Plebejus acmon; Baccharis pilularis; Asteraceae","Asteraceae","2013-09-11"
"d911b_d911-012.jpg","9/11/13","9729110962 This is a fully adult <b>Assassin Bug</b> in the family <i>Reduviidae</i> of the old insect order <i>Hemiptera</i>. I found it today on a dusty leaf of native <b>Wild Blackberry</b> (<i>Rubus ursinus</i>) in the <i>Rosaceae</i> plant family about 10 feet away from the nymph in my [Previous] photo. It has the same red spots on its ankles, though it has lost the pretty black and white spots on its legs. I'm not sure what kind of reduviid it is. (San Marcos Pass, 11 September 2013) <p>Fall is the time for predators like these Assassin Bugs and spiders to pick off the pollinator insects, but in this drought summer the pollinators are already scarce because the flowers are scarce. We'll see what happens.","34.518491","-119.79431","16","San Marcos Pass","United States","California","Assassin Bug; Wild Blackberry","Reduviidae; Hemiptera; Rubus ursinus; Rosaceae","Reduviidae; Hemiptera; Rubus ursinus; Rosaceae","Reduviidae; Rosaceae","2013-09-11"
"d911c_d911-003.jpg","9/11/13","9729006502 This is another late-instar nymph of an <b>Assassin Bug</b> in the family <i>Reduviidae</i> of the old insect order <i>Hemiptera</i>. It has very short wings that will become larger in its final molt, and a remarkable proboscis folded under its head. This one is perched on a leaf of native <b>Wild Blackberry</b> (<i>Rubus ursinus</i>) in the <i>Rosaceae</i> plant family. I'm not sure about its taxonomy, but I may have captured a photo of the adult in my [Next] photo. It's quite beautiful. (San Marcos Pass, 11 September 2013)","34.542055","-119.757961","16","San Marcos Pass","United States","California","Assassin Bug; Wild Blackberry","Reduviidae; Hemiptera; Rubus ursinus; Rosaceae","Reduviidae; Hemiptera; Rubus ursinus; Rosaceae","Reduviidae; Rosaceae","2013-09-11"
"d911d_d911-008.jpg","9/11/13","9728943882 This is a different large <b>Crab Spider</b> (<i>Thomisidae</i>) on a non-native composite garden flower, maybe a small <b>Black-Eyed Susan</b> aka <b>Gloriosa Daisy</b> (<i>Rudbeckia hirta</i>) in the <i>Asteraceae</i> plant family, in the garden this morning. The dramatic light is just right. (San Marcos Pass, 11 September 2013)","34.541913","-119.757488","16","San Marcos Pass","United States","California","Crab Spider; Black-Eyed Susan; Gloriosa Daisy","Thomisidae; Rudbeckia hirta; Asteraceae","Thomisidae; Rudbeckia hirta; Asteraceae","Thomisidae; Asteraceae","2013-09-11"
"d911e_d911-032.jpg","9/11/13","9728910872 This is a fairly large <b>Crab Spider</b> (<i>Thomisidae</i>) on a twig of <b>Coast Live Oak</b> (<i>Quercus agrifolia</i>) tree in the <i>Fagaceae</i> plant family, with a neaby leaf of native <b>Mugwort</b> (<i>Artemisia douglasiana</i>) in the <i>Asteraceae</i> plant family below. It's abdomen looks empty, and I'm not surprised. All insects are scarce in the woods right now at the end of this drought year. (San Marcos Pass, 11 September 2013)","34.499801","-119.719165","16","San Marcos Pass","United States","California","Crab Spider; Coast Live Oak; Mugwort","Thomisidae; Quercus agrifolia; Fagaceae; Artemisia douglasiana; Asteraceae","Thomisidae; Quercus agrifolia; Fagaceae; Artemisia douglasiana; Asteraceae","Thomisidae; Fagaceae; Asteraceae","2013-09-11"
"d911f_d911-027.jpg","9/11/13","9725653261 Here are new flowers of <b>California Fuschia</b> (<i>Epilobium canum</i> aka <i>Zauschneria californica</i>) - in the <i>Onagraceae</i> plant family in the woods. They keep the hummingbirds going during late summer and autumn. Very beautiful, and surprising in our hot, dry summer. The white pollen grains are remarkable. (San Marcos Pass, 11 September 2013)","34.499624","-119.71895","16","San Marcos Pass","United States","California","California Fuschia","Epilobium canum; Zauschneria californica; Onagraceae","Epilobium canum; Zauschneria californica; Onagraceae","Onagraceae","2013-09-11"
"d912a_d912-046.jpg","9/12/13","9732793119 I believe this is an extraordinary <b>Spider Wasp</b> (family <i>Pompilidae</i>) in the order <i>Hymenoptera</i> - maybe genus <i>Aporus</i>. It's working new native composite flowers of <b>Scale Broom</b> (<i>Lepidospartum squamatum</i>) in the <i>Asteraceae</i> plant family a dry wash by the river. Both body and wings have that ""so blue it's black"" color. (Paradise, Santa Ynez River, 12 September 2013) <p><a href=""http://www.flickr.com/photos/treebeard/9390214432/"">Tarantula Hawks</a> should also be working these flowers, but I haven't seen them since we got back from Oregon - or any large tarantula spiders.","34.518579","-119.793859","16","Paradise","United States","California","Spider Wasp; Scale Broom","Pompilidae; Hymenoptera; Aporus; Lepidospartum squamatum; Asteraceae","Pompilidae; Hymenoptera; Aporus; Lepidospartum squamatum; Asteraceae","Pompilidae; Asteraceae","2013-09-12"
"d912b_d912-055.jpg","9/12/13","9735911882 This is an uncommon <b>Paper Wasp</b> (genus <i>Polistes</i>) in the family <i>Vespidae</i> of the order <i>Hymenoptera</i> - maybe <i>Polistes dorsalis californicus</i>. There are a number of these wasps with ""desert colors"" - all handsome. This one is working flowers of the native composite <b>Scale Broom</b> (<i>Lepidospartum squamatum</i>) shrub in the <i>Asteraceae</i> plant family on the dry wash by the river. (Paradise, Santa Ynez River, 12 September 2013) <p>That's a little <b>Bagrada Bug</b> (<i>Bagrada hilaris</i>) out-of-focus on the left. See my [Previous] photo.","34.512727","-119.81315","16","Paradise","United States","California","Paper Wasp; Scale Broom; Bagrada Bug","Polistes; Vespidae; Hymenoptera; Polistes dorsalis californicus; Lepidospartum squamatum; Asteraceae; Bagrada hilaris","Polistes; Vespidae; Hymenoptera; Polistes dorsalis californicus; Lepidospartum squamatum; Asteraceae; Bagrada hilaris","Vespidae; Asteraceae","2013-09-12"
"d912c_d912-053.jpg","9/12/13","9735820224 I believe this is a notorious <b>Bagrada Bug</b> (<i>Bagrada hilaris</i>) in the family <i>Pentatomidae</i> in the order <i>Hemiptera</i> on a flower of native composite <b>Scale Broom</b> (<i>Lepidospartum squamatum</i>) in the <i>Asteraceae</i> plant family on a dry hillside by the river. It has ""bug eyes!"" They look a lot like native <b>Harlequin Bugs</b> (<i>Murgantia histrionica</i>), but there are little differences. (Paradise, Santa Ynez River, 12 September 2013) <p>These bugs were in the local news last year. Apparently they are native to northern Africa, and are now munching kale, Brussels sprouts, and broccoli in Lompoc. See <a href=""http://www.independent.com/news/2012/sep/22/buggin-out/"">this link</a> and <a href=""http://www.edhat.com/site/tidbit.cfm?nid=100493"">this</a>. It's a new invasion, but they've been here for a while. If these bugs are really destructive pests as reported, I don't think there's a chance of containing them. They seem well established in the backcountry on native shrubs. I've seen them for at least two years - see my <a href=http://www.fotolog.com/treebeard/67882830/>old photo (29 Aug 2011)</a>.","34.512745","-119.81315","16","Paradise","United States","California","Bagrada Bug; Scale Broom; Harlequin Bugs","Bagrada hilaris; Pentatomidae; Hemiptera; Lepidospartum squamatum; Asteraceae; Murgantia histrionica","Bagrada hilaris; Pentatomidae; Hemiptera; Lepidospartum squamatum; Asteraceae; Murgantia histrionica","Pentatomidae; Asteraceae","2013-09-12"
"d912d_d912-017.jpg","9/12/13","9735710238 This is another beautiful <b>California Sister</b> (<i>Adelpha bredowii</i>) butterfly, still flying around through the woods. This one must be newly emerged with those fantastic blue colors on its forewings. (Compare <a href=""http://www.flickr.com/photos/treebeard/9249844893/"">this photo</a>.) They are odd butterflies that never seem to visit flowers. I guess they emerge with a full belly and fly until they are empty. They don't feed, but they do come down to ""puddle"" on the damp soil in the garden. (San Marcos Pass, 12 September 2013)","34.518579","-119.793859","16","San Marcos Pass","United States","California","California Sister","Adelpha bredowii","Adelpha bredowii",NA,"2013-09-12"
"d912e_d912-054.jpg","9/12/13","9735665352 I believe this is a <b>Northern White-Skipper</b> (<i>Heliopetes ericetorum</i>) butterfly working new yellow composite flowers of <b>Coastal Goldenbush</b> (<i>Isocoma menziesii</i>) in the <i>Asteraceae</i> plant family on a dry bluff above the Santa Ynez River. It was breezy, and it was difficult to get photos. The butterfly's upper wings are more interesting, but this is what I got. (Paradise, Santa Ynez River, 12 September 2013)","34.518579","-119.793859","16","Paradise","United States","California","Northern White-Skipper; Coastal Goldenbush","Heliopetes ericetorum; Isocoma menziesii; Asteraceae","Heliopetes ericetorum; Isocoma menziesii; Asteraceae","Asteraceae","2013-09-12"
"d912f_d912-039.jpg","9/12/13","9735568586 This is another pretty little <b>Mormon Metalmark</b> (<i>Apodemia mormo</i>) butterfly in the woods today - probably ""<b>Behr's Metalmark</b>"" (<i>Apodemia mormo virgulti</i> aka <i>Apodemia virgulti</i>). It's working new yellow composite flowers of <b>Coastal Goldenbush</b> (<i>Isocoma menziesii</i>) in the <i>Asteraceae</i> plant family on a dry bluff above the Santa Ynez River. (Paradise, Santa Ynez River, 12 September 2013) <p>These are by far the most common butterflies in the mountains right now, but I also got a good glimpse of a much rarer <b>Fatal Metalmark</b> (<i>Calephelis nemesis californica</i>) butterfly today on similar flowers. I couldn't get a photo before it took off, but it's good to know they're out there. As Arnold says in the movie Terminator, ""I'll be back!","34.518562","-119.793838","16","<i>Calephelis nemesis californica</i>) butterfly today on similar flowers.  I couldn't get a photo before it took off","United States","California","Mormon Metalmark; Behr's Metalmark; Coastal Goldenbush; Fatal Metalmark","Apodemia mormo; Apodemia mormo virgulti; Apodemia virgulti; Isocoma menziesii; Asteraceae; Calephelis nemesis californica","Apodemia mormo; Apodemia mormo virgulti; Apodemia virgulti; Isocoma menziesii; Asteraceae; Calephelis nemesis californica","Asteraceae","2013-09-12"
"d913a_d912-048.jpg","9/13/13","9736273823 These are new yellow composite flowers of native <b>Scale Broom</b> (<i>Lepidospartum squamatum</i>) in the <i>Asteraceae</i> plant family on a dry wash by the river. This shrub and no ray flowers and no leaves to speak of on the stems. It's one of my favorite late-summer shrubs that produce flowers when little else is. Butterflies and wasps like it. (Paradise, Santa Ynez River, 12 September 2013) <p>Today's photos are all yellow composite flowers that are flowering now, in the heat of late summer. These are flowers that keep the insects alive during the hardest part of the year. There are more, give me a few days.","34.503921","-119.865421","16","Paradise","United States","California","Scale Broom","Lepidospartum squamatum; Asteraceae","Lepidospartum squamatum; Asteraceae","Asteraceae","2013-09-13"
"d913b_d912-041.jpg","9/13/13","9736071771 Here are new yellow composite flowers of <b>Coastal Goldenbush</b> (<i>Isocoma menziesii</i>) in the <i>Asteraceae</i> plant family on a dry bluff above the Santa Ynez River. I think of this as a plant that grows near the ocean, but here it is in dry country. Maybe this one is really <i>Isocoma acradenia</i>? Anyway, here it is. (Paradise, Santa Ynez River, 12 September 2013)","34.512745","-119.81315","16","Paradise","United States","California","Coastal Goldenbush","Isocoma menziesii; Asteraceae; Isocoma acradenia","Isocoma menziesii; Asteraceae; Isocoma acradenia","Asteraceae","2013-09-13"
"d913c_d908-054.jpg","9/13/13","9736071771 These are new yellow composite flower heads of <b>Golden Fleece</b> (<i>Ericameria arborescens</i>) in the <i>Asteraceae</i> plant family. See <a href=""http://www.flickr.com/photos/treebeard/9703288525/"">this photo</a>. The shrubs are leafy with slender leaves and no ray flowers. It only grows in the higher mountains. A <b>Honey Bee</b> (<i>Apis mellifera</i>, <i>Hymenoptera</i>) is working the flowers. (Near La Cumbre Peak, Santa Ynez Mountains, 8 September 2013)","34.512745","-119.81315","16","Near La Cumbre Peak","United States","California","Golden Fleece; Honey Bee","Ericameria arborescens; Asteraceae; Apis mellifera; Hymenoptera","Ericameria arborescens; Asteraceae; Apis mellifera; Hymenoptera","Asteraceae","2013-09-13"
"d913d_d908-066.jpg","9/13/13","9736019731 These are new yellow flowers of native composite <b>California Goldenrod</b> (<i>Solidago californica</i>) in the <i>Asteraceae</i> plant family - with <b>Mormon Metalmark</b> (<i>Apodemia mormo</i>) butterflies - probably ""<b>Behr's Metalmark</b>"" (<i>Apodemia mormo virgulti</i> aka <i>Apodemia virgulti</i>). Butterflies and wasps like these late-season yellow flowers. (Near La Cumbre Peak, Santa Ynez Mountains, 8 September 2013)","34.512727","-119.81315","16","Near La Cumbre Peak","United States","California","California Goldenrod; Mormon Metalmark; Behr's Metalmark","Solidago californica; Asteraceae; Apodemia mormo; Apodemia mormo virgulti; Apodemia virgulti","Solidago californica; Asteraceae; Apodemia mormo; Apodemia mormo virgulti; Apodemia virgulti","Asteraceae","2013-09-13"
"d913e_d908-003.jpg","9/13/13","9735899767 These are new yellow composite flowers of native <b>Southern Goldenrod</b> (<i>Solidago confinis</i>) in the <i>Asteraceae</i> plant family. It's a slender plant with long slender leaves and no ray flowers that favors marshy places, but here it is in a bone-dry ditch along East Camino Cielo Road. (San Marcos Pass, 8 September 2013) <p>Did you notice that tiny <b>Ambush Bug</b> (family <i>Phymatidae</i>, <i>Hemiptera</i>) in the upper left of my photo? They like these yellow composite flowers.","34.512745","-119.81315","16","family <i>Phymatidae</i>","United States","California","Southern Goldenrod; Ambush Bug","Solidago confinis; Asteraceae; Phymatidae; Hemiptera","Solidago confinis; Asteraceae; Phymatidae; Hemiptera","Asteraceae; Phymatidae","2013-09-13"
"d913f_d912-061.jpg","9/13/13","9735824637 These are late-season composite flowers of native <b>Hairy Golden Aster</b> (<i>Heterotheca sessiliflora</i> ssp. <i>echoides</i>) in the <i>Asteraceae</i> plant family on the dry wash along the river. My photos today are all yellow flowered composites. This one has fewer flowers than my [Next] few photos, but it does qualify. It has hairy stems and flowers with ray flowers. (Paradise, Santa Ynez River, 12 September 2013) <p>It's related to another native composite <b>Telegraph Weed</b> (<i>Heterotheca grandiflora</i>) that is flowering now. That plant grows like a weed along roads, and it's surprising that it's native - but it is. I'll get a photo one of these days.","34.512745","-119.81315","16","<i>Heterotheca grandiflora</i>) that is flowering now.  That plant grows like a weed along roads","United States","California","Hairy Golden Aster; Telegraph Weed","Heterotheca sessiliflora; echoides; Asteraceae; Heterotheca grandiflora","Heterotheca sessiliflora; echoides; Asteraceae; Heterotheca grandiflora","Asteraceae","2013-09-13"
"d914a_d914-026.jpg","9/14/13","9753426092 This is a handsome <b>Paper Wasp</b> in the family <i>Vespidae</i> of the order <i>Hymenoptera</i> getting honey from a gall of the <b>Clasping Twig Gall Wasp</b> (<i>Disholcaspis prehensa</i>) in the family <i>Cynipidae</i> of the order <i>Hymenoptera</i>. This is happening on a twig of on a twig of <b>Scrub Oak</b> (<i>Quercus berberidifolia</i>) in the <i>Fagaceae</i> plant family. (San Marcos Pass, 14 September 2013) <p>I don't think this is our usual <b>Western Paper Wasp</b> (<i>Mischocyttarus flavitarsis</i>) at home because of the brown on its thorax. There are many large paper wasps, so I won't try to guess what this one is. There's also a little <b>fly</b> (order <i>Diptera</i>) on the stem below - maybe a <b>Freeloader Fly</b> (family <i>Milichiidae</i>)? <p>My camera has a [+/-] button which I use a lot to nudge a photo from the exposure it thinks is right. I push the button and rotate a little wheel with my thumb to change it. Damn, I rolled the wheel the wrong way again! This photo is overexposed and maybe over-corrected. I'm an old-time film photographer. I like to get the photo right from the start.","34.512462","-119.775406","16","family <i>Milichiidae</i>)?  <p>My camera has a [+/-] button which I use a lot to nudge a photo from the exposure it thinks is right.  I push the button and rotate a little wheel with my thumb to change it.  Damn","United States","California","Paper Wasp; Clasping Twig Gall Wasp; Scrub Oak; Western Paper Wasp; fly; Freeloader Fly","Vespidae; Hymenoptera; Disholcaspis prehensa; Cynipidae; Hymenoptera; Quercus berberidifolia; Fagaceae; Mischocyttarus flavitarsis; Diptera; Milichiidae","Vespidae; Hymenoptera; Disholcaspis prehensa; Cynipidae; Hymenoptera; Quercus berberidifolia; Fagaceae; Mischocyttarus flavitarsis; Diptera; Milichiidae","Vespidae; Cynipidae; Fagaceae; Milichiidae","2013-09-14"
"d914b_d914-032.jpg","9/14/13","9753252732 These are interesting new galls of the <b>Clasping Twig Gall Wasp</b> (<i>Disholcaspis prehensa</i>) in the family <i>Cynipidae</i> of the order <i>Hymenoptera</i>. The mushroom-like overlapping base of the gall distinguishes them from similar galls. They are growing on a twig of <b>Scrub Oak</b> (<i>Quercus berberidifolia</i>) in the <i>Fagaceae</i> plant family. (San Marcos Pass, 14 September 2013) <p>These galls produce real ""oak honey"" on their surface - I've tasted them. I guess the galls produce honey to attract ants which will protect them from other wasp predators. It's curious that there are no ants visible in this photo. Maybe I scared them away putting my tripod in place?","34.541613","-119.781457","16","San Marcos Pass","United States","California","Clasping Twig Gall Wasp; Scrub Oak","Disholcaspis prehensa; Cynipidae; Hymenoptera; Quercus berberidifolia; Fagaceae","Disholcaspis prehensa; Cynipidae; Hymenoptera; Quercus berberidifolia; Fagaceae","Cynipidae; Fagaceae","2013-09-14"
"d914c_d914-028.jpg","9/14/13","9753304535 These are more interesting galls on leaves of <b>Scrub Oak</b> (<i>Quercus berberidifolia</i>) in the <i>Fagaceae</i> plant family. I believe they are the galls of the <b>Woollybear Gall Wasp</b> (<i>Sphaeroteras timaculosum</i> aka <i>Atrusca trimaculosa</i>) in the <i>Cynipidae</i> family of the <i>Hymenoptera</i>. I found lots of them today. Unlike most galls, they seem to shrivel up the leaves that feed them. (San Marcos Pass, 14 September 2013)","34.515644","-119.778882","16","San Marcos Pass","United States","California","Scrub Oak; Woollybear Gall Wasp","Quercus berberidifolia; Fagaceae; Sphaeroteras timaculosum; Atrusca trimaculosa; Cynipidae; Hymenoptera","Quercus berberidifolia; Fagaceae; Sphaeroteras timaculosum; Atrusca trimaculosa; Cynipidae; Hymenoptera","Fagaceae; Cynipidae","2013-09-14"
