"File.Name","Date","Notes","Latitude","Longitude","Accuracy","Locality","Country","State","CommonNames","ScientificName","associatedTaxa","Families","Date_YYYYMMDD"
"6512b_6512-090.jpg","5/12/06","Remarkable flowers of a native <b>Larkspur</b> in the canyon. I guess this is <i>Delphinium patens</i> ssp. <i>hepaticoideum</i> but cp. <i>D. parryi</i>. It's not common. The color ranges from maroon to deep blue. The flowers offer sweet nectar at the end of the spur, but long-tongued insects have to snuffle past the stamens to reach it. Pollination happens. (San Marcos Pass, 12 May 2006)",NA,NA,NA,"San Marcos Pass","United States","California","Larkspur","Delphinium patens; hepaticoideum; D. parryi","Delphinium patens; hepaticoideum; D. parryi",NA,"2006-05-12"
"6512c_6512-093.jpg","5/12/06","Grass flowers - like fern seeds - seem like fairy stuff, but here they with yellow pollen-bearing male stamens and tiny furry white female stigmas. This grass is native <b>California Brome</b> (<i>Bromus carinatus</i>). We have to be careful weeding the garden not to confuse this native with the non-native bromes like <b>Ripgut Grass</b> (<i>Bromus diandrus</i>) and kin that are trying to take over. Wind-pollinated grass flowers seem simple, but they are considered ""highly evolved"" because they have gone a step further and lost everything that is not essential. (San Marcos Pass, 12 May 2006)",NA,NA,NA,"San Marcos Pass","United States","California","California Brome; Ripgut Grass","Bromus carinatus; Bromus diandrus","Bromus carinatus; Bromus diandrus",NA,"2006-05-12"
"6512d_6511-064.jpg","5/12/06","Looking close at the female <b>Western Fence Lizard</b> (<i>Sceloporus occidentalis</i>) - the lower of the pair in my [Previous] photo. It's beautiful how the occasional scale gets green or turquoise color. (San Marcos Pass, 11 May 2006) <P>I believe the diamond-shaped green patch between and behind her eyes is the mysterious ""third eye"" - see my photo at: <BR>&nbsp;&nbsp; http://www.fotolog.com/treebeard/?photo_id=9087674",NA,NA,NA,"San Marcos Pass","United States","California","Western Fence Lizard","Sceloporus occidentalis","Sceloporus occidentalis",NA,"2006-05-12"
"6513a_6513-004.jpg","5/13/06","I took my usual weekend morning coffee on the porch looking for little songbirds in the trees when this non-native <b>Rock Dove</b> aka <b>City Pigeon</b> (<i>Columba livia</i>) almost knocked my camera over when it tried to land right next to me! Here it is sitting on an old plastic chair from school. Note the bands on both its legs. There was deep fog on both sides of the mountains this morning. I reckon this homing pigeon was waiting in the sun for the fog to clear. (San Marcos Pass, 13 May 2006)",NA,NA,NA,"San Marcos Pass","United States","California","Rock Dove; City Pigeon","Columba livia","Columba livia",NA,"2006-05-13"
"6514a_6514-018.jpg","5/14/06","New <b>Edith's Checkerspot</b> (<i>Occidryas editha</i>) butterfly in the canyon today. (San Marcos Pass, 14 May 2006) <P>I took my morning walk and saw many butterflies - but got few photos. I'm preoccupied with the school slide show I'm putting together. I spent most of the day staring at my computer. Que lastima!",NA,NA,NA,"San Marcos Pass","United States","California","Edith's Checkerspot","Occidryas editha","Occidryas editha",NA,"2006-05-14"
"6515a_6514-016.jpg","5/15/06","<b>Convergent Lady Beetles</b> (<i>Hippodamia convergens</i> in the family <i>Coccinellidae</i>) making more Lady Beetles on a plant in the canyon. Note how the female (?) on the right has black spots that the male (?) on the left almost completely lacks. The question marks (?) are a reminder not to take anything for granted. Tilt your head to the left to admire the robot faces they have painted on head and thorax! (San Marcos Pass, 14 May 2006) <P>In some winters I find thousands of these ""Lady Bugs"" converging in our canyon. This year I saw none. I'm glad a few have returned. See my photo at: <BR>&nbsp;&nbsp; http://www.fotolog.com/treebeard/?photo_id=5622374",NA,NA,NA,"San Marcos Pass","United States","California","Convergent Lady Beetles","Hippodamia convergens; Coccinellidae","Hippodamia convergens; Coccinellidae","Coccinellidae","2006-05-15"
"6515b_6514-010.jpg","5/15/06","Little <b>Silvery Blue</b> (<i>Glaucopsyche lygdamus</i>) butterfly working tiny flowers of <b>Lavender</b> (<i>Lavandula officinalis</i> or kin) in the garden. You can see it's whisker-thin proboscis. These little butterflies really are blue on top, and they look blue when they fly. The color almost disappears when they land with wings folded like this. You can see a hint of blue on the body and just a sliver of upper wing showing along the top edge of its front forewing. This individual seem unusually pale (or worn?) underneath. (San Marcos Pass, 14 May 2006) <P>Lavender has showy ""petals"" on top that are really just leafy bracts. That's the color in the background. This butterfly has found the small real flowers down below. The flowers are so purple that they are almost black. See my photo at: <BR>&nbsp;&nbsp; http://www.fotolog.com/treebeard/?pid=10557094",NA,NA,NA,"San Marcos Pass","United States","California","Silvery Blue; Lavender","Glaucopsyche lygdamus; Lavandula officinalis","Glaucopsyche lygdamus; Lavandula officinalis",NA,"2006-05-15"
"6516a_6514-020.jpg","5/16/06","First flower of native <b>Fairy Lantern</b> (<i>Calochortus albus</i>) - a kind of <i>Mariposa Lily</i> in the <i>Liliaceae</i> family - on the dry side of our garden. They might be my favorite wildflower - not showy like the poppies, but elegant. They have six petals like all lilies, but the upper three are sepal-like, and the other three form a tender trap to guide pollinator-insects to the sweet nectar glands at the base of the petals. One of the glands is visible in this photo. See my [Previous] photo to understand the trap. (San Marcos Pass, 14 May 2006)",NA,NA,NA,"San Marcos Pass","United States","California","Fairy Lantern","Calochortus albus; Mariposa Lily; Liliaceae","Calochortus albus; Mariposa Lily; Liliaceae","Liliaceae","2006-05-16"
"6516b_6515-024.jpg","5/16/06","Looking almost straight up into a new flower of native <b>Fairy Lantern</b> (<i>Calochortus albus</i>) - a kind of <i>Mariposa Lily</i> in the <i>Liliaceae</i> family. The flower is a trap, but it's a ""tender trap"" not a deadly one. Insects push in between the fringed petals past the inward-pointing hairs to get to the nectar glands and goodies inside. It's harder getting out, and pollination happens. (San Marcos Pass, 15 May 2006)",NA,NA,NA,"San Marcos Pass","United States","California","Fairy Lantern","Calochortus albus; Mariposa Lily; Liliaceae","Calochortus albus; Mariposa Lily; Liliaceae","Liliaceae","2006-05-16"
"6517a_6517-034.jpg","5/17/06","First new flowers of native <b>Rock Phacelia</b> (<i>Phacelia imbricata</i>) in the <b>Waterleaf</b> (<i>Hydrophyllaceae</i>) family. True to its common name, it grows on rocky outcrops and slides that are naturally disturbed. It also does well along mountain roads that are disturbed by people and cars. This one is doing well on the dry side of our garden. It's one of the hairiest plants I know - even the stamens are hairy! (San Marcos Pass, 17 May 2006) <P>Insects are still scarce, but the warm weather this week is starting to bring them out. The dark pellets scattered below the flowers are insect ""frass"" - poop - from unknown insect larvae still waiting for their wings.",NA,NA,NA,"San Marcos Pass","United States","California","Rock Phacelia; Waterleaf","Phacelia imbricata; Hydrophyllaceae","Phacelia imbricata; Hydrophyllaceae","Hydrophyllaceae","2006-05-17"
"6518a_6518-053.jpg","5/18/06","Impressive thunderstorm growing over Figueroa Mountain this afternoon as seen from the poppy field at school. It looks like a massive explosion or eruption over the mountains! The growing mushroom-cap crown on top shows strong uplift. As moist surface air rises into an area of lower pressure, the air cools and the water vapor is ""squeezed out"" as rain and storm. I talked with a Forest Service person today and heard there have been lighting stricks and small fires in the backcountry. (Santa Ynez Valley, 18 May 2006) <P>I expect summer thunderstorms as it warms up for summer, but blow me down, there's a chance of rain from another real storm this weekend. I'm off on another school trip to the desert next week, and I have that feeling of deja vu. What a strange weather year this has been!",NA,NA,NA,"Santa Ynez Valley","United States","California",NA,NA,NA,NA,"2006-05-18"
"6518b_6518-058.jpg","5/18/06","Beautiful thunderstorm rising over Big Pine Mountain, looking from the upper end of Lake Cachuna. I followed this storm home from school today. Pretty as it is, it's becoming less threatening as it moves. See my [Next] photo. (Santa Ynez Valley, 18 May 2006)",NA,NA,NA,"Santa Ynez Valley","United States","California",NA,NA,NA,NA,"2006-05-18"
"6519a_6519-150.jpg","5/19/06","Finally we have new flowers on the native <b>Snowdrop Bush</b> (<i>Styrax officinalis</i> var. <i>redivivus</i>) in the <b>Storax</b> (<i>Styracaceae</i>) family. The flowers are fragrant and beautiful and unusual. (San Marcos Pass, 19 May 2006) <P>These head-high shrubs are common here on San Marcos Pass both in the woodland and into the chaparral. They have a very spotty distrubution in Southern California, common here and there, but not in-between. They demonstrate the naturalist adage that ""rare"" really means ""rarely common"". It's true. <P>The full species name is ""<i>Styrax officinalis</i> L. var. <i>redivivus</i> (Torrey) H. Howard"". The strange thing is that this is a California variety of the same species that grows in the Mediterranean region . The species name dates back to Linnaeus (L.) and the genus name ""Styrax"" goes way back to Theophrastus in ancient Greece. The Mediterranean species is the source of ""<i>gum storax</i>"". You'd recognize the perfume-like smell. <P>This is an example of an ""intercontinental disjunction"". How can a single species grow just here and there across the world? I reckon it was once widespread and then became isolated due to changing conditions. It's interesting that this plant has spotty distrubution both in California and across the world. These unusual native plants with ""disjunct distributions"" tell us something about the history of the earth. There's more info at: <BR>&nbsp;&nbsp; http://www.botgard.ucla.edu/html/MEMBGNewsletter/Volume5number2/Styraxofficinalis.html",NA,NA,NA,"San Marcos Pass","United States","California","Snowdrop Bush; Storax","Styrax officinalis; redivivus; Styracaceae; Styrax officinalis; redivivus; gum storax","Styrax officinalis; redivivus; Styracaceae; Styrax officinalis; redivivus; gum storax","Styracaceae","2006-05-19"
"6520a_6511-051.jpg","5/20/06","New flowers of native <b>Sugar Bush</b> (<i>Rhus Ovata</i>) in the <b>Sumac</b> (<i>Anacardiaceae</i>) family. The waxy buds formed way back in autumn, but they wait until now to open. (San Marcos Pass, 18 May 2006)",NA,NA,NA,"San Marcos Pass","United States","California","Sugar Bush; Sumac","Rhus Ovata; Anacardiaceae","Rhus Ovata; Anacardiaceae","Anacardiaceae","2006-05-20"
"6521a_6521-051.jpg","5/21/06","This male (I guess) <b>House Wren</b> (<i>Troglodytes aedon</i>) bird has just delivered a caterpillar snack to the female (I guess) wren sitting on new eggs inside. I have no time for photos today, but these wrens came to me. They took over a bird nest sitting on our upstairs' porch railing about six feet or two meters away from the door and my usual chair. I had to back away for this photo! Now we have three nesting wrens at home. (San Marcos Pass, 21 May 2006) <P>I'm taking our graduating 8th grade school kids to our cabin in the Alabama Hills at the base of Mt. Whitney near Lone Pine next week. It's raining tonight, I hope it will clear for our trip. It's been that kind of year. I'm sure I'll come back with new photos to share in a week.",NA,NA,NA,"San Marcos Pass","United States","California","House Wren","Troglodytes aedon","Troglodytes aedon",NA,"2006-05-21"
"6527a_6523-101.jpg","5/27/06","<b>Honey Bee</b> (<i>Apis mellifera</i>) with full ""pollen baskets"" working a flower head of <b>Bush Sunflower</b> (<i>Encelia actoni</i>) in the Alabama Hills desert at the base of Mount Whitney. This bee is obviously collecting pollen, but it's also using its proboscis to suck nectar from the composite florets. (Owens Valley, 23 May 2006) <P>I'm back from my school trip to our cabin in the Alabama Hills at the base of Mt. Whitney near Lone Pine. Now I have a slide show to finish, then graduation. And summer!",NA,NA,NA,"Owens Valley","United States","California","Honey Bee; Bush Sunflower","Apis mellifera; Encelia actoni","Apis mellifera; Encelia actoni",NA,"2006-05-27"
"6527b_6525-111.jpg","5/27/06","Little <b>Crab Spider</b> (<i>Thomisidae</i>) in a flower head of native <b>Mojave Thistle</b> (<i>Cirsium mohavense</i>). This spider looks like it's hanging on in a great wind, but it's really just sitting on the composite florets of the flower. It has a happy face on its back! (Owens Valley, 23 May 2006)",NA,NA,NA,"Owens Valley","United States","California","Crab Spider; Mojave Thistle","Thomisidae; Cirsium mohavense","Thomisidae; Cirsium mohavense","Thomisidae","2006-05-27"
"6527c_6523-104.jpg","5/27/06","Little <b>ants</b> (family <i>Formicidae</i> in the order <i>Hymenoptera</i>) on a new flower bud of this <b>Silver Cholla</b> (<i>Opuntia echinocarpa</i>) cactus. There are ants everywhere in the desert! (Owens Valley, 23 May 2006)",NA,NA,NA,"Owens Valley","United States","California","ants; Silver Cholla","Formicidae; Hymenoptera; Opuntia echinocarpa","Formicidae; Hymenoptera; Opuntia echinocarpa","Formicidae","2006-05-27"
"6528a_6523-079.jpg","5/28/06","There's a beetle (<i>Coleoptera<i>) rave happening inside this flower of <b>Beavertail Cactus</b> (<i>Opuntia basilaris</i>)! It's like one of those candy ""Easter eggs"" with a scene inside. (Owens Valley, 23 May 2006)",NA,NA,NA,"Owens Valley","United States","California","Beavertail Cactus","Coleoptera) rave happening inside this flower of <b>Beavertail Cactus</b> (Opuntia basilaris","Coleoptera) rave happening inside this flower of <b>Beavertail Cactus</b> (Opuntia basilaris",NA,"2006-05-28"
"6528b_6523-077.jpg","5/28/06","Little <b>ants</b> (family <i>Formicidae</i> in the order <i>Hymenoptera</i>) on flowers of <b>American Dogwood</b> - aka <b>Creek Dogwood</b> or <b>Redosier Dogwood</b> - (<i>Cornus sericea</i>) in the <b>Dogwood</b> (<i>Cornaceae</i>) family. This shrub lacks the large white petal-like bracts that some species have. There are ants everywhere! (Owens Valley, 23 May 2006)",NA,NA,NA,"Owens Valley","United States","California","ants; American Dogwood; Creek Dogwood; Redosier Dogwood; Dogwood","Formicidae; Hymenoptera; Cornus sericea; Cornaceae","Formicidae; Hymenoptera; Cornus sericea; Cornaceae","Formicidae; Cornaceae","2006-05-28"
"6528c_6523-098.jpg","5/28/06","Incoming <b>Honey Bee</b> (<i>Apis mellifera</i>) with full ""pollen baskets"" working a flower head of <b>Bush Sunflower</b> (<i>Encelia actoni</i>) in the Alabama Hills desert at the base of Mount Whitney. See my [Previous] photo. (Owens Valley, 23 May 2006)",NA,NA,NA,"Owens Valley","United States","California","Honey Bee; Bush Sunflower","Apis mellifera; Encelia actoni","Apis mellifera; Encelia actoni",NA,"2006-05-28"
"6529a_6524-092.jpg","5/29/06","This female <b>Blue Grouse</b> (<i>Dendragapus obscurus</i>) bird attacked us on the Mount Whitney trail to Lone Pine Lake! I reckon she was trying to to move us away from her nest. She's the size of a banty chicken! (Owens Valley, 24 May 2006)",NA,NA,NA,"Owens Valley","United States","California","Blue Grouse","Dendragapus obscurus","Dendragapus obscurus",NA,"2006-05-29"
"6530a_6523-096.jpg","5/30/06","Looking into a surreal flower head of native <b>Mojave Thistle</b> (<i>Cirsium mohavense</i>) growing at the base of a rock outcrop in the Alabama Hills desert at the base of Mount Whitney. There's nothing commonplace about these thistles. (Owens Valley, 25 May 2006)",NA,NA,NA,"Owens Valley","United States","California","Mojave Thistle","Cirsium mohavense","Cirsium mohavense",NA,"2006-05-30"
"6530b_6525-128.jpg","5/30/06","Beautiful composite flower head of native <b>Mojave Aster</b> (<i>Xylorhiza tortifolia</i>). The flower seems to glow with it's own light. (Owens Valley, 25 May 2006)",NA,NA,NA,"Owens Valley","United States","California","Mojave Aster","Xylorhiza tortifolia","Xylorhiza tortifolia",NA,"2006-05-30"
"6531a_6525-175.jpg","5/31/06","Native <b>Desert Needlegrass</b> (<i>Achnatherum speciosum</i> aka <i>Stipa speciosa</i>) in the Alabama Hills desert with the sun behind. I love the twisted and bent awns. The native grasses have so much more character than the usual introduced weedy annuals. (Owens Valley, 25 May 2006) <P>My school slide show is almost done - 1,891 photos in 23 segments with music sequenced to video - 60 minutes and 37 seconds - showtime is Thursday night at 7:00 pm, and graduation is Friday morning. I look forward to getting out in the woods with my camera again!",NA,NA,NA,"Owens Valley","United States","California","Desert Needlegrass","Achnatherum speciosum; Stipa speciosa","Achnatherum speciosum; Stipa speciosa",NA,"2006-05-31"
"6601a_6523-080.jpg","6/1/06","Golden composite flower heads of (I think) <b>Cooper's Goldenbush</b> (<i>Ericameria cooperi</i>) growing in the Alabama Hills desert at the base of Mount Whitney on the east side of the Sierras last week. This plant is being attacked by golden tendrils of a parasitic <b>Dodder</b> (<i>Cuscuta</i> sp.) plant in the <i>Cuscutaceae</i> family. It's creepy. Dodder grows without green chlorophyll or a connection to the earth, but it sucks nutrients from other green plants like this. It grows in the salt marshes and mountains at home, and here it is in the desert as well. (Owens Valley, 23 May 2006) <P>My school slide show is done. Graduation is tomorrow. I look forward to a walk in the woods with my camera this weekend - and many more to follow - to get a few new photos!",NA,NA,NA,"Owens Valley","United States","California","Cooper's Goldenbush; Dodder","Ericameria cooperi; Cuscuta; Cuscutaceae","Ericameria cooperi; Cuscuta; Cuscutaceae","Cuscutaceae","2006-06-01"
"6602a_6602-009.jpg","6/2/06","Beautiful <b>Wild Bee</b> (<i>Apoidea</i>, order <i>Hymenoptera</i>) working a flower of native <b>Rock Phacelia</b> (<i>Phacelia imbricata</i>) in the <b>Waterleaf</b> (<i>Hydrophyllaceae</i>) family. These interesting native bees hover and fly like the <b>Syrphid Flower Flies</b> (family <i>Syrphidae</i>, order <i>Diptera</i>) that mimic other bees. It's a bee that mimics a fly that mimics a bee! (San Marcos Pass, 2 June 2006) <P>It's summer!",NA,NA,NA,"San Marcos Pass","United States","California","Wild Bee; Rock Phacelia; Waterleaf; Syrphid Flower Flies","Apoidea; Hymenoptera; Phacelia imbricata; Hydrophyllaceae; Syrphidae; Diptera","Apoidea; Hymenoptera; Phacelia imbricata; Hydrophyllaceae; Syrphidae; Diptera","Hydrophyllaceae; Syrphidae","2006-06-02"
"6602b_6602-007.jpg","6/2/06","This ""<b>Wild Bee</b>"" (<i>Apoidea</i>, order <i>Hymenoptera</i>) working a flower of native <b>Rock Phacelia</b> (<i>Phacelia imbricata</i>) seemed too big and clumsy when I took the photo on the dry side of our garden this afternoon. Look close... can you see what this is? <P>.<P>.<P>.<P>.<P>Two wild bees are mating - look for the antennae on top and bottom! (San Marcos Pass, 2 June 2006)",NA,NA,NA,"San Marcos Pass","United States","California","Wild Bee; Rock Phacelia","Apoidea; Hymenoptera; Phacelia imbricata","Apoidea; Hymenoptera; Phacelia imbricata",NA,"2006-06-02"
"6603a_6603-041.jpg","6/3/06","Little hummer - I guess a female <b>Anna's Hummingbird</b> (<i>Calypte anna</i>) - collecting soft fluff from a native <b>Cattail</b> (<i>Typha domingensis</i>?) seed head in our little ""pond"" for her nest. Note the yellow pollen on her head - she's been working the flowers! See my [Previous] photo. (San Marcos Pass, 3 June 2006) <P>It's not much of a pond - just a meter-square fiberglass tub a few inches deep filled with native water plants. It's good for wildlife and photos. You should have one.",NA,NA,NA,"San Marcos Pass","United States","California","Anna's Hummingbird; Cattail","Calypte anna; Typha domingensis","Calypte anna; Typha domingensis",NA,"2006-06-03"
"6603b_6603-042.jpg","6/3/06","Little hummer - I guess a female <b>Anna's Hummingbird</b> (<i>Calypte anna</i>) - with a beak-full of soft fluff from a native <b>Cattail</b> (<i>Typha domingensis</i>?) in our little ""pond"". Note the yellow pollen on the hummer's head. She's been working the flowers! See my [Next] photo. (San Marcos Pass, 3 June 2006)",NA,NA,NA,"San Marcos Pass","United States","California","Anna's Hummingbird; Cattail","Calypte anna; Typha domingensis","Calypte anna; Typha domingensis",NA,"2006-06-03"
"6603c_6603-021.jpg","6/3/06","Clown-colored <b>Variable Checkerspot</b> (<i>Euphydryas chalcedona</i>) butterfly licking our concrete wellhead by the creek. The well doesn't leak, and the creek is running, so maybe it's after salt rather than water? See my [Previous] photo for more of the story. (San Marcos Pass, 3 June 2006) <P>I was surprised to see several of these Checkerspot butterflies in the woods today. Usually I first see the colonial web-spinning caterpillars on native <b>Climbing Penstemon</b> (<i>Keckiella cordifolia</i>) shrubs, but I haven't seen any new caterpillars yet. It's been a strange year with late rain and late insects. Que pasa?",NA,NA,NA,"<i>Keckiella cordifolia</i>) shrubs","United States","California","Variable Checkerspot; Climbing Penstemon","Euphydryas chalcedona; Keckiella cordifolia","Euphydryas chalcedona; Keckiella cordifolia",NA,"2006-06-03"
"6603d_6603-025.jpg","6/3/06","Face to face with a new clown-colored <b>Variable Checkerspot</b> (<i>Euphydryas chalcedona</i>) butterfly trying to roll up its proboscis/tongue. Look close. Butterflies fold their long proboscis into two tight tubes to suck nectar, but this veteran is missing half its stuff. (Butterfly left, screen right.) I wonder if this is like trying to drink through a straw with a hole in it? Maybe this is why I managed to get so close? (San Marcos Pass, 3 June 2006)",NA,NA,NA,"San Marcos Pass","United States","California","Variable Checkerspot","Euphydryas chalcedona","Euphydryas chalcedona",NA,"2006-06-03"
"6603e_6603-037.jpg","6/3/06","<b>Lorquin's Admiral</b> (<i>Basilarchia lorquini</i>) butterfly perched on a <b>Coast Live Oak</b> (<i>Quercus agrifolia</i>) branch by the creek. I kept moving in closer until it flew off, but it always came back to the same roost. This feisty butterfly was trying to chase everything away from its territory - even birds! (San Marcos Pass, 3 June 2006)",NA,NA,NA,"San Marcos Pass","United States","California","Lorquin's Admiral; Coast Live Oak","Basilarchia lorquini; Quercus agrifolia","Basilarchia lorquini; Quercus agrifolia",NA,"2006-06-03"
"6603f_6603-031.jpg","6/3/06","Some kind of ""<b>Blue</b>"" (subfamily <i>Polyommatinae</i>) butterfly? - even though there's no blue on it. It's resting on a not-quite-flowering stem of <b>Deerweed</b> (<i>Lotus scoparius</i>) in the (<b>Pea</b> (<i>Fabaceae</i>) family. The broad orange bands on upper and lower hindwings don't match anything in my books. In the air, it looks brownish with an orange tail. My first thought was a <b>Copper</b>. (San Marcos Pass, 3 June 2006)",NA,NA,NA,"San Marcos Pass","United States","California","Blue; Deerweed; Pea; Copper","Polyommatinae; Lotus scoparius; Fabaceae","Polyommatinae; Lotus scoparius; Fabaceae","Fabaceae","2006-06-03"
"6604a_6604-058.jpg","6/4/06","Tiny caterpillar munching a leaflet of <b>Canyon Lupine</b> (<i>Lupinus latifolius</i>) near home. It's using special effects to look scary to preditors. It's real head is hunkered down to munch lupine in this photo. But it has groups of thicker black hairs in front to mimic claws and bigger red bumps to mimic eyes. See my [Previous] two photos to appreciate the effect! (San Marcos Pass, 4 June 2006) <P>Zooming into the original hi-res photos, I can see that the body hairs are simple, but the ""antennae"" hairs are plumose with side hairs and tufts at the end. That's why they look thicker. Impressive design for a humble caterpillar!",NA,NA,NA,"San Marcos Pass","United States","California","Canyon Lupine","Lupinus latifolius","Lupinus latifolius",NA,"2006-06-04"
"6604b_6604-065.jpg","6/4/06","Tiny caterpillar on a leaflet of <b>Canyon Lupine</b> (<i>Lupinus latifolius</i>) near home. It's less than a centimeter long, but it sure looks like a nightmare psychedelic scorpion to me! (Or maybe a lobster?) It has an upturned tail, and special dark hairs in front to mimic claws, and big red ""eyes"" that are really just bumps like all the others on its back - but these are in just the right place to be eyes. Sometimes you just have to smile at Mama Nature's tricks. I wonder if the disguise really helps protect them from preditors? (San Marcos Pass, 4 June 2006)",NA,NA,NA,"San Marcos Pass","United States","California","Canyon Lupine","Lupinus latifolius","Lupinus latifolius",NA,"2006-06-04"
"6604c_6604-062.jpg","6/4/06","Tiny caterpillar on a leaflet of <b>Canyon Lupine</b> (<i>Lupinus latifolius</i>) near home. I got too close with my camera and it starting writhing like a demon! That's the tail on top and the head below. It's less than a centimeter long, but it still looks pretty frightening. That's special effects! See my [Next] two photos. (San Marcos Pass, 4 June 2006)",NA,NA,NA,"San Marcos Pass","United States","California","Canyon Lupine","Lupinus latifolius","Lupinus latifolius",NA,"2006-06-04"
