"File.Name","Date","Notes","Latitude","Longitude","Accuracy","Locality","Country","State","CommonNames","ScientificName","associatedTaxa","Families","Date_YYYYMMDD"
"6c05a_6c03-055.jpg","12/5/06","Beautiful - or scary? <b>Green Lynx Spider</b> (<i>Peucetia viridens</i> in the family <i>Oxyopidae</i>) tending her nest in a bristly winter-ripe plant of <b>Cocklebur</b> (<i>Xanthium strumarium</i>) in the <b>Sunflower</b> (<i>Asteraceae</i>) plant family. See my [Previous] photo. Even spiders are getting scarce in our almost-winter woods. We're still waiting for real rain in the mountains to bring on the new growing season. (Santa Ynez Valley, 3 December 2006)",NA,NA,NA,"Santa Ynez Valley","United States","California","Green Lynx Spider; Cocklebur; Sunflower","Peucetia viridens; Oxyopidae; Xanthium strumarium; Asteraceae","Peucetia viridens; Oxyopidae; Xanthium strumarium; Asteraceae","Oxyopidae; Asteraceae","2006-12-05"
"6c05b_6c03-051.jpg","12/5/06","Bristly <b>Green Lynx Spider</b> (<i>Peucetia viridens</i> in the family <i>Oxyopidae</i>) tending her nest in a bristly winter-ripe plant of <b>Cocklebur</b> (<i>Xanthium strumarium</i>) in the <b>Sunflower</b> (<i>Asteraceae</i>) plant family. The plant is said to be native, but it's weedy in disturbed places like the river wash. I had to plck dozens of the seed heads from my pants and socks after taking this photo. It`s said to be the original inspiration for <i>velcro</i>. (Santa Ynez Valley, 3 December 2006)",NA,NA,NA,"Santa Ynez Valley","United States","California","Green Lynx Spider; Cocklebur; Sunflower","Peucetia viridens; Oxyopidae; Xanthium strumarium; Asteraceae; velcro","Peucetia viridens; Oxyopidae; Xanthium strumarium; Asteraceae; velcro","Oxyopidae; Asteraceae","2006-12-05"
"6c06a_6c03-032.jpg","12/6/06","Fall-color leaves of <b>Western Sycamore</b> (<i>Platanus racemosa</i>) near the river. (Santa Ynez Valley, 3 December 2006)",NA,NA,NA,"Santa Ynez Valley","United States","California","Western Sycamore","Platanus racemosa","Platanus racemosa",NA,"2006-12-06"
"6c07a_6b19-054.jpg","12/7/06","Male ""pollen cones"" on a non-native pine tree (<i>Pinaceae</i> family) growing near an old homestead in the mountains. The pines and a few other unexpected naturalized plants are about the only clue that someone once lived here and called this place home. A typical woody pine cone is large and woody and female, with seeds or nuts. A male pollen cone (aka <i>microstrobilus</i>) is small and herbaceous, with lots of pollen. Sometimes you can hit a branch and see it release a cloud of yellow pollen! (San Marcos Pass, 25 November 2006)",NA,NA,NA,"San Marcos Pass","United States","California",NA,"Pinaceae; microstrobilus","Pinaceae; microstrobilus","Pinaceae","2006-12-07"
"6c07b_6b19-062.jpg","12/7/06","We usually notice the bright flowers, but the ripe seeds have their own beauty. These are the dandelion-like composite seeds of a native <b>Sawtooth Goldenbush</b> (<i>Hazardia squarrosa</i> var. <i>Grindelioides</i>) shrub in the <b>Sunflower</b> (<i>Asteraceae</i>) family. (San Marcos Pass, 19 November 2006)",NA,NA,NA,"San Marcos Pass","United States","California","Sawtooth Goldenbush; Sunflower","Hazardia squarrosa; Grindelioides; Asteraceae","Hazardia squarrosa; Grindelioides; Asteraceae","Asteraceae","2006-12-07"
"6c07c_6b20-089.jpg","12/7/06","Winged seeds of a native <b>Bigleaf Maple</b> (<i>Acer macrophyllum</i>) tree in the <b>Maple</b> (<i>Aceraceae</i>) family. It's fun to knock the branches with a stick and watch the seeds flutter down like little helicopters. (San Marcos Pass, 19 November 2006)",NA,NA,NA,"San Marcos Pass","United States","California","Bigleaf Maple; Maple","Acer macrophyllum; Aceraceae","Acer macrophyllum; Aceraceae","Aceraceae","2006-12-07"
"6c08a_6c02-006.jpg","12/8/06","Even at the end of our summer-dry season, there are native flowers to be found. These are well-named <b>Woolly Blue Curls</b> (<i>Trichostema lanatum</i>), a shrub in the <b>Mint</b> (<i>Lamiaceae</i>) family. There are no pollinators in the woods now that fit these remarkable flowers. (San Marcos Pass, 2 December 2006) <P>The good news is that we're expecting rain tonight. I already felt a few drops!",NA,NA,NA,"San Marcos Pass","United States","California","Woolly Blue Curls; Mint","Trichostema lanatum",NA,"Lamiaceae","2006-12-08"
"6c09a_6c09-007.jpg","12/9/06","Fallen <b>Apple</b> (<i>Malus pumila</i>) fruit in the <b>Rose</b> (<i>Rosaceae</i>) family lying in a compost of fallen autumn apple leaves in the garden. This is one way to spread seeds. The other way is for the tree to make delicious fruit that we carry and eat and spit out the seeds to grow. The parent apple tree appeared 25 years ago when we built our home from a spit seed or tossed core during lunch break. It has tasty fruit. The real Johnny Appleseed - aka John Chapman - would be proud! (San Marcos Pass, 9 December 2006) <P>The clouds came down to the mountains today - good for the woods, but not for photos. After drizzle and clouds and wind all day - few photos - I'm hoping for real rain tonight.",NA,NA,NA,"San Marcos Pass","United States","California","Apple; Rose","Malus pumila; Rosaceae","Malus pumila; Rosaceae","Rosaceae","2006-12-09"
"6c09b_6c09-003.jpg","12/9/06","A tiny forest of fruiting <b>moss</b> (<i>Bryophyta<i>) sporophytes in the canyon. I can not tell a lie. This moss is growing on the concrete lid over an access point to our shared water system in the canyon. I arranged the oak leaves to look natural. Maybe there's a small leek that keeps them happy here? Most mosses, fungi, lichens, and seedlings in our mountains are dormant, waiting for real winter rain to end our summer dry-season. Maybe tonight? (San Marcos Pass, 9 December 2006)",NA,NA,NA,"San Marcos Pass","United States","California","moss",NA,NA,NA,"2006-12-09"
"6c09c_6c09-006.jpg","12/9/06","Old frond of summer dry-season <b>Western Bracken Fern</b> (<i>Pteridium aquilinum</i> var. <i>pubescens</i>) losing color in the woods just as the new winter wet-season ferns are waking up. (San Marcos Pass, 9 December 2006)",NA,NA,NA,"San Marcos Pass","United States","California","Western Bracken Fern","Pteridium aquilinum; pubescens","Pteridium aquilinum; pubescens",NA,"2006-12-09"
"6c10a_6c10-017.jpg","12/10/06","A clutch of <b>Convergent Lady Beetles</b> - aka ""ladybugs"" - (<i>Hippodamia convergens</i>) huddling on a branch of <b>Coast Live Oak</b> (<i>Quercus agrifolia</i>) in the canyon, with raindrops. We had a huge convergence of these beetles a few months ago. They seem to be coming back for winter. (San Marcos Pass, 10 December 2006) <P>We had an inch of rain last night and more today. Today's photos show some of what the rain brings out!",NA,NA,NA,"San Marcos Pass","United States","California","Convergent Lady Beetles; Coast Live Oak","Hippodamia convergens; Quercus agrifolia","Hippodamia convergens; Quercus agrifolia",NA,"2006-12-10"
"6c10b_6c0-043.jpg","12/10/06","Slugs have teeth? This <b>Pacific Banana Slug</b> (<i>Ariolimax columbianus</i> or kin) is sucking on a fallen plant stem in the woods. It sure looks like this hand-size terrestrial mollusk can extrude dentures as well as eye stalks! (San Marcos Pass, 10 December 2006) <P>We had an inch of rain last night and more today. This is what the rain brings!",NA,NA,NA,"San Marcos Pass","United States","California","Pacific Banana Slug","Ariolimax columbianus","Ariolimax columbianus",NA,"2006-12-10"
"6c10c_6c0-032.jpg","12/10/06","An inch of rain last night, and already there are mushrooms in the woods. I have to find my books and relearn the mushrooms every year. Maybe this is <i>Collybia</i>? I love the curves of the mushroom and oak leaves. (San Marcos Pass, 10 December 2006)",NA,NA,NA,"San Marcos Pass","United States","California",NA,"Collybia","Collybia",NA,"2006-12-10"
"6c11a_6c10-009.jpg","12/11/06","A circus tent of spider webs and raindrops on the top leaves of the native <b>Greenbark Ceanothus</b> (<i>Ceanothus spinosus</i>) just outside the upstairs bathroom window. It's a great view while sitting on ""the throne"". The perfect morning light only lasted a few minutes. No time to remove the screen, so I took this photo through the window glass. (San Marcos Pass, 10 December 2006)",NA,NA,NA,"San Marcos Pass","United States","California","Greenbark Ceanothus","Ceanothus spinosus","Ceanothus spinosus",NA,"2006-12-11"
"6c11b_6c10-00.jpg","12/11/06","Dying leaf of native <b>California Blackberry</b> (<i>Rubus ursinus</i>) in the woods, with raindrops. The bright red fungus looks like a line of advancing wildfire leaving a wasteland behind. That's pretty close to the truth! (San Marcos Pass, 10 December 2006)",NA,NA,NA,"San Marcos Pass","United States","California","California Blackberry","Rubus ursinus","Rubus ursinus",NA,"2006-12-11"
"6c12a_6c12-063.jpg","12/12/06","Sleepytime for hummers... <P>This little male <b>Anna's Hummingbird</b> (<i>Calypte anna</i>) is asleep on his favorite perch in the <b>Coast Live Oak</b> (<i>Quercus agrifolia</i>) tree above the garden. The sun is setting, but it's still dusk. I used ""Slow Flash"" turned down a stop and my 500 mm telephoto with an exposure of 1/15 second @ f/6.3 @ ISO 800. (San Marcos Pass, 12 December 2006)",NA,NA,NA,"San Marcos Pass","United States","California","Anna's Hummingbird; Coast Live Oak","Calypte anna; Quercus agrifolia","Calypte anna; Quercus agrifolia",NA,"2006-12-12"
"6c12b_6c12-058.jpg","12/12/06","Mushrooms have legs! Not really, but this strange <b>Earthstar</b> (<i>Astreus hygrometricus</i> or kin) fungus growing under <b>Coast Live Oak</b> (<i>Quercus agrifolia</i>) appears in the woods suddenly, like it crept in on starfish-like feet from somewhere else. It's a double-skinned puffball mushroom. The thick outer skin opens like a star and curves down to lift the inner thin-skined spore sack to expose the spores to the elements. The thin membrane and spores soon disappear, but the thick rinds persist in the woods for months, like washed-up shells on the beach. (Santa Ynez Valley, 12 December 2006) <P>I had some time after school today, but the sun was already too low. It's fun trying long exposures in the shade when there's no other choice. This exposure is 2.5 seconds @ F/22 @ ISO 200.",NA,NA,NA,"Santa Ynez Valley","United States","California","Earthstar; Coast Live Oak","Astreus hygrometricus; Quercus agrifolia","Astreus hygrometricus; Quercus agrifolia",NA,"2006-12-12"
"6c13a_6c10-030.jpg","12/13/06","Late berries of native <b>California Honeysuckle</b> (<i>Lonicera hispidula</i>) in the <b>Honeysuckle</b> (<i>Caprifoliaceae</i>) family. The vines in the woods mostly finished making their berries two months ago, all eaten by birds now. This one plant still has a glow of life. The old flowers look ancient, carved from stone. (San Marcos Pass, 10 December 2006)",NA,NA,NA,"San Marcos Pass","United States","California","California Honeysuckle; Honeysuckle","Lonicera hispidula",NA,"Caprifoliaceae","2006-12-13"
"6c13b_6c10-034.jpg","12/13/06","New mushroom and fallen oak leaf in the woods after our first real winter rain. (San Marcos Pass, 10 December 2006) <P>I show the mushroom at: <BR>&nbsp;&nbsp; http://www.fotolog.com/treebeard/?pid=17463479",NA,NA,NA,"San Marcos Pass","United States","California",NA,NA,NA,NA,"2006-12-13"
"6c14a_6c14-135.jpg","12/14/06","My after-school Hike Club kids - I recognize each of you by silhouette - on the rocks near Lizard's Mouth on top of the mountains as the sun goes down. There's ocean and at least one Channel Island in the background. It's a perfect moment to remember. (San Marcos Pass, 14 December 2006)",NA,NA,NA,"San Marcos Pass","United States","California",NA,NA,NA,NA,"2006-12-14"
"6c14b_6c14-071.jpg","12/14/06","Very dead mouse shot against the sky today at school using a stack of chairs as my tripod. We teachers expect the usual Christmas gifts, but not perfect dead mice! Thanks Mark, it really is perfect. (Santa Ynez Valley, 14 December 2006)",NA,NA,NA,"Santa Ynez Valley","United States","California",NA,NA,NA,NA,"2006-12-14"
"6c15a_6c10-023.jpg","12/15/06","Like a battlefield map... Deciduous trees drop their leaves all at once, but evergreen trees like this <b>Coast Live Oak</b> (<i>Quercus agrifolia</i> in the <i>Fagaceae</i> family) still drop old leaves one by one over the year. The tree absorbs what nutrients it can, and fungi take care of the rest. In time the husk of the leaf will fall to enrich the soil for more new life. So it goes. (San Marcos Pass, 10 December 2006)",NA,NA,NA,"San Marcos Pass","United States","California","Coast Live Oak","Quercus agrifolia",NA,"Fagaceae","2006-12-15"
"6c15b_6c15-151.jpg","12/15/06","<b>Inky Cap</b> (<i>Coprinus atramentarius</i> or kin) mushrooms at the base of a <b>Willow</b> (genus <i>Salix</i> in the <i>Salicaceae</i> family) tree at school. Clumps of these mushrooms have been coming up under this tree for years. These mushrooms literally digest themselves or ""<i>deliquesce</i>"" into a black inky mess. They are said to be edible, but I'm not tempted. (Santa Ynez Valley, 15 December 2006) <P>Maybe it's coincidence, but this willow tree with the mushrooms is not healthy. Several large branches died last spring, and we discovered a crack in the trunk. We campaigned to keep the tree as a school symbol and a good home for cavity-nesting birds. After major pruning, it's still here.",NA,NA,NA,"Santa Ynez Valley","United States","California","Inky Cap; Willow","Coprinus atramentarius; Salix; Salicaceae; deliquesce","Coprinus atramentarius; Salix; Salicaceae; deliquesce","Salicaceae","2006-12-15"
"6c16a_6c16-031.jpg","12/16/06","<b>Convergent Lady Beetles</b> - aka ""ladybugs"" - (<i>Hippodamia convergens</i> in the family <i>Coccinellidae</i>, order <i>Coleoptera</i>) converging on a spike of a native grass near the creek. I believe the grass is <b>Blue Wildrye</b> (<i>Elymus glaucus</i>). The ladybugs aren't picky about their roost - I also found them today on oaks, blackberries, mugwort, canyon sunflowers and just about everything near the creek. See my [Previous] photo. (San Marcos Pass, 16 December 2006) <P>We had a huge convergence of these ladybugs in September. Then they disappeared. Now they're converging again for winter. I saw a few last week, and many more today. I guess they come together to mate, then depart to lay eggs, then come together again now to snuggle through the cold winter. Sounds good!",NA,NA,NA,"San Marcos Pass","United States","California","Convergent Lady Beetles; Blue Wildrye","Hippodamia convergens; Coccinellidae; Coleoptera; Elymus glaucus","Hippodamia convergens; Coccinellidae; Coleoptera; Elymus glaucus","Coccinellidae","2006-12-16"
"6c16b_6c16-025.jpg","12/16/06","A breaking wave of <b>Convergent Lady Beetles</b> - aka ""ladybugs"" - (<i>Hippodamia convergens</i> in the family <i>Coccinellidae</i>, order <i>Coleoptera</i>) crowding under a leaf of native <b>California Blackberry</b> (<i>Rubus ursinus</i>) in the canyon today. There's a storm coming tonight. Maybe the ladybugs know, and this is shelter. See my [Next] photo. (San Marcos Pass, 16 December 2006)",NA,NA,NA,"San Marcos Pass","United States","California","Convergent Lady Beetles; California Blackberry","Hippodamia convergens; Coccinellidae; Coleoptera; Rubus ursinus","Hippodamia convergens; Coccinellidae; Coleoptera; Rubus ursinus","Coccinellidae","2006-12-16"
"6c16c_6c16-014.jpg","12/16/06","I lifted this pretty yellow mushroom from the ground in the woods today - the <b>Wolf Spider</b> (family <i>Lycosidae</i>) came up with it. These spiders hunt their prey without webs. At first I thought the mushroom was a delicious ""<b>Man on Horseback</b>"" (<i>Tricholoma flavovirens</i>), but the rusty spore-stained fibers on the stem prove that it is a <i>Cortinarius</i> mushroom - the first I've seen this winter. There are too many Cortinarius species - I won't try to guess. (San Marcos Pass, 16 December 2006)",NA,NA,NA,"San Marcos Pass","United States","California","Wolf Spider; Man on Horseback","Lycosidae; Tricholoma flavovirens; Cortinarius","Lycosidae; Tricholoma flavovirens; Cortinarius","Lycosidae","2006-12-16"
"6c16d_6c16-040.jpg","12/16/06","Tiny dark-stemmed ""<b>Horsehair Fungi</b>"" (<i>Marasmius androsaceus</i> or kin) mushrooms sprouting from the tip of a fallen <b>Coast Live Oak</b> (<i>Quercus agrifolia</i>) leaf in the woods. They look like long-legged surfers riding the nose of this oak leaf! These little 'shrooms have a connection with lichens - they have a remarkable ability to dry out and revive again after new rain. (San Marcos Pass, 16 December 2006) <P>It's been overcast and drizzly all day, with a storm moving in tonight. Today's photos are all long exposures with tripod, mostly using the self-timer to steady the camera. This photo is 1/8 second @ f/22 @ ISO 400.",NA,NA,NA,"San Marcos Pass","United States","California","Horsehair Fungi; Coast Live Oak","Marasmius androsaceus; Quercus agrifolia","Marasmius androsaceus; Quercus agrifolia",NA,"2006-12-16"
"6c16e_6c16-043.jpg","12/16/06","This looks like a strange monochrome flower with in-turned petals, but it's really a strange mushroom with an up-turned cap. This is a tiny pencil eraser-size <b>Inky Cap</b> (<i>Coprinus</i> sp.) mushroom growing under the <b>California Blackberry</b> (<i>Rubus ursinus</i>) in the woods. The margins of the cap look sugar-coated with spores. (San Marcos Pass, 16 December 2006) <P>There really are strange monochrome flowers - see my photo at: <BR>&nbsp;&nbsp; http://www.fotolog.com/treebeard/?pid=15015682",NA,NA,NA,"San Marcos Pass","United States","California","Inky Cap; California Blackberry","Coprinus; Rubus ursinus","Coprinus; Rubus ursinus",NA,"2006-12-16"
"6c16f_6c16-002.jpg","12/16/06","I was looking for tiny mushrooms in the fallen leaves when I found this belly-up male <b>Snowy Tree Cricket</b> (<i>Oecanthus</i> sp. in order <i>Orthoptera</i>, family <i>Gryllidae</i>). Maybe it's too cold, or there's no food in the woods, or he's just used up his time. This may be the last of the summer insects, but there are new mushrooms in the woods. Life goes on. (San Marcos Pass, 16 December 2006)",NA,NA,NA,"San Marcos Pass","United States","California","Snowy Tree Cricket","Oecanthus; Orthoptera; Gryllidae","Oecanthus; Orthoptera; Gryllidae","Gryllidae","2006-12-16"
"6c17a_6c17-054.jpg","12/17/06","Acrobatic male <b>Townsend's Warbler</b> (<i>Dendroica townsendi</i>) bird in the <b>Coast Live Oak</b> (<i>Quercus agrifolia</i>) tree close to our upstairs porch. He appears to have a snack in his beak. A mixed flock of these warblers, kinglets, and a titmouse or two came through the woods today on the wind following our expected storm that never happened. I've seen these mixed flocks of songbirds before - I don't see them every day - I wonder how this works. It's windy today after our faux storm. Maybe the birds follow the storms to get an easier ride as they migrate south? (San Marcos Pass, 17 December 2006)",NA,NA,NA,"San Marcos Pass","United States","California","Townsend's Warbler; Coast Live Oak","Dendroica townsendi; Quercus agrifolia","Dendroica townsendi; Quercus agrifolia",NA,"2006-12-17"
"6c17b_6c17-049.jpg","12/17/06","Beautiful male <b>Townsend's Warbler</b> (<i>Dendroica townsendi</i>) bird looking at me as I look at him from our upstairs porch. What remarkable colors! See my [Next] photo. (San Marcos Pass, 17 December 2006)",NA,NA,NA,"San Marcos Pass","United States","California","Townsend's Warbler","Dendroica townsendi","Dendroica townsendi",NA,"2006-12-17"
"6c17c_6c17-073.jpg","12/17/06","It takes a moment to realize what's wrong with this photo! This is a little <b>Ruby-crowned Kinglet</b> (<i>Regulus calendula</i>) bird in the <b>Coast Live Oak</b> (<i>Quercus agrifolia</i>) tree near our upstairs porch. These birds are such acrobats. I get neck pains just looking at this photo! (San Marcos Pass, 17 December 2006)",NA,NA,NA,"San Marcos Pass","United States","California","Ruby-crowned Kinglet; Coast Live Oak","Regulus calendula; Quercus agrifolia","Regulus calendula; Quercus agrifolia",NA,"2006-12-17"
"6c17d_6c17-084.jpg","12/17/06","Little <b>Ruby-crowned Kinglet</b> (<i>Regulus calendula</i>) bird - not much larger than a hummingbird - in the <b>Coast Live Oak</b> (<i>Quercus agrifolia</i>) tree near our upstairs porch. They look like flycatchers, but they have a different characteristic behaviour as they flutter under the oak leaves looking for breakfast. The variable pitch of their feathers while hovering is amazing! (San Marcos Pass, 17 December 2006) <P>Sure it's a lucky shot - but I took 150 photos of the birds today, kept 30, and I'm posting 5. It's that kind of luck.",NA,NA,NA,"San Marcos Pass","United States","California","Ruby-crowned Kinglet; Coast Live Oak","Regulus calendula; Quercus agrifolia","Regulus calendula; Quercus agrifolia",NA,"2006-12-17"
"6c17e_6c17-078.jpg","12/17/06","A mixed flock of busy warblers and kinglets came through the woods today - see my [Next] photos. I've seen this pattern before. There's almost always a shy <b>Oak Titmouse</b> (<i>Baeolophus inoratus</i>) - aka ""Plain Titmouse"" - like this flying with the flock. (San Marcos Pass, 17 December 2006) <P>This Titmouse has his crest down flat. Compare my photo at: <BR>&nbsp;&nbsp; http://www.fotolog.com/treebeard/?pid=17251962",NA,NA,NA,"San Marcos Pass","United States","California","Oak Titmouse","Baeolophus inoratus","Baeolophus inoratus",NA,"2006-12-17"
"6c17f_6c16-029.jpg","12/17/06","I can't resist one more photo of the <b>Convergent Lady Beetles</b> - aka ""ladybugs"" - (<i>Hippodamia convergens</i> in the family <i>Coccinellidae</i>, order <i>Coleoptera</i>) covering this spike of native <b>Blue Wildrye</b> (<i>Elymus glaucus</i>) grass near the creek. Se my [Previous] two photos. (San Marcos Pass, 16 December 2006)",NA,NA,NA,"San Marcos Pass","United States","California","Convergent Lady Beetles; Blue Wildrye","Hippodamia convergens; Coccinellidae; Coleoptera; Elymus glaucus","Hippodamia convergens; Coccinellidae; Coleoptera; Elymus glaucus","Coccinellidae","2006-12-17"
"6c18a_6c18-101.jpg","12/18/06","<b>Monarch Butterflies</b> (<i>Danaus plexippus</i>, order <i>Lepidoptera</i>) - 1 of 6 <P>This is a hanging solstice banner of Monarch butterflies - strange fruit in the Eucalyptus trees - at the Ellwood Butterfly Grove near the beach. All Monarch butterflies west of the Rocky Mountains fly to California for winter and this is a favorite stop. Eastern Monarchs head for Cuba or Mexico. I first saw the butterflies almost 40 years ago in the same trees. This Eucalyptus grove is now protected, and I stayed behind the rope barrier, though I wanted to get closer for photos. I used my 500 mm telephoto lens for all of today's photos. (Ellwood Mesa, 18 December 2006) <P>This butterfly grove is more than half surrounded by houses just a few hundred meters away. These winter butterflies are so vulnerable to habitat loss, but this grove is now protected as a reserve. Find your special places and find a way to protect them! <P>The irony is that the butterflies roost in the introduced <b>Blue Gum</b> (<i>Eucalyptus globulus</i> or kin) trees - not native, but doing well here after 100+ years. It's an eco-quandry - remove the alien trees or disturb the native butterflies? I think the message is that we can't put it back together again - we have to make do with what we have and not lose more.",NA,NA,NA,"<i>Eucalyptus globulus</i> or kin) trees - not native","United States","California","Monarch Butterflies; Blue Gum","Danaus plexippus; Lepidoptera; Eucalyptus globulus","Danaus plexippus; Lepidoptera; Eucalyptus globulus",NA,"2006-12-18"
"6c18b_6c18-124.jpg","12/18/06","<b>Monarch Butterflies</b> (<i>Danaus plexippus</i>, order <i>Lepidoptera</i>) - 2 of 6 <P>Look close - these are Monarch butterflies hanging down, not leaves. The butterflies look almost gray in the shade until they open their wings - just like old leaves. (Ellwood Mesa, 18 December 2006)",NA,NA,NA,"Ellwood Mesa","United States","California","Monarch Butterflies","Danaus plexippus; Lepidoptera","Danaus plexippus; Lepidoptera",NA,"2006-12-18"
"6c18c_6c18-094.jpg","12/18/06","<b>Monarch Butterflies</b> (<i>Danaus plexippus</i>, order <i>Lepidoptera</i>) - 3 of 6 <P>One Monarch butterfly is distinctive, but en masse they become some else, almost a single organism with many parts, a kind of cryptic camouflage to confuse preditors, like zebra stripes in the grass. (Ellwood Mesa, 18 December 2006)",NA,NA,NA,"Ellwood Mesa","United States","California","Monarch Butterflies","Danaus plexippus; Lepidoptera","Danaus plexippus; Lepidoptera",NA,"2006-12-18"
"6c18d_6c18-095.jpg","12/18/06","<b>Monarch Butterflies</b> (<i>Danaus plexippus</i>, order <i>Lepidoptera</i>) - 4 of 6 <P>A hanging solstice banner of Monarch butterflies - strange fruit in the Eucalyptus trees - at the Ellwood Butterfly Grove where western monarch butterflies converge for winter. (Ellwood Mesa, 18 December 2006)",NA,NA,NA,"Ellwood Mesa","United States","California","Monarch Butterflies","Danaus plexippus; Lepidoptera","Danaus plexippus; Lepidoptera",NA,"2006-12-18"
"6c18e_6c18-126.jpg","12/18/06","<b>Monarch Butterflies</b> (<i>Danaus plexippus</i>, order <i>Lepidoptera</i>) - 5 of 6 <P>Like looking out of a hobbit hole lined with butterflies. (Ellwood Mesa, 18 December 2006)",NA,NA,NA,"Ellwood Mesa","United States","California","Monarch Butterflies","Danaus plexippus; Lepidoptera","Danaus plexippus; Lepidoptera",NA,"2006-12-18"
