"File.Name","Date","Notes","Latitude","Longitude","Accuracy","Locality","Country","State","CommonNames","ScientificName","associatedTaxa","Families","Date_YYYYMMDD"
"3826f_3810-074.jpg","8/26/03","I`ve been chasing this male <b>California Dogface</b> (</i>Colias eurydice</i>) butterflies through our woods and garden for weeks trying to get a shot with his wings open. He`s a strong flier and I`m convinced he`s teasing me. <P>I haven`t seen him for a while, so this might be the best shot I`ll get, fuzzy as it is. It`s our California State Butterfly for good reason, with wonderful iridescence on the upper wings. I have more sharp photos (with wings folded) <A HREF=""http://www.fotolog.net/treebeard/?photo_id=604432"">here</A>, <A HREF=""http://www.fotolog.net/treebeard/?photo_id=604379"">here</A>, and <A HREF=""http://www.fotolog.net/bugsncritters/?photo_id=573283"">here</A>. (San Marcos Pass, 10 August 2003)",NA,NA,NA,"San Marcos Pass","United States","California","California Dogface",NA,NA,NA,"2003-08-26"
"3827a_3826-276.jpg","8/27/03","Not every acorn becomes a mighty oak, as shown by this <b>Scrub Oak</b> (<i>Quercus berberidifolia</i> aka <i>Q. dumosa</i>) near home. One acorn became insect food, probably a weevil grub, you can see the exit hole. The others never developed. Interesting thought now that jury duty is done and school is just around the corner. I have another photo of fat happy acorns <A HREF=""http://www.fotolog.net/treebeard/?photo_id=637483"">here</A>! (San Marcos Pass, 26 August 2003)",NA,NA,NA,"San Marcos Pass","United States","California","Scrub Oak","Quercus berberidifolia; Q. dumosa","Quercus berberidifolia; Q. dumosa",NA,"2003-08-27"
"3827b_3826-272.jpg","8/27/03","Elegant seed pods of <b>Bush Poppy</b> (<i>Dendromecon rigida</i>) still show the female stigma lobes at the tip. I have a photo of the flower with the start of a seed pod <A HREF=""http://www.fotolog.net/treebeard/?photo_id=395137"">here</A>. (San Marcos Pass, 26 August 2003)",NA,NA,NA,"San Marcos Pass","United States","California","Bush Poppy","Dendromecon rigida","Dendromecon rigida",NA,"2003-08-27"
"3827c_3826-265.jpg","8/27/03","<b>Harding Grass</b> (<i>Phalaris aquatica</i>) is an introduced grass that is spreading along roads and into the woodland in our mountains. It`s invasive, but it sure is pretty with the sun behind it. There`s a rumor that it has mind-altering properties. Really, see <A HREF=""http://leda.lycaeum.org/?ID=806"">here</A>. I figure if enough people harvest it, maybe it will go away! (San Marcos Pass, 26 August 2003)",NA,NA,NA,"San Marcos Pass","United States","California","Harding Grass","Phalaris aquatica","Phalaris aquatica",NA,"2003-08-27"
"3827d_3827-304.jpg","8/27/03","This pretty little moth was trying to hide in a basket of tomatoes and chilies from the garden. (San Marcos Pass, 27 August 2003)",NA,NA,NA,"San Marcos Pass","United States","California",NA,NA,NA,NA,"2003-08-27"
"3827e_3826-287.jpg","8/27/03","The planet Mars at closest approach to Earth, 27 August 2003 at 1:30 AM PDT, full telephoto on a tripod, F2.6 @ 16 seconds. It`s still just a (over-exposed) red dot, so I enlarged the 30x30 pixel planet to 500x500 pixels. Kind of pretty. I also pasted the original size image in the upper right corner for comparison. I used a <A HREF=""http://www.mediachance.com/digicam/blackframe.htm"">Black Frame Noise Reduction</A> tool to despeckle the image. (See my <A HREF=""http://www.fotolog.net/treebeard/?photo_id=791827"">previous image</A>.) <P>I`m sure I can do better. Mars will be nearly as close for the next month at least, so there`s plenty of time to try again! (San Marcos Pass, 27 August 2003)",NA,NA,NA,"San Marcos Pass","United States","California",NA,NA,NA,NA,"2003-08-27"
"3827f_3826-291.jpg","8/27/03","I did my duty as a science teacher last night and went out at 1:30 AM PDT to get a photo of Mars at closest approach. (See this <A HREF=""http://science.nasa.gov/headlines/y2003/25aug_closeencounter.htm?list95455"">NASA page</A>.) My method was brute force: set my Olympus 2040Z digital camera up on a tripod at full telephoto and take the longest manual exposure possible, F2.6 @ 16 seconds. <P>The problem is that digital photo sensors fire off +/- random pixels over time. Astronomers use elaborate schemes to keep their cameras VERY COLD. Another way is to put your hand over the lens and take a ""black frame"" shot and then <i>subtract</i> it from your image using a program like the free <A HREF=""http://www.mediachance.com/digicam/blackframe.htm"">MediaChance BlackFrame NR</A> utility. This works because the hot pixels aren`t quite random, they will most likely be in the same place during a short period at the same temperature. (I have three hot pixels that show up in <i>every</i> photo.) <P>This is a 500x500 pixel section of my 16 second ""black frame"" exposure with the lens covered. Looks pretty busy for <i>nothing</i>! (San Marcos Pass, 27 August 2003)",NA,NA,NA,"San Marcos Pass","United States","California",NA,"subtract; every; nothing","subtract; every; nothing",NA,"2003-08-27"
"3829a_3829-491.jpg","8/29/03","I had another encounter today with a <b>Snowberry Clearwing Moth</b> (<i>Hemaris diffinis</i>), also called a Bumblebee or Hummingbird Moth for good reasons. He`s hovering and sucking at the <b>Butterfly Bush</b> (<i>Buddleia davidii</i>) flowers in our garden. What control! I have more photos of these amazing creatures <A HREF=""http://www.fotolog.net/bugsncritters/?photo_id=823160"">here</A>, <A HREF=""http://www.fotolog.net/treebeard/?photo_id=603967"">here</A>, and <A HREF=""http://www.fotolog.net/bugsncritters/?photo_id=592237"">here</A>. (San Marcos Pass, 29 August 2003)",NA,NA,NA,"San Marcos Pass","United States","California","Snowberry Clearwing Moth; Butterfly Bush","Hemaris diffinis; Buddleia davidii","Hemaris diffinis; Buddleia davidii",NA,"2003-08-29"
"3829b_3829-486.jpg","8/29/03","<b>American Painted Lady</b> (<i>Vanessa virginiensis</i>) working the <b>Butterfly Bush</b> (<i>Buddleia davidii</i>) flowers in our garden. Notice how her <i>proboscis</i> is neatly coiled up between the horns or <i>labial palps</i> on her face. Compare <A HREF=""http://www.fotolog.net/treebeard/?photo_id=769219"">this photo</A>. (San Marcos Pass, 29 August 2003)",NA,NA,NA,"San Marcos Pass","United States","California","American Painted Lady; Butterfly Bush","Vanessa virginiensis; Buddleia davidii; proboscis; labial palps","Vanessa virginiensis; Buddleia davidii; proboscis; labial palps",NA,"2003-08-29"
"3829c_3829-479.jpg","8/29/03","<b>American Painted Lady</b> (<i>Vanessa virginiensis</i>) <i>and</i> <b>Painted Gentleman</b> butterflies! They are working the <b>Butterfly Bush</b> (<i>Buddleia davidii</i>) flowers in our garden. Note the red and orange color difference. They were getting frisky together, so I figure they are related. (San Marcos Pass, 29 August 2003)",NA,NA,NA,"San Marcos Pass","United States","California","American Painted Lady; Painted Gentleman; Butterfly Bush","Vanessa virginiensis; and; Buddleia davidii","Vanessa virginiensis; and; Buddleia davidii",NA,"2003-08-29"
"3829d_3829-443.jpg","8/29/03","Pretty little butterfly, maybe a <b>Common Hairstreak</b> (<i>Strymon melinus puducus</i>), feeding on <b>Scale Broom</b> (<i>Lepidospartum squamatum</i>). Follow that wandering tongue crossing its front leg! The late-flowering composite shrubs on the dry river wash are <i>full</i> of insects right now. (Santa Ynez River, 29 August 2003)",NA,NA,NA,"Santa Ynez River","United States","California","Common Hairstreak; Scale Broom","Strymon melinus puducus; Lepidospartum squamatum; full","Strymon melinus puducus; Lepidospartum squamatum; full",NA,"2003-08-29"
"3829e_3829-368.jpg","8/29/03","Some kind of <b>Pond Damselfly</b> (<i>Coenagrionidae</i>) resting on a flower of <b>Scale Broom</b> (<i>Lepidospartum squamatum</i>). (Santa Ynez River, 29 August 2003)",NA,NA,NA,"Santa Ynez River","United States","California","Pond Damselfly; Scale Broom","Coenagrionidae; Lepidospartum squamatum","Coenagrionidae; Lepidospartum squamatum","Coenagrionidae","2003-08-29"
"3829f_3829-331.jpg","8/29/03","Tiny wasp on a flower of <b>Hairy Goldenaster</b> (<i>Heterotheca sessiliflora</i> ssp. <i>echioides</i> aka <i>Chrysopsis villosa</i>) growing on the dry river bed of the Santa Ynez River. The river is just a trickle now with a few great spring-fed swimming holes. It`s like a desert on the flood plain away from the pools, but these late-summer composites keep the insects in nectar. (Santa Ynez River, 29 August 2003)",NA,NA,NA,"Santa Ynez River","United States","California","Hairy Goldenaster","Heterotheca sessiliflora; echioides; Chrysopsis villosa","Heterotheca sessiliflora; echioides; Chrysopsis villosa",NA,"2003-08-29"
"3829g_3829-489.jpg","8/29/03","<b>Snowberry Clearwing Moth</b> (<i>Hemaris diffinis</i>) hovering and sucking at the <b>Butterfly Bush</b> (<i>Buddleia davidii</i>) flowers in our garden. This photo is looking through its fast-beating clear wings! It`s a strange kind of <b>Sphinx Moth</b> (<i>Sphingidae</i>) that mimics a bumblebee and hovers like a hummingbird to suck nectar from flowers. This beauty breaks all the usual moth rules with clear wings and daytime habit. I have another new photo here. (San Marcos Pass, 29 August 2003)",NA,NA,NA,"San Marcos Pass","United States","California","Snowberry Clearwing Moth; Butterfly Bush; Sphinx Moth","Hemaris diffinis; Buddleia davidii; Sphingidae","Hemaris diffinis; Buddleia davidii; Sphingidae","Sphingidae","2003-08-29"
"3830a_3829-398.jpg","8/30/03","Twisted flower bud of <b>Toloache</b> (<i>Datura wrightii</i>). I`m surprised how yellow this is. The large white flowers open at night. (Santa Ynez River, 29 August 2003)",NA,NA,NA,"Santa Ynez River","United States","California","Toloache","Datura wrightii","Datura wrightii",NA,"2003-08-30"
"3830b_3829-387.jpg","8/30/03","<b>California Wild Rose</b> (<i>Rosa californica</A>) with just a bit of extra sunlight coming into the shade. (Santa Ynez River, 29 August 2003)",NA,NA,NA,"Santa Ynez River","United States","California","California Wild Rose",NA,NA,NA,"2003-08-30"
"3830c_3829-409.jpg","8/30/03","I found this <b>Croton</b> (<i>Croton californicus</i>) in the dry woodland near White Rock in the upper Santa Ynez River valley. Usually it grows on stabilized dunes near the ocean to the north, so this was a surprise. This species is <i>dioecious</i> with separate male and female plants. This one is male with stamens. (Santa Ynez River, 29 August 2003)",NA,NA,NA,"Santa Ynez River","United States","California","Croton","Croton californicus; dioecious","Croton californicus; dioecious",NA,"2003-08-30"
"3830d_3829-434.jpg","8/30/03","Not a remarkable photo, but it is remarkable that this <b>Great Basin Sagebrush</b> (<i>Artemisia tridentata</i> ssp. <i>tridentata</i>) is growing in the woodland on a dry river flat near Santa Barbara instead of the interior desert. It`s not common here. The few plants I`ve found look very different from their desert kin, softer and whiter, with no trunk. (Santa Ynez River, 29 August 2003)",NA,NA,NA,"Santa Ynez River","United States","California","Great Basin Sagebrush","Artemisia tridentata; tridentata","Artemisia tridentata; tridentata",NA,"2003-08-30"
"3830e_3829-357.jpg","8/30/03","Seed head of native <b>California Thistle</b> (<i>Cirsium occidentale</i> var. <i>californicum</i>). I have a photo of the flower <A HREF=""http://www.fotolog.net/treebeard/?photo_id=282809"">here</A>. (Santa Ynez River, 29 August 2003)",NA,NA,NA,"Santa Ynez River","United States","California","California Thistle","Cirsium occidentale; californicum","Cirsium occidentale; californicum",NA,"2003-08-30"
"3830f_3829-346.jpg","8/30/03","You have to know California sages to appreciate this photo. This is a natural hybrid between <b>White Sage</b> (<i>Salvia apiana</i>) and <b>Purple Sage</b> (<i>Salvia leucophylla</i>). It has the usual leaves of the former and seed heads in balls like the latter. Both parents were growing nearby. There`s a stumper here: if the plants can cross, then why do the separate species still exist? (Santa Ynez River, 29 August 2003)",NA,NA,NA,"Santa Ynez River","United States","California","White Sage; Purple Sage","Salvia apiana; Salvia leucophylla","Salvia apiana; Salvia leucophylla",NA,"2003-08-30"
"3831a_3829-497.jpg","8/31/03","The first seeds escaping from the pod on the <b>Milkweed</b> in our garden. It`s a good image to begin a new <A HREF=""http://members.impulse.net/~dunn/"">school year</A>! Meetings tomorrow (laboring on Labor Day), first day of school on Tuesday, a school camping trip to Big Sur on Wednesday. Not bad! I`ll get back here next weekend. (San Marcos Pass, 30 August 2003)",NA,NA,NA,"San Marcos Pass","United States","California","Milkweed",NA,NA,NA,"2003-08-31"
"3831b_3829-320.jpg","8/31/03","Pretty <b>Willow</b> roots (maybe <i>Salix Lasiolepis</i>?) growing into a pool at the river. These roots can grow into your spring box and pipes and <A HREF=""http://www.rain.org/~mkummel/stumpers/12apr02.html"">stop your water supply</A>! (Santa Ynez River, 29 August 2003)",NA,NA,NA,"Santa Ynez River","United States","California","Willow","Salix Lasiolepis","Salix Lasiolepis",NA,"2003-08-31"
"3831c_3829-373.jpg","8/31/03","<b>Cocklebur</b> (<i>Xanthium strumarium</i>) is a ""native weed"" with typical composite flowers (above) and seed pods with remarkable hooked spines (below). It`s said to be the original inspiration for <i>velcro</i>. Sometimes it`s easier to throw away socks than to untangle them. Dogs are a bigger problem! This is near the river, but it also grows along roads up in the mountains. (Santa Ynez River, 29 August 2003)",NA,NA,NA,"Santa Ynez River","United States","California","Cocklebur","Xanthium strumarium; velcro","Xanthium strumarium; velcro",NA,"2003-08-31"
"3831d_3829-448.jpg","8/31/03","The old rule is that <b>Sedges</b> (maybe <i>Cyperus eragrostis</i>?) have edges on leaves and stems. You can see them in this photo. (Santa Ynez River, 29 August 2003)",NA,NA,NA,"Santa Ynez River","United States","California","Sedges","Cyperus eragrostis","Cyperus eragrostis",NA,"2003-08-31"
"3831e_3829-339.jpg","8/31/03","We have native <b>Tarragon</b> (<i>Artemisia dracunculus</i>) growing in California, but it doesn`t have much taste, even when dried. This is a <i>foliose insect gall</i> on a flowering plant. It`s not in my <A HREF=""http://www.amazon.com/exec/obidos/tg/detail/-/091028671X/""> gall book</A>, but it might be from a <b>Gall Midge</b> (<i>Cecidomiidae</i>). Insect galls are fascinating and not well-known. (Santa Ynez River, 29 August 2003)",NA,NA,NA,"Santa Ynez River","United States","California","Tarragon; Gall Midge","Artemisia dracunculus; foliose insect gall; Cecidomiidae","Artemisia dracunculus; foliose insect gall; Cecidomiidae","Cecidomiidae","2003-08-31"
"3831f_3829-459.jpg","8/31/03","New gourds on <b>Calabazilla</b> (<i>Cucurbita foetidissima</i>). The species name tells how it smells and tastes. The orange-size gourds were used by Chumash native Americans for soap, tools, and rattles. It`s not common. This plant/colony near Paradise Camp is <i>huge</i>, covering 1/2 acre or more. I wonder if it goes back to the old days. (Santa Ynez River, 29 August 2003)",NA,NA,NA,"Santa Ynez River","United States","California","Calabazilla","Cucurbita foetidissima; huge","Cucurbita foetidissima; huge",NA,"2003-08-31"
"3901a_3901-024.jpg","9/1/03","Kissing? Naw, that`s the wrong end. This pair of <b>Monarch Butterfly</b> (<i>Danaus plexippus</i>) caterpillars were stripping the same leaf of <b>Milkweed</b> in our garden early this morning - at the <i>bottom</i> of the leaf. It`s interesting how the hind colors look opposite. I was up early for a day of <A HREF=""http://members.impulse.net/~dunn/"">school</A> planning and cleanup. The first real day of school is Tuesday, and we have a three-day camping trip to Big Sur on Wednesday. Not bad! I`ll get back here next weekend. (San Marcos Pass, 1 September 2003)",NA,NA,NA,"San Marcos Pass","United States","California","Monarch Butterfly; Milkweed","Danaus plexippus; bottom","Danaus plexippus; bottom",NA,"2003-09-01"
"3901b_3901-029.jpg","9/1/03","<b>Monarch Butterfly</b> (<i>Danaus plexippus</i>) caterpillar stripping the <b>Milkweed</b> in our garden. That`s the head end on the right with the longer horns and short feet. No problem. Gardens are for butterflies too, and these milkweeds are already <A HREF=""http://www.fotolog.net/treebeard/?photo_id=844578"">making seeds</A>! (San Marcos Pass, 1 September 2003)",NA,NA,NA,"San Marcos Pass","United States","California","Monarch Butterfly; Milkweed","Danaus plexippus","Danaus plexippus",NA,"2003-09-01"
"3901c_3901-026.jpg","9/1/03","We have babies! This <b>Monarch Butterfly</b> (<i>Danaus plexippus</i>) caterpillar left a ""package"" on a leaf of the <b>Milkweed</b> in our garden that he`s stripping. Scat, frass, or (*your_own_name*) it`s no problem. Gardens are for butterflies too! (San Marcos Pass, 1 September 2003)",NA,NA,NA,"San Marcos Pass","United States","California","Monarch Butterfly; Milkweed","Danaus plexippus","Danaus plexippus",NA,"2003-09-01"
"3901d_3901-032.jpg","9/1/03","The back side of this <b>Crab Spider</b> (<i>Thomisidae</i>) waiting on a <b>Black-Eyed Susan</b> (<i>Rudbeckia hirta</i>?) flower in our garden has a gnarly face to scare away preditors. Pretty cool adaptation! (San Marcos Pass, 1 September 2003)",NA,NA,NA,"San Marcos Pass","United States","California","Crab Spider; Black-Eyed Susan","Thomisidae; Rudbeckia hirta","Thomisidae; Rudbeckia hirta","Thomisidae","2003-09-01"
"3901e_3901-037.jpg","9/1/03","The business side of a perfectly camouflaged <b>Crab Spider</b> (<i>Thomisidae</i>) waiting on a <b>Black-Eyed Susan</b> (<i>Rudbeckia hirta</i>?) flower in our garden. I waited a long time for some action, but no luck for either of us. (San Marcos Pass, 1 September 2003)",NA,NA,NA,"San Marcos Pass","United States","California","Crab Spider; Black-Eyed Susan","Thomisidae; Rudbeckia hirta","Thomisidae; Rudbeckia hirta","Thomisidae","2003-09-01"
"3906a_3904-346.jpg","9/6/03","<b>Seaside Daisy</b> (<i>Erigeron glaucus</i>) on the bluff at Sand Dollar Beach. We had our first week of <A HREF=""http://members.impulse.net/~dunn/"">Dunn Middle School</A> at this perfect beach and the Plaskett Creek Campground just across the road. I`m starting a new <A HREF=""http://www.fotolog.net/dms"">DMS fotolog</A>. I was pretty busy taking pictures as a teacher, but I did find some time to be a naturalist as well. The species are similar to home, but the <i>mix</i> is very different! (Big Sur, 4 September 2003)",NA,NA,NA,"Big Sur","United States","California","Seaside Daisy","Erigeron glaucus; mix","Erigeron glaucus; mix",NA,"2003-09-06"
"3906b_3905-459.jpg","9/6/03","Leaves of <b>Red Flowering Currant</b> (<i>Ribes sanguineum</i> var. <i>glutinosum</i>) starting to show fall colors. (Big Sur, 5 September 2003)",NA,NA,NA,"Big Sur","United States","California","Red Flowering Currant","Ribes sanguineum; glutinosum","Ribes sanguineum; glutinosum",NA,"2003-09-06"
"3906c_3904-357.jpg","9/6/03","Ripe berries of <b>Red Flowering Currant</b> (<i>Ribes sanguineum</i> var. <i>glutinosum</i>). They don`t taste very good. (Big Sur, 4 September 2003)",NA,NA,NA,"Big Sur","United States","California","Red Flowering Currant","Ribes sanguineum; glutinosum","Ribes sanguineum; glutinosum",NA,"2003-09-06"
"3906d_3904-361.jpg","9/6/03","New foliage of a young <b>Redwood</b> (<i>Sequoia sempervirens</i>) tree near our campsite at Plaskett Creek. (Big Sur, 4 September 2003)",NA,NA,NA,"Big Sur","United States","California","Redwood","Sequoia sempervirens","Sequoia sempervirens",NA,"2003-09-06"
"3906e_3905-423.jpg","9/6/03","Flowers of <b>Common Aster</b> (<i>Aster chilensis</i>) still wet with morning dew. (Big Sur, 5 September 2003)",NA,NA,NA,"Big Sur","United States","California","Common Aster","Aster chilensis","Aster chilensis",NA,"2003-09-06"
"3906f_3904-261.jpg","9/6/03","Green cone on <b>Monterey Pine</b> (<i>Pinus radiata</i>). The brown scars have fantastic shapes like rabbits or flying dragons. (Big Sur, 4 September 2003)",NA,NA,NA,"Big Sur","United States","California","Monterey Pine","Pinus radiata","Pinus radiata",NA,"2003-09-06"
"3906h_3904-292.jpg","9/6/03","We found this <b>Garter Snake</b> (<i>Thamnophis sirtalis</i>?) on the sand at Sand Dollar Beach near a wet seep on the bluff. I was careful because of his triangular head and aggressive behavior as he hissed and tried to strike. (Big Sur, 4 September 2003)",NA,NA,NA,"Big Sur","United States","California","Garter Snake","Thamnophis sirtalis","Thamnophis sirtalis",NA,"2003-09-06"
"3907a_3904-377.jpg","9/7/03","Watching the Sun set into the ocean framed by <b>Monterey Pine</b> (<i>Pinus radiata</i>) trees. This is a <i>closed-cone pine</i>. The cones (in principle) stay closed on the tree until toasted by fire to open and release their seeds. Look close on the branch to the right of the sun to see a line of old cones. I have a closer photo of a pine cone <A HREF=""http://www.fotolog.net/treebeard/?photo_id=924842"">here</A>. (Big Sur, 4 September 2003)",NA,NA,NA,"Big Sur","United States","California","Monterey Pine","Pinus radiata; closed-cone pine","Pinus radiata; closed-cone pine",NA,"2003-09-07"
"3907b_3903-232.jpg","9/7/03","Huge feathery plumes of <b>Pampas Grass</b> (<i>Cortaderia jubata</i> or a close relative). This seems to be a terrible invasive weed on the Big Sur coast, especially on disturbed slide areas along the highway. There`s more info <A HREF=""http://ucce.ucdavis.edu/datastore/detailreport.cfm?usernumber=33&surveynumber=182"">here</A> and <A HREF=""http://www.ventanawild.org/news/fe99/pampas.html"">here</A>. Despite all the problems, this non-native invader is <i>still</i> sold in local nurseries. That`s not right. (Big Sur, 3 September 2003)",NA,NA,NA,"Big Sur","United States","California","Pampas Grass","Cortaderia jubata; still","Cortaderia jubata; still",NA,"2003-09-07"
"3907c_3904-296.jpg","9/7/03","<b>Common Monkey Flower</b> (<i>Mimulus guttatus</i>) growing on a wet seep on the bluff at Sand Dollar Beach. The ruffled calyces look like little cookie cutters! (Big Sur, 4 September 2003)",NA,NA,NA,"Big Sur","United States","California","Common Monkey Flower","Mimulus guttatus","Mimulus guttatus",NA,"2003-09-07"
"3907d_3905-429.jpg","9/7/03","<b>Coastal Sagebrush</b> (<i>Artemisia californica</i>) is another one of those <i>composites</i> with flowers that don`t look like flowers at first. They have small heads of <i>disk flowers</i> without the usual petal-like <i>ray flowers</i>. These aromatic shrubs have herbal uses. (Big Sur, 5 September 2003)",NA,NA,NA,"Big Sur","United States","California","Coastal Sagebrush","Artemisia californica; composites; disk flowers; ray flowers","Artemisia californica; composites; disk flowers; ray flowers",NA,"2003-09-07"
"3907e_3905-432.jpg","9/7/03","Flowers and twisted buds of <b>Coastal Morning-Glory</b> (<i>Calystegia macrostegia</i> ssp. <i>cyclostegia</i>?). These flowers have much stronger color than our Santa Barbara plants. (Big Sur, 5 September 2003)",NA,NA,NA,"Big Sur","United States","California","Coastal Morning-Glory","Calystegia macrostegia; cyclostegia","Calystegia macrostegia; cyclostegia",NA,"2003-09-07"
"3907f_3904-354.jpg","9/7/03","Small wasp on <b>Golden Yarrow</b> (<i>Eriophyllum confertiflorum</i>). (Big Sur, 4 September 2003)",NA,NA,NA,"Big Sur","United States","California","Golden Yarrow","Eriophyllum confertiflorum","Eriophyllum confertiflorum",NA,"2003-09-07"
"3908a_3907-028.jpg","9/8/03","Beautiful old leaf on a <b>Madrone</b> (<i>Arbutus menziesii</i>) tree at the end of the season. These evergreen trees develop their new leaves at the same time as they drop the old ones. New flowers are scarce in our summer-dry woods now, waiting for rain, but the old tattered leaves are so rich with character and beauty. Do you know the remarkable portraits in <A HREF=""http://www.fotolog.net/mashuga"">Mashuga`s Fotolog</A>? (San Marcos Pass, 7 September 2003)",NA,NA,NA,"San Marcos Pass","United States","California","Madrone","Arbutus menziesii","Arbutus menziesii",NA,"2003-09-08"
"3908b_3907-051.jpg","9/8/03","Old leaf of <b>Canyon Sunflower</b> (<i>Venegasia carpesioides</i>) Starting to show color at the end of the season. (San Marcos Pass, 7 September 2003)",NA,NA,NA,"San Marcos Pass","United States","California","Canyon Sunflower","Venegasia carpesioides","Venegasia carpesioides",NA,"2003-09-08"
"3908c_3907-021.jpg","9/8/03","Pretty leaves of <b>Poison Oak</b> (<i>Toxicodendron diversilobum</i>) at the end of the season. I reckon every leaf tells a story, but this one has already lost a full chapter of its trilogy. (San Marcos Pass, 7 September 2003)",NA,NA,NA,"San Marcos Pass","United States","California","Poison Oak","Toxicodendron diversilobum","Toxicodendron diversilobum",NA,"2003-09-08"
"3908d_3907-016.jpg","9/8/03","Leaves of <b>California Honeysuckle</b> (<i>Lonicera hispidula</i> var. <i>vacillans</i>) turning a deep color at the end of the season. (San Marcos Pass, 7 September 2003)",NA,NA,NA,"San Marcos Pass","United States","California","California Honeysuckle","Lonicera hispidula; vacillans","Lonicera hispidula; vacillans",NA,"2003-09-08"
"3908e_3907-050.jpg","9/8/03","Leaf of <b>Western Sycamore</b> (<i>Platanus racemosa</i>) at the end of the season, but still looking good. (San Marcos Pass, 7 September 2003)",NA,NA,NA,"San Marcos Pass","United States","California","Western Sycamore","Platanus racemosa","Platanus racemosa",NA,"2003-09-08"
